Indicator ID,Indicator name,Source dataset,Units,Dataset summary,More Info,Terms of Use,HDX Methodology,2050,2049,2048,2047,2046,2045,2044,2043,2042,2041,2040,2039,2038,2037,2036,2035,2034,2033,2032,2031,2030,2029,2028,2027,2026,2025,2024,2023,2022,2021,2020,2019,2018,2017,2016,2015,2014,2013,2012,2011,2010,2009,2008,2007,2006,2005,2004,2003,2002,2001,2000,1999,1998,1997,1996,1995,1994,1993,1992,1991,1990,1989,1988,1987,1986,1985,1984,1983,1982,1981,1980,1979,1978,1977,1976,1975,1974,1973,1972,1971,1970,1969,1968,1967,1966,1965,1964,1963,1962,1961,1960,1959,1958,1957,1956,1955,1954,1953,1952,1951,1950
CH100,Total cost of damage done by disasters,emdat,US$,Total cost of damage done by disasters,http://www.emdat.be/explanatory-notes,"The EM-DAT database is protected by the law of June 30th, 1994 on copyrights and the law of August 31st, 1998 on the legal protection of databases. Access to the EM-DAT database is made available free of charge by the UCL. The reproduction and communication of the information from EM-DAT is authorized by any means and in all forms, provided that the source is clearly mentioned and as follows:
 
“EM-DAT: The OFDA/CRED International Disaster Database – www.emdat.be – Université catholique de Louvain – Brussels – Belgium.”

","Several institutions have developed methodologies to quantify these losses in their specific domain. However, there is no standard procedure to determine a global figure for economic impact. Estimated damage are given (000’) US$.",,,,,,,,,,,,,,,,,,,,,,,,,,,,,,,,,,,,,,0.0,0.0,0.0,0.0,0.0,0.0,0.0,0.0,20000.0,1.0E8,0.0,0.0,0.0,0.0,0.0,0.0,0.0,0.0,0.0,0.0,,0.0,0.0,,0.0,0.0,0.0,0.0,0.0,,0.0,,0.0,0.0,,,0.0,,,,0.0,,,,0.0,,,,0.0,0.0,,,0.0,,,,,,,,,,,
CH070,Number of disasters,emdat,Disasters,Total number of disasters,http://www.emdat.be/explanatory-notes,"The EM-DAT database is protected by the law of June 30th, 1994 on copyrights and the law of August 31st, 1998 on the legal protection of databases. Access to the EM-DAT database is made available free of charge by the UCL. The reproduction and communication of the information from EM-DAT is authorized by any means and in all forms, provided that the source is clearly mentioned and as follows:
 
“EM-DAT: The OFDA/CRED International Disaster Database – www.emdat.be – Université catholique de Louvain – Brussels – Belgium.”

",For a disaster to be entered into the database at least one of the following criteria must be fulfilled: Ten (10) or more people reported killed. Hundred (100) or more people reported affected. Declaration of a state of emergency. Call for international assistance.,,,,,,,,,,,,,,,,,,,,,,,,,,,,,,,,,,,,,,1.0,4.0,1.0,3.0,2.0,3.0,5.0,11.0,9.0,5.0,2.0,5.0,5.0,7.0,3.0,2.0,4.0,2.0,1.0,3.0,,1.0,1.0,,3.0,1.0,2.0,1.0,2.0,,1.0,,1.0,1.0,,,2.0,,,,1.0,,,,1.0,,,,1.0,1.0,,,1.0,,,,,,,,,,,
CH090,People affected by disasters,emdat,People,Total number of people affected by disasters,http://www.emdat.be/explanatory-notes,"The EM-DAT database is protected by the law of June 30th, 1994 on copyrights and the law of August 31st, 1998 on the legal protection of databases. Access to the EM-DAT database is made available free of charge by the UCL. The reproduction and communication of the information from EM-DAT is authorized by any means and in all forms, provided that the source is clearly mentioned and as follows:
 
“EM-DAT: The OFDA/CRED International Disaster Database – www.emdat.be – Université catholique de Louvain – Brussels – Belgium.”

",People requiring immediate assistance during a period of emergency; it can also include displaced or evacuated people.,,,,,,,,,,,,,,,,,,,,,,,,,,,,,,,,,,,,,,50000.0,3012205.0,2800.0,4016000.0,1753.0,3352663.0,43687.0,492376.0,5199.0,304813.0,300.0,1191.0,6611.0,155990.0,1200175.0,14564.0,1003044.0,5657.0,8500.0,17000.0,,0.0,0.0,,50000.0,53500.0,500000.0,7093.0,4815.0,,0.0,,30000.0,0.0,,,42671.0,,,,230000.0,,,,0.0,,,,0.0,700000.0,,,0.0,,,,,,,,,,,
CH080,People killed in disasters,emdat,People,Total number of people killed in disasters,http://www.emdat.be/explanatory-notes,"The EM-DAT database is protected by the law of June 30th, 1994 on copyrights and the law of August 31st, 1998 on the legal protection of databases. Access to the EM-DAT database is made available free of charge by the UCL. The reproduction and communication of the information from EM-DAT is authorized by any means and in all forms, provided that the source is clearly mentioned and as follows:
 
“EM-DAT: The OFDA/CRED International Disaster Database – www.emdat.be – Université catholique de Louvain – Brussels – Belgium.”

",Persons confirmed as dead and persons missing and presumed dead (official figures when available).,,,,,,,,,,,,,,,,,,,,,,,,,,,,,,,,,,,,,,7.0,86.0,0.0,11.0,15.0,13.0,1180.0,258.0,227.0,416.0,1.0,194.0,163.0,688.0,48.0,481.0,2811.0,250.0,20.0,230.0,,50.0,130.0,,64.0,0.0,600.0,1307.0,1262.0,,0.0,,5.0,0.0,,,0.0,,,,19000.0,,,,0.0,,,,0.0,50.0,,,200.0,,,,,,,,,,,
PVE030,Expected Years of Schooling (of children),data.undp.org,Years,Expected years of schooling,https://data.undp.org/dataset/Expected-Years-of-Schooling-of-children-years-/qnam-f624,"The information in the various pages of the UNDP Web site is issued by the United Nations Development Programme for general distribution. The information presented is protected under the Berne Convention for the Protection of Literature and Artistic works, under other international conventions and under national laws on copyright and neighboring rights. Extracts of the information in the Web site may be reviewed, reproduced or translated for research or private study but not for sale or for use in conjunction with commercial purposes. Any use of information in the Web site should be accompanied by an acknowledgment of UNDP as the source, citing the uniform resource locator (URL) of the article. Reproduction or translation of substantial portions of the Web site, or any use other than for educational or other non-commercial purposes, require explicit, prior authorization in writing. Applications and enquiries should be addressed to the programme responsible for the page used.",Number of years of schooling that a child of school entrance age can expect to receive if prevailing patterns of age-specific enrollment rates persist throughout the child’s life.,,,,,,,,,,,,,,,,,,,,,,,,,,,,,,,,,,,,,,,2.4,2.4,2.4,2.4,2.4,2.4,,2.4,,,,,2.4,,,,,,,,,,2.3,,,,,,,,,,2.3,,,,,,,,,,,,,,,,,,,,,,,,,,,,,,
PSP080,"Population density by major area, region and country, 1950-2010",esa-unpd-wpp2012,People per square km,Population per square Kilometer.,http://esa.un.org/wpp/Excel-Data/population.htm,"The United Nations maintains this web site (the “Site”) as a courtesy to those who may choose to access the Site (“Users”). The information presented herein is for informative purposes only. The United Nations grants permission to Users to visit the Site and to download and copy the information, documents and materials (collectively, “Materials”) from the Site for the User’s personal, non-commercial use, without any right to resell or redistribute them or to compile or create derivative works therefrom, subject to the terms and conditions outlined below, and also subject to more specific restrictions that may apply to specific Material within this Site.","For information about the method of calculation, please visit http://unstats.un.org/unsd/demographic/standmeth/default.htm",,,,,,,,,,,,,,,,,,,,,,,,,,,,,,,,,,,,,,,,,15.112,14.711,14.334,13.974,13.624,13.278,12.938,12.605,12.273,11.933,11.582,11.211,10.829,10.465,10.164,9.953,9.847,9.832,9.871,9.911,9.914,9.857,9.75,9.627,9.539,9.517,9.587,9.723,9.835,9.804,9.55,9.031,8.295,7.456,6.68,6.086,5.716,5.53,5.474,5.454,5.403,5.309,5.193,5.061,4.931,4.814,4.708,4.606,4.509,4.414,4.323,4.234,4.148,4.065,3.985,3.907,3.832,3.759,3.688,3.619,3.551
PSP070,"Median age by major area, region and country, 1950-2010",esa-unpd-wpp2012,Years,"Median age by major area, region and country",http://esa.un.org/wpp/Excel-Data/population.htm,"The United Nations maintains this web site (the “Site”) as a courtesy to those who may choose to access the Site (“Users”). The information presented herein is for informative purposes only. The United Nations grants permission to Users to visit the Site and to download and copy the information, documents and materials (collectively, “Materials”) from the Site for the User’s personal, non-commercial use, without any right to resell or redistribute them or to compile or create derivative works therefrom, subject to the terms and conditions outlined below, and also subject to more specific restrictions that may apply to specific Material within this Site.","Age that divides the population in two parts of equal size, that is, there are as many persons with ages above the median as there are with ages below the median. It is expressed as years.",,,,,,,,,,,,,,,,,,,,,,,,,,,,,,,,,,,,,,,,,16.1,,,,,16.125,,,,,16.42,,,,,17.072,,,,,17.543,,,,,17.895,,,,,18.082,,,,,18.193,,,,,18.298,,,,,18.506,,,,,18.889,,,,,19.158,,,,,19.546
PSP100,"Percentage of Population Residing in Urban Areas by Major Area, Region and Country, 1950-2050",esa-unpd-wup2011,Percentage,"Percentage of Population Residing in Urban Areas by Major Area, Region and Country, 1950-2050",http://esa.un.org/wpp/Excel-Data/population.htm,"The United Nations maintains this web site (the “Site”) as a courtesy to those who may choose to access the Site (“Users”). The information presented herein is for informative purposes only. The United Nations grants permission to Users to visit the Site and to download and copy the information, documents and materials (collectively, “Materials”) from the Site for the User’s personal, non-commercial use, without any right to resell or redistribute them or to compile or create derivative works therefrom, subject to the terms and conditions outlined below, and also subject to more specific restrictions that may apply to specific Material within this Site.",For information about the method of calculation please visit http://esa.un.org/wpp/Excel-Data/population.htm,59.757,,,,,56.869,,,,,53.933,,,,,50.97,,,,,48.0,,,,,45.045,,,,,42.232,,,,,39.646,,,,,37.289,,,,,35.16,,,,,33.247,,,,,31.425,,,,,29.658,,,,,28.067,,,,,26.763,,,,,25.498,,,,,22.678,,,,,19.964,,,,,17.312,,,,,14.873,,,,,12.726
PSP060,Population growth ,world-bank,Percentage,Population growth (annual %),http://data.worldbank.org/indicator/SP.POP.GROW,"You are free to copy, distribute, adapt, display or include the data in other products for commercial and noncommercial purposes at no cost subject to certain limitations summarized below.
You must include attribution for the data you use in the manner indicated in the metadata included with the data.
You must not claim or imply that The World Bank endorses your use of the data by or use The World Bank’s logo(s) or trademark(s) in conjunction with such use.
Other parties may have ownership interests in some of the materials contained on The World Bank Web site. For example, we maintain a list of some specific data within the Datasets that you may not redistribute or reuse without first contacting the original content provider, as well as information regarding how to contact the original content provider. Before incorporating any data in other products, please check the list: Terms of use: Restricted Data
The World Bank makes no warranties with respect to the data and you agree The World Bank shall not be liable to you in connection with your use of the data.
This is only a summary of the Terms of Use for Datasets Listed in The World Bank Data Catalogue. Please read the actual agreement that controls your use of the Datasets, which is available here: Terms of use for datasets. Also see World Bank Terms and Conditions.","Population growth (annual %) is the exponential rate of growth of midyear population from year t-1 to t, expressed as a percentage. Derived from total population. Population source: (1) United Nations Population Division. World Population Prospects, (2) United Nations Statistical Division. Population and Vital Statistics Report (various years), (3) Census reports and other statistical publications from national statistical offices, (4) Eurostat: Demographic Statistics, (5) Secretariat of the Pacific Community: Statistics and Demography Programme, and (6) U.S. Census Bureau: International Database.",,,,,,,,,,,,,,,,,,,,,,,,,,,,,,,,,,,,,,2.90439543538353,2.85778261273734,2.78086834114166,2.68532344492135,2.59820816050482,2.54189744608379,2.53648534336112,2.57359620634576,2.59599741736256,2.60652388180184,2.67019065732767,2.8075228755778,2.98593389699709,3.25286033235776,3.4736040713578,3.41350037227362,2.92273772042431,2.09861940605444,1.06974679716735,0.154078458745026,-0.394372641113147,-0.404549692076025,-0.0329716944789596,0.573632037958015,1.08976781265827,1.26940016994846,0.919425572353509,0.235335897462226,-0.735977523333004,-1.40373523082377,-1.15253934937917,0.316339417447941,2.62582565403118,5.58428924133703,8.51186199403984,10.662074607756,10.9833999853446,9.3102453251379,6.28423199283992,3.29254034881446,1.03272740905065,0.365306096096518,0.928738604725535,1.75696096852379,2.21924205511914,2.56549505212957,2.60553523986985,2.40399024056028,2.21972174938336,2.18251410386056,2.14780229613153,2.11835515606161,2.09314196044841,2.06990447470995,,,,,,,,,,
PSP090,Population density ,world-bank,People per square km,Population density,http://data.worldbank.org/indicator/EN.POP.DNST,"You are free to copy, distribute, adapt, display or include the data in other products for commercial and noncommercial purposes at no cost subject to certain limitations summarized below.
You must include attribution for the data you use in the manner indicated in the metadata included with the data.
You must not claim or imply that The World Bank endorses your use of the data by or use The World Bank’s logo(s) or trademark(s) in conjunction with such use.
Other parties may have ownership interests in some of the materials contained on The World Bank Web site. For example, we maintain a list of some specific data within the Datasets that you may not redistribute or reuse without first contacting the original content provider, as well as information regarding how to contact the original content provider. Before incorporating any data in other products, please check the list: Terms of use: Restricted Data
The World Bank makes no warranties with respect to the data and you agree The World Bank shall not be liable to you in connection with your use of the data.
This is only a summary of the Terms of Use for Datasets Listed in The World Bank Data Catalogue. Please read the actual agreement that controls your use of the Datasets, which is available here: Terms of use for datasets. Also see World Bank Terms and Conditions.","Population density is midyear population divided by land area in square kilometers. Population is based on the de facto definition of population, which counts all residents regardless of legal status or citizenship--except for refugees not permanently settled in the country of asylum, who are generally considered part of the population of their country of origin. Land area is a country's total area, excluding area under inland water bodies, national claims to continental shelf, and exclusive economic zones. In most cases the definition of inland water bodies includes major rivers and lakes. Food and Agriculture Organization and World Bank population estimates.",,,,,,,,,,,,,,,,,,,,,,,,,,,,,,,,,,,,,,16.7302945771033,16.2513692734402,15.7935138840182,15.3603675837664,14.9533809417541,14.5698648260911,14.2041811457902,13.8484250964389,13.4965696432557,13.1507077501833,12.8123601236969,12.4747728504479,12.1294114834061,11.7725890266841,11.3958045079223,11.0067555073804,10.6373800490962,10.3309768227755,10.116428093219,10.0087847100456,9.99337520323907,10.0328641565977,10.0735342876271,10.0768562501993,10.0192176491217,9.91062422290943,9.78561386170179,9.69605477093761,9.67326330219658,9.7447189721682,9.88247361877132,9.99703191251953,9.96545732776485,9.7071874900373,9.17996780055472,8.43091306149775,7.5782653744381,6.78999585551694,6.18636624477955,5.8095641916664,5.62139669078968,5.56364172538018,5.5433544808238,5.49210954187522,5.39645806101954,5.27801670545478,5.14433162240571,5.01202537698855,4.89297350718908,4.78555966461568,4.68224567220327,4.58275257436159,4.48669461536009,,,,,,,,,,,
PSP110,Population in urban agglomerations of more than 1 million,world-bank,Percentage,Population in urban agglomerations of more than 1 million,http://esa.un.org/wpp/Excel-Data/population.htm,"You are free to copy, distribute, adapt, display or include the data in other products for commercial and noncommercial purposes at no cost subject to certain limitations summarized below.
You must include attribution for the data you use in the manner indicated in the metadata included with the data.
You must not claim or imply that The World Bank endorses your use of the data by or use The World Bank’s logo(s) or trademark(s) in conjunction with such use.
Other parties may have ownership interests in some of the materials contained on The World Bank Web site. For example, we maintain a list of some specific data within the Datasets that you may not redistribute or reuse without first contacting the original content provider, as well as information regarding how to contact the original content provider. Before incorporating any data in other products, please check the list: Terms of use: Restricted Data
The World Bank makes no warranties with respect to the data and you agree The World Bank shall not be liable to you in connection with your use of the data.
This is only a summary of the Terms of Use for Datasets Listed in The World Bank Data Catalogue. Please read the actual agreement that controls your use of the Datasets, which is available here: Terms of use for datasets. Also see World Bank Terms and Conditions.",Population in urban agglomerations of more than one million is the percentage of a country's population living in metropolitan areas that in 2000 had a population of more than one million people.,,,,,,,,,,,,,,,,,,,,,,,,,,,,,,,,,,,,,2013926.0,1847296.0,1694454.0,1554257.0,1425660.0,1307703.0,1199648.0,1100260.0,1470995.0,1415108.0,1361416.0,1309622.0,1259866.0,1212000.0,1200865.0,1189802.0,1178855.0,1168010.0,1157279.0,1146617.0,1136068.0,1125616.0,1115275.0,1105000.0,1035248.0,969899.0,908756.0,851315.0,797577.0,747230.0,700125.0,648176.0,600127.0,574977.0,550966.0,527895.0,505820.0,484668.0,464428.0,444981.0,407863.0,363185.0,323453.0,287975.0,256430.0,228340.0,203359.0,181054.0,161221.0,143560.0,127855.0,116398.0,108361.0,100879.0,93923.0,,,,,,,,,,
PSP010,"Total population (both sexes combined) by major area, region and country, annually for 1950-2010",esa-unpd-wpp2012,People,Total Population - Both Sexes.,http://esa.un.org/wpp/Excel-Data/population.htm,"The United Nations maintains this web site (the “Site”) as a courtesy to those who may choose to access the Site (“Users”). The information presented herein is for informative purposes only. The United Nations grants permission to Users to visit the Site and to download and copy the information, documents and materials (collectively, “Materials”) from the Site for the User’s personal, non-commercial use, without any right to resell or redistribute them or to compile or create derivative works therefrom, subject to the terms and conditions outlined below, and also subject to more specific restrictions that may apply to specific Material within this Site.","Total Population - Both Sexes. De facto population in a country, area or region as of 1 July of the year indicated. Figures are presented in thousands.",,,,,,,,,,,,,,,,,,,,,,,,,,,,,,,,,,,,,,,,,9636173.0,9380854.0,9140259.0,8910851.0,8687671.0,8466938.0,8249965.0,8037706.0,7825924.0,7609265.0,7385416.0,7149044.0,6904978.0,6673254.0,6481035.0,6346440.0,6278911.0,6269244.0,6294017.0,6319531.0,6321615.0,6285456.0,6217331.0,6138907.0,6082723.0,6068425.0,6113252.0,6199671.0,6271538.0,6251730.0,6089707.0,5758961.0,5289049.0,4754149.0,4259636.0,3880955.0,3644572.0,3526527.0,3490295.0,3477568.0,3445420.0,3385414.0,3311111.0,3227245.0,3144244.0,3069558.0,3002173.0,2937360.0,2874944.0,2814683.0,2756380.0,2699912.0,2645219.0,2592278.0,2541067.0,2491530.0,2443576.0,2397067.0,2351811.0,2307576.0,2264081.0
PSE140,"Age dependency ratio, old ",world-bank,Percentage,"Age dependency ratio, old, is the ratio of older dependents (people older than 64) to the working-age population (those ages 15-64).",http://data.worldbank.org/indicator/SP.POP.DPND.OL,"You are free to copy, distribute, adapt, display or include the data in other products for commercial and noncommercial purposes at no cost subject to certain limitations summarized below.
You must include attribution for the data you use in the manner indicated in the metadata included with the data.
You must not claim or imply that The World Bank endorses your use of the data by or use The World Bank’s logo(s) or trademark(s) in conjunction with such use.
Other parties may have ownership interests in some of the materials contained on The World Bank Web site. For example, we maintain a list of some specific data within the Datasets that you may not redistribute or reuse without first contacting the original content provider, as well as information regarding how to contact the original content provider. Before incorporating any data in other products, please check the list: Terms of use: Restricted Data
The World Bank makes no warranties with respect to the data and you agree The World Bank shall not be liable to you in connection with your use of the data.
This is only a summary of the Terms of Use for Datasets Listed in The World Bank Data Catalogue. Please read the actual agreement that controls your use of the Datasets, which is available here: Terms of use for datasets. Also see World Bank Terms and Conditions.","Age dependency ratio, old, is the ratio of older dependents (people older than 64) to the working-age population (those ages 15-64). Data are shown as the proportion of dependents per 100 working-age population. World Bank staff estimates from various sources including census reports, the United Nations Population Division's World Population Prospects, national statistical offices, household surveys conducted by national agencies, and ICF International.",,,,,,,,,,,,,,,,,,,,,,,,,,,,,,,,,,,,,,5.65406957347309,5.64768229334269,5.67288443059496,5.70299728948983,5.73946283565216,5.7817514260753,5.82499771309932,5.862401224386,5.88873949716516,5.90099464388571,5.90056321010662,5.89207298099848,5.88382803435254,5.88219649765743,5.88932466351583,5.90429503227333,5.92734565574528,5.9572238518447,5.99230565136641,6.03228821532929,6.07609184423879,6.11931483666018,6.15760595454615,6.18826114182892,6.2106173488409,6.22551409805788,6.23408850067293,6.23825514175533,6.23935342709308,6.23757641762959,6.23268977139508,6.22564668626135,6.21716689293001,6.20713589623219,6.19502607644529,6.17981490584992,6.15953047315394,6.13349769506513,6.10216504701625,6.0678740557243,6.03335592499568,6.00050542093462,5.96848718813597,5.93521141122703,5.89948350160331,5.86135169292347,5.82036366027079,5.77624646515985,5.72929320767169,5.67978160618166,5.6272543576379,5.57011383274572,5.50712425360367,5.43729901180596,,,,,,,,,,
