Indicator ID,Indicator name,Source dataset,Units,Dataset summary,More Info,Terms of Use,HDX Methodology,2050,2049,2048,2047,2046,2045,2044,2043,2042,2041,2040,2039,2038,2037,2036,2035,2034,2033,2032,2031,2030,2029,2028,2027,2026,2025,2024,2023,2022,2021,2020,2019,2018,2017,2016,2015,2014,2013,2012,2011,2010,2009,2008,2007,2006,2005,2004,2003,2002,2001,2000,1999,1998,1997,1996,1995,1994,1993,1992,1991,1990,1989,1988,1987,1986,1985,1984,1983,1982,1981,1980,1979,1978,1977,1976,1975,1974,1973,1972,1971,1970,1969,1968,1967,1966,1965,1964,1963,1962,1961,1960,1959,1958,1957,1956,1955,1954,1953,1952,1951,1950
PSE150,"Age dependency ratio, young ",world-bank,Percentage,"Age dependency ratio, young, is the ratio of younger dependents (people younger than 15) to the working-age population(those ages 15-64).",http://data.worldbank.org/indicator/SP.POP.DPND.YG,"You are free to copy, distribute, adapt, display or include the data in other products for commercial and noncommercial purposes at no cost subject to certain limitations summarized below.
You must include attribution for the data you use in the manner indicated in the metadata included with the data.
You must not claim or imply that The World Bank endorses your use of the data by or use The World Bank’s logo(s) or trademark(s) in conjunction with such use.
Other parties may have ownership interests in some of the materials contained on The World Bank Web site. For example, we maintain a list of some specific data within the Datasets that you may not redistribute or reuse without first contacting the original content provider, as well as information regarding how to contact the original content provider. Before incorporating any data in other products, please check the list: Terms of use: Restricted Data
The World Bank makes no warranties with respect to the data and you agree The World Bank shall not be liable to you in connection with your use of the data.
This is only a summary of the Terms of Use for Datasets Listed in The World Bank Data Catalogue. Please read the actual agreement that controls your use of the Datasets, which is available here: Terms of use for datasets. Also see World Bank Terms and Conditions.","Age dependency ratio, young, is the ratio of younger dependents (people younger than 15) to the working-age population(those ages 15-64). Data are shown as the proportion of dependents per 100 working-age population. World Bank staff estimates from various sources including census reports, the United Nations Population Division's World Population Prospects, national statistical offices, household surveys conducted by national agencies, and ICF International.",,,,,,,,,,,,,,,,,,,,,,,,,,,,,,,,,,,,,,94.4374965445849,95.0098438001576,95.7778887471499,96.3778147101537,96.7640790365848,96.9430676626959,96.9434946664015,96.8255786553685,96.6377533483374,96.3960557538076,96.0857752004608,95.691764703458,95.1850580553307,94.544415400581,93.7571561181529,92.8351369133999,91.8184151074003,90.782428247788,89.8044944374857,88.9424196598527,88.209907552689,87.5862540159033,87.0145654067768,86.4461180528786,85.8652723705682,85.282600305374,84.708724501555,84.175029261386,83.714131887601,83.3374680669355,83.0401585091833,82.8146349418113,82.6396201917529,82.4919706061437,82.3581854893234,82.2290023582049,82.0909735982222,81.9362512544577,81.7670365843328,81.5938647760642,81.4258262568273,81.2680378132121,81.1120023369124,80.9443508503204,80.7532121260238,80.5368266093961,80.2973619664806,80.0446195078852,79.7871028803301,79.5336613353487,79.2764652931216,78.990308937912,78.6384265471429,78.1963743345363,,,,,,,,,,
PCX140,Percentage of population with access to electricity,world-bank,Percentage,Percentage of population with access to electricity.,http://data.worldbank.org/indicator/EG.ELC.ACCS.ZS,"You are free to copy, distribute, adapt, display or include the data in other products for commercial and noncommercial purposes at no cost subject to certain limitations summarized below.
You must include attribution for the data you use in the manner indicated in the metadata included with the data.
You must not claim or imply that The World Bank endorses your use of the data by or use The World Bank’s logo(s) or trademark(s) in conjunction with such use.
Other parties may have ownership interests in some of the materials contained on The World Bank Web site. For example, we maintain a list of some specific data within the Datasets that you may not redistribute or reuse without first contacting the original content provider, as well as information regarding how to contact the original content provider. Before incorporating any data in other products, please check the list: Terms of use: Restricted Data
The World Bank makes no warranties with respect to the data and you agree The World Bank shall not be liable to you in connection with your use of the data.
This is only a summary of the Terms of Use for Datasets Listed in The World Bank Data Catalogue. Please read the actual agreement that controls your use of the Datasets, which is available here: Terms of use for datasets. Also see World Bank Terms and Conditions.","Access to electricity is the percentage of population with access to electricity. Electrification data are collected from industry, national surveys and international sources.",,,,,,,,,,,,,,,,,,,,,,,,,,,,,,,,,,,,,,,,,29.14539,,,,,,,,,,25.9093,,,,,,,,,,22.23787,,,,,,,,,,,,,,,,,,,,,,,,,,,,,,,,,,,,,,,,
PSE120,GNI (current US$),world-bank,Current International US$,Gross national income in current dollars,http://data.worldbank.org/indicator/NY.GNP.MKTP.CD,"You are free to copy, distribute, adapt, display or include the data in other products for commercial and noncommercial purposes at no cost subject to certain limitations summarized below.
You must include attribution for the data you use in the manner indicated in the metadata included with the data.
You must not claim or imply that The World Bank endorses your use of the data by or use The World Bank’s logo(s) or trademark(s) in conjunction with such use.
Other parties may have ownership interests in some of the materials contained on The World Bank Web site. For example, we maintain a list of some specific data within the Datasets that you may not redistribute or reuse without first contacting the original content provider, as well as information regarding how to contact the original content provider. Before incorporating any data in other products, please check the list: Terms of use: Restricted Data
The World Bank makes no warranties with respect to the data and you agree The World Bank shall not be liable to you in connection with your use of the data.
This is only a summary of the Terms of Use for Datasets Listed in The World Bank Data Catalogue. Please read the actual agreement that controls your use of the Datasets, which is available here: Terms of use for datasets. Also see World Bank Terms and Conditions.",GNI (formerly GNP) is the sum of value added by all resident producers plus any product taxes (less subsidies) not included in the valuation of output plus net receipts of primary income (compensation of employees and property income) from abroad. Data are in current U.S. dollars.,,,,,,,,,,,,,,,,,,,,,,,,,,,,,,,,,,,,,,,,,,,,,,,,,,,,,,,,,,,,,8.3494809560293E8,1.01483331781831E9,9.77731090081983E8,9.57837202830203E8,8.73161529605778E8,8.27405804208425E8,7.44326958428779E8,7.27809219629046E8,7.62206602464832E8,6.94610023210703E8,6.02724027560837E8,5.92585314936483E8,5.6395023219309E8,4.97536364137859E8,8.08498986865198E8,7.11151561833747E8,4.69658285650185E8,5.0863633047052E8,4.17313606947587E8,3.30697930872455E8,3.16441880749177E8,2.99431882920196E8,2.85922036042634E8,2.71375750530326E8,2.56577760796435E8,2.4352990925823E8,2.29237007677433E8,2.16147149952901E8,2.03336953207247E8,1.91366850444027E8,1.80180823451015E8,,,,,,,,,,
PVE120,Combined gross enrolment in education (both sexes),data.undp.org,Percentage,Combined gross enrolment in education (both sexes),http://stats.uis.unesco.org/unesco/tableviewer/document.aspx?ReportId=143,"The information in the various pages of the UNDP Web site is issued by the United Nations Development Programme for general distribution. The information presented is protected under the Berne Convention for the Protection of Literature and Artistic works, under other international conventions and under national laws on copyright and neighboring rights. Extracts of the information in the Web site may be reviewed, reproduced or translated for research or private study but not for sale or for use in conjunction with commercial purposes. Any use of information in the Web site should be accompanied by an acknowledgment of UNDP as the source, citing the uniform resource locator (URL) of the article. Reproduction or translation of substantial portions of the Web site, or any use other than for educational or other non-commercial purposes, require explicit, prior authorization in writing. Applications and enquiries should be addressed to the programme responsible for the page used.","Average number of years of education received by people ages 25 and older, converted from education attainment levels using official durations of each level.",,,,,,,,,,,,,,,,,,,,,,,,,,,,,,,,,,,,,,,,17.0,,,,17.0,,,,,,,,,,,,,,,,,,,,,,,,,,,,,,,,,,,,,,,,,,,,,,,,,,,,,,,,,
PVW010,Proportion of the population using improved drinking water sources,mdgs,Percentage,Proportion of the population using improved drinking water sources,http://unstats.un.org/unsd/mdg/Metadata.aspx?IndicatorId=0&SeriesId=665,"The United Nations maintains this web site (the “Site”) as a courtesy to those who may choose to access the Site (“Users”). The information presented herein is for informative purposes only. The United Nations grants permission to Users to visit the Site and to download and copy the information, documents and materials (collectively, “Materials”) from the Site for the User’s personal, non-commercial use, without any right to resell or redistribute them or to compile or create derivative works therefrom, subject to the terms and conditions outlined below, and also subject to more specific restrictions that may apply to specific Material within this Site.","The proportion of the population using an improved drinking water source, total, urban, and rural, is the percentage of the population who use any of the following types of water supply for drinking: piped water into dwelling, plot or yard; public tap/standpipe; borehole/tube well; protected dug well; protected spring; rainwater collection and bottled water (if a secondary available source is also improved). It does not include unprotected well, unprotected spring, water provided by carts with small tanks/drums, tanker truck-provided water and bottled water (if secondary source is not an improved source) or surface water taken directly from rivers, ponds, streams, lakes, dams, or irrigation channels. Definitions and a detailed description of these facilities can be found at the website of the WHO/UNICEF Joint Monitoring Programme for Water Supply and Sanitation at www.wssinfo.org.",,,,,,,,,,,,,,,,,,,,,,,,,,,,,,,,,,,,,,,,32.0,31.0,31.0,31.0,31.0,30.0,28.0,27.0,26.0,25.0,24.0,24.0,23.0,22.0,21.0,21.0,21.0,21.0,21.0,,,,,,,,,,,,,,,,,,,,,,,,,,,,,,,,,,,,,,,,,,,
PVX040,Incidence of Conflict,acled,Incidents,Incidence of conflict,http://www.acleddata.com,"If using ACLED data, please cite: Raleigh, Clionadh, Andrew Linke, Håvard Hegre and Joakim Karlsen. 2010. Introducing ACLED-Armed Conflict Location and Event Data. Journal of Peace Research 47(5) 1-10.","The Armed Conflict Location and Event Database (ACLED) project codes reported information on the exact location, date, and other characteristics of politically violent events in unstable and warring states. ACLED focuses specifically on: 
- Tracking rebel, militia and government activity over time and space 
- Locating rebel group bases, headquarters, strongholds and presence 
- Distinguishing between territorial transfers of military control from governments 
to rebel groups and vice versa 
- Recording violent acts between militias 
- Collecting information on rioting and protesting 
- Non-violent events that are crucial to the dynamics of political violence (e.g. rallies, recruitment drives, peace talks, high-level arrests) 
ACLED data cover all countries on the African continent from 1997-present. Real-time data is available for African states. Data for additional countries including Haiti, Laos, Cambodia, Nepal, Myanmar are available from 1997-early 2010. Data for Afghanistan and Pakistan is available from 2006-2009 and Lebanon from 2006-2012.

Total number of incidents of all types are summed by country by year.  Non-violent incident categories are excluded from the sum.",,,,,,,,,,,,,,,,,,,,,,,,,,,,,,,,,,,,,6898.0,7234.0,4793.0,2808.0,2970.0,1388.0,2042.0,1979.0,593.0,527.0,791.0,954.0,266.0,153.0,187.0,193.0,69.0,61.0,,,,,,,,,,,,,,,,,,,,,,,,,,,,,,,,,,,,,,,,,,,,,,,
PVX020,GNA Crisis Index,echo,Index,GNA crisis index,http://ec.europa.eu,"Copyright notice

© European Union, 1995-2014 

Reuse is authorised, provided the source is acknowledged. The reuse policy of the European Commission is implemented by a Decision of 12 December 2011  [728KB] . 

The general principle of reuse can be subject to conditions which may be specified in individual copyright notices. Therefore users are advised to refer to the copyright notices of the individual websites maintained under Europa and of the individual documents. Reuse is not applicable to documents subject to intellectual property rights of third parties. ","The GNA Final Index lists countries in ranking order. The GNA Vulnerability Index and the GNA Crisis Index are shown, as well as the various dimensions. Each dimension has a value that is the result of combining indicators. Note that all values are the result of ranking countries. If countries are in the top quartile (25%), they score 3; in the bottom quartile, they score 1; in the middle 2 quartiles, they score 2.  Index value is taken directly from the source dataset. For the calculation methods see the Methodological notes on http://ec.europa.eu/echo/policies/strategy_en.htm.",,,,,,,,,,,,,,,,,,,,,,,,,,,,,,,,,,,,,,,3.0,,,,,,,,,,,,,,,,,,,,,,,,,,,,,,,,,,,,,,,,,,,,,,,,,,,,,,,,,,,,,,
PVW040,Proportion of the population using improved sanitation facilities,mdgs,Percentage,Proportion of the population using improved sanitation facilities,http://mdgs.un.org/unsd/mdg/Metadata.aspx?IndicatorId=0&SeriesId=668,"The United Nations maintains this web site (the “Site”) as a courtesy to those who may choose to access the Site (“Users”). The information presented herein is for informative purposes only. The United Nations grants permission to Users to visit the Site and to download and copy the information, documents and materials (collectively, “Materials”) from the Site for the User’s personal, non-commercial use, without any right to resell or redistribute them or to compile or create derivative works therefrom, subject to the terms and conditions outlined below, and also subject to more specific restrictions that may apply to specific Material within this Site.","The proportion of the population using an improved sanitation facility, total, urban, rural, is the percentage of the population with access to facilities that hygienically separate human excreta from human contact. Improved facilities include flush/pour flush toilets or latrines connected to a sewer, -septic tank, or -pit, ventilated improved pit latrines, pit latrines with a slab or platform of any material which covers the pit entirely, except for the drop hole and composting toilets/latrines. Unimproved facilities include public or shared facilities of an otherwise acceptable type, flush/pour-flush toilets or latrines which discharge directly into an open sewer or ditch, pit latrines without a slab, bucket latrines, hanging toilets or latrines which directly discharge in water bodies or in the open and the practice of open defecation in the bush, field or bodies or water. Definitions and a detailed description of these facilities can be found at the website of the WHO/UNICEF Joint Monitoring Programme for Water Supply and Sanitation at www.wssinfo.org.",,,,,,,,,,,,,,,,,,,,,,,,,,,,,,,,,,,,,,,,24.0,23.0,23.0,23.0,23.0,23.0,22.0,22.0,22.0,22.0,22.0,22.0,22.0,22.0,22.0,22.0,21.0,21.0,21.0,,,,,,,,,,,,,,,,,,,,,,,,,,,,,,,,,,,,,,,,,,,
PVF020,Per capita food supply,faostat3,kcal/capita/day,"Estimates of per capita food supplies available for human consumption during the reference period in terms of quantity, caloric value, protein and fat content.",http://faostat3.fao.org/faostat-gateway/go/to/browse/C/*/E,"Content on www.fao.org, its affiliated websites and specific pages (collectively the FAO website) is protected by copyright. To ensure wide dissemination of its information, FAO is committed to making its content freely available and encourages the use, reproduction and dissemination of the text, multimedia and data products presented. Except where otherwise indicated, content may be copied, printed and downloaded for private study, research and teaching purposes, or for use in non-commercial products or services, provided that appropriate acknowledgement of FAO as the source and copyright holder is given and that FAO's endorsement of users' views, products or services is not stated or implied in any way. FAO encourages unrestricted use of news releases provided on the FAO website, and no formal permission is required to reproduce these materials.

All requests for translation and adaptation rights, and for resale and other commercial use rights should be addressed to copyright@fao.org or submitted via the online Licence Request Form when downloading.

RECOMMENDED CITATION:

[© FAO] [Year of publication] [Title of content] [Page number (for publications)] [Location on FAO website] [Date accessed and/or downloaded]","Estimates of per capita food supplies available for human consumption during the reference period in terms of quantity, caloric value, protein and fat content. Calorie supplies are reported in kilocalories (1 calorie = 4.19 kilojoules). Per capita supplies in terms of product weight are derived from the total supplies available for human consumption (i.e. Food) by dividing the quantities of Food by the total population actually partaking of the food supplies during the reference period, i.e. the present in-area (de facto) population within the present geographical boundaries of the country. In other words, nationals living abroad during the reference period are excluded, but foreigners living in the country are included. Adjustments are made wherever possible for part-time presence or absence, such as temporary migrants, tourists and refugees supported by special schemes (if it has not been possible to allow for the amounts provided by such schemes under imports). In almost all cases, the population figures used are the mid-year estimates published by the United Nations Population Division. Per capita supply figures shown in the commodity balances therefore represent only the average supply available for the population as a whole and do not necessarily indicate what is actually consumed by individuals. Even if they are taken as approximation to per capita consumption, it is important to note that the amount of food actually consumed may be lower than the quantity shown here, depending on the degree of losses of edible food and nutrients in the household, e.g. during storage, in preparation and cooking etc. In many cases commodities are not consumed in the primary form in which they are presented in the commodity balance, e.g. cereals enter the household mainly in processed form like flour, meal, husked or milled rice. To take this fact into account, the caloric value, the protein and fat content shown against primary commodities in the commodity balances have been derived by applying the appropriate food composition factors to the quantities of the processed commodities and not by multiplying the quantities shown in the commodity balance with the food composition factors relating to primary commodities.",,,,,,,,,,,,,,,,,,,,,,,,,,,,,,,,,,,,,,,,1696.0,1742.0,1707.0,1680.0,1718.0,1707.0,1779.0,1662.0,1772.0,1697.0,1660.0,1628.0,1616.0,1616.0,1621.0,1589.0,1624.0,1629.0,1606.0,1597.0,1662.0,1839.0,1976.0,2013.0,2078.0,2092.0,2028.0,1963.0,1955.0,2023.0,1950.0,1676.0,1687.0,1657.0,1808.0,1833.0,1898.0,1744.0,1867.0,1878.0,1946.0,1938.0,1907.0,1889.0,1786.0,1817.0,1863.0,1808.0,1848.0,1832.0,1795.0,,,,,,,,,,,
PVX010,GNA Vulnerability Index,echo,Index,GNA vulnerability index,http://ec.europa.eu,"Copyright notice

© European Union, 1995-2014 

Reuse is authorised, provided the source is acknowledged. The reuse policy of the European Commission is implemented by a Decision of 12 December 2011  [728KB] . 

The general principle of reuse can be subject to conditions which may be specified in individual copyright notices. Therefore users are advised to refer to the copyright notices of the individual websites maintained under Europa and of the individual documents. Reuse is not applicable to documents subject to intellectual property rights of third parties. ","The GNA Final Index lists countries in ranking order. The GNA Vulnerability Index and the GNA Crisis Index are shown, as well as the various dimensions. Each dimension has a value that is the result of combining indicators. Note that all values are the result of ranking countries. If countries are in the top quartile (25%), they score 3; in the bottom quartile, they score 1; in the middle 2 quartiles, they score 2. Index value is taken directly from the source dataset. For the calculation methods see the Methodological notes on http://ec.europa.eu/echo/policies/strategy_en.htm",,,,,,,,,,,,,,,,,,,,,,,,,,,,,,,,,,,,,,,3.0,,,,,,,,,,,,,,,,,,,,,,,,,,,,,,,,,,,,,,,,,,,,,,,,,,,,,,,,,,,,,,
PVN050,Children under 5 moderately or severely underweight,mdgs,Percentage,Percentage of children under 5 moderately or severely underweight,http://mdgs.un.org/unsd/mdg/Metadata.aspx?IndicatorId=0&SeriesId=559,"The United Nations maintains this web site (the “Site”) as a courtesy to those who may choose to access the Site (“Users”). The information presented herein is for informative purposes only. The United Nations grants permission to Users to visit the Site and to download and copy the information, documents and materials (collectively, “Materials”) from the Site for the User’s personal, non-commercial use, without any right to resell or redistribute them or to compile or create derivative works therefrom, subject to the terms and conditions outlined below, and also subject to more specific restrictions that may apply to specific Material within this Site.","Prevalence of (moderately and severely) underweight children is the percentage of children aged 0-59 months whose weights for age are less than two standard deviations below the median weight for age of the international reference population. The international reference population, often referred to as the NCHS/WHO reference population, was formulated by the National Center for Health Statistics (NCHS) as a reference for the United States and later adopted by the World Health Organization (WHO).

The NCHS/WHO reference standard represents the distribution of height and weight by age and sex in a well-nourished population. In a well-nourished population, 2.3 percent of children fall below minus two standard deviations.

A new standard reference population, the WHO Child Growth Standards, was released in April 2006 and is also being used to estimate underweight prevalence (see Comments and Limitations below).

Percentage of children under five that are underweight =        (Number of children under age five that fall below minus two standard deviations from the median weight for age of the NCHS/WHO standard (moderate and severe))*100/ Total number of children under age five that were weighted.",,,,,,,,,,,,,,,,,,,,,,,,,,,,,,,,,,,,,,,,,,,,,32.8,,,,,,22.8,,,,,,,,,,,,,,,,,,,,,,,,,,,,,,,,,,,,,,,,,,,,,,,,,,
