Indicator ID,Indicator name,Source dataset,Units,Dataset summary,More Info,Terms of Use,HDX Methodology,2050,2049,2048,2047,2046,2045,2044,2043,2042,2041,2040,2039,2038,2037,2036,2035,2034,2033,2032,2031,2030,2029,2028,2027,2026,2025,2024,2023,2022,2021,2020,2019,2018,2017,2016,2015,2014,2013,2012,2011,2010,2009,2008,2007,2006,2005,2004,2003,2002,2001,2000,1999,1998,1997,1996,1995,1994,1993,1992,1991,1990,1989,1988,1987,1986,1985,1984,1983,1982,1981,1980,1979,1978,1977,1976,1975,1974,1973,1972,1971,1970,1969,1968,1967,1966,1965,1964,1963,1962,1961,1960,1959,1958,1957,1956,1955,1954,1953,1952,1951,1950
CH100,Total cost of damage done by disasters,emdat,US$,Total cost of damage done by disasters,http://www.emdat.be/explanatory-notes,"The EM-DAT database is protected by the law of June 30th, 1994 on copyrights and the law of August 31st, 1998 on the legal protection of databases. Access to the EM-DAT database is made available free of charge by the UCL. The reproduction and communication of the information from EM-DAT is authorized by any means and in all forms, provided that the source is clearly mentioned and as follows:
 
“EM-DAT: The OFDA/CRED International Disaster Database – www.emdat.be – Université catholique de Louvain – Brussels – Belgium.”

","Several institutions have developed methodologies to quantify these losses in their specific domain. However, there is no standard procedure to determine a global figure for economic impact. Estimated damage are given (000’) US$.",,,,,,,,,,,,,,,,,,,,,,,,,,,,,,,,,,,,,,0.0,,0.0,0.0,0.0,0.0,0.0,0.0,0.0,0.0,0.0,0.0,0.0,0.0,0.0,0.0,0.0,0.0,,,,0.0,0.0,,0.0,0.0,0.0,0.0,0.0,0.0,,,0.0,0.0,0.0,,,0.0,,,,,,,0.0,,,0.0,,,,,,,,,,,,,,,,
CH070,Number of disasters,emdat,Disasters,Total number of disasters,http://www.emdat.be/explanatory-notes,"The EM-DAT database is protected by the law of June 30th, 1994 on copyrights and the law of August 31st, 1998 on the legal protection of databases. Access to the EM-DAT database is made available free of charge by the UCL. The reproduction and communication of the information from EM-DAT is authorized by any means and in all forms, provided that the source is clearly mentioned and as follows:
 
“EM-DAT: The OFDA/CRED International Disaster Database – www.emdat.be – Université catholique de Louvain – Brussels – Belgium.”

",For a disaster to be entered into the database at least one of the following criteria must be fulfilled: Ten (10) or more people reported killed. Hundred (100) or more people reported affected. Declaration of a state of emergency. Call for international assistance.,,,,,,,,,,,,,,,,,,,,,,,,,,,,,,,,,,,,,,3.0,,5.0,5.0,2.0,1.0,2.0,8.0,6.0,3.0,2.0,3.0,2.0,5.0,1.0,2.0,1.0,2.0,,,,1.0,2.0,,1.0,3.0,3.0,1.0,2.0,1.0,,,1.0,1.0,1.0,,,1.0,,,,,,,2.0,,,1.0,,,,,,,,,,,,,,,,
CH090,People affected by disasters,emdat,People,Total number of people affected by disasters,http://www.emdat.be/explanatory-notes,"The EM-DAT database is protected by the law of June 30th, 1994 on copyrights and the law of August 31st, 1998 on the legal protection of databases. Access to the EM-DAT database is made available free of charge by the UCL. The reproduction and communication of the information from EM-DAT is authorized by any means and in all forms, provided that the source is clearly mentioned and as follows:
 
“EM-DAT: The OFDA/CRED International Disaster Database – www.emdat.be – Université catholique de Louvain – Brussels – Belgium.”

",People requiring immediate assistance during a period of emergency; it can also include displaced or evacuated people.,,,,,,,,,,,,,,,,,,,,,,,,,,,,,,,,,,,,,,46000.0,,3516605.0,632000.0,20476.0,0.0,42662.0,25151.0,1000168.0,0.0,1216.0,22801.0,3500.0,0.0,2000.0,1784.0,9666.0,2208.0,,,,0.0,302000.0,,14635.0,159.0,305.0,0.0,0.0,4502.0,,,4153.0,1500000.0,80.0,,,0.0,,,,,,,4023.0,,,0.0,,,,,,,,,,,,,,,,
CH080,People killed in disasters,emdat,People,Total number of people killed in disasters,http://www.emdat.be/explanatory-notes,"The EM-DAT database is protected by the law of June 30th, 1994 on copyrights and the law of August 31st, 1998 on the legal protection of databases. Access to the EM-DAT database is made available free of charge by the UCL. The reproduction and communication of the information from EM-DAT is authorized by any means and in all forms, provided that the source is clearly mentioned and as follows:
 
“EM-DAT: The OFDA/CRED International Disaster Database – www.emdat.be – Université catholique de Louvain – Brussels – Belgium.”

",Persons confirmed as dead and persons missing and presumed dead (official figures when available).,,,,,,,,,,,,,,,,,,,,,,,,,,,,,,,,,,,,,,50.0,,104.0,43.0,35.0,0.0,18.0,82.0,56.0,57.0,106.0,58.0,2.0,87.0,2.0,3.0,1098.0,345.0,,,,27.0,52.0,,1.0,64.0,202.0,0.0,51.0,1022.0,,,412.0,0.0,30.0,,,0.0,,,,,,,513.0,,,0.0,,,,,,,,,,,,,,,,
PSE210,GINI index,world-bank,Index,GINI Index,http://data.worldbank.org/indicator/SI.POV.GINI,"You are free to copy, distribute, adapt, display or include the data in other products for commercial and noncommercial purposes at no cost subject to certain limitations summarized below.
You must include attribution for the data you use in the manner indicated in the metadata included with the data.
You must not claim or imply that The World Bank endorses your use of the data by or use The World Bank’s logo(s) or trademark(s) in conjunction with such use.
Other parties may have ownership interests in some of the materials contained on The World Bank Web site. For example, we maintain a list of some specific data within the Datasets that you may not redistribute or reuse without first contacting the original content provider, as well as information regarding how to contact the original content provider. Before incorporating any data in other products, please check the list: Terms of use: Restricted Data
The World Bank makes no warranties with respect to the data and you agree The World Bank shall not be liable to you in connection with your use of the data.
This is only a summary of the Terms of Use for Datasets Listed in The World Bank Data Catalogue. Please read the actual agreement that controls your use of the Datasets, which is available here: Terms of use for datasets. Also see World Bank Terms and Conditions.","Gini index measures the extent to which the distribution of income or consumption expenditure among individuals or households within an economy deviates from a perfectly equal distribution. A Lorenz curve plots the cumulative percentages of total income received against the cumulative number of recipients, starting with the poorest individual or household. The Gini index measures the area between the Lorenz curve and a hypothetical line of absolute equality, expressed as a percentage of the maximum area under the line. Thus a Gini index of 0 represents perfect equality, while an index of 100 implies perfect inequality.",,,,,,,,,,,,,,,,,,,,,,,,,,,,,,,,,,,,,,,,,33.02,,,,38.99,,,,,40.01,,,,,,,50.56,,,,,,,,,,,,,,,,,,,,,,,,,,,,,,,,,,,,,,,,,,,,
PVE010,Public expenditure on education (% of GDP),data.undp.org,Percentage,Public expenditure on education as percentage of Gross Domestic Product,https://data.undp.org/dataset/Public-expenditure-on-education-of-GDP-/bkr7-unqh,"The information in the various pages of the UNDP Web site is issued by the United Nations Development Programme for general distribution. The information presented is protected under the Berne Convention for the Protection of Literature and Artistic works, under other international conventions and under national laws on copyright and neighboring rights. Extracts of the information in the Web site may be reviewed, reproduced or translated for research or private study but not for sale or for use in conjunction with commercial purposes. Any use of information in the Web site should be accompanied by an acknowledgment of UNDP as the source, citing the uniform resource locator (URL) of the article. Reproduction or translation of substantial portions of the Web site, or any use other than for educational or other non-commercial purposes, require explicit, prior authorization in writing. Applications and enquiries should be addressed to the programme responsible for the page used.","Public expenditure on education as % of GDP is the total public expenditure (current and capital) on education expressed as a percentage of the Gross Domestic Product (GDP) in a given year. Public expenditure on education includes government spending on educational institutions (both public and private), education administration, and transfers/subsidies for private entities (students/households and other privates entities).",,,,,,,,,,,,,,,,,,,,,,,,,,,,,,,,,,,,,,,,,4.5,4.4,3.8,,,4.1,,,,,3.6,,,,,,,,,,,,,,,,,,,,3.4,,,,,,,,,,,,,,,,,,,,,,,,,,,,,,
PVE030,Expected Years of Schooling (of children),data.undp.org,Years,Expected years of schooling,https://data.undp.org/dataset/Expected-Years-of-Schooling-of-children-years-/qnam-f624,"The information in the various pages of the UNDP Web site is issued by the United Nations Development Programme for general distribution. The information presented is protected under the Berne Convention for the Protection of Literature and Artistic works, under other international conventions and under national laws on copyright and neighboring rights. Extracts of the information in the Web site may be reviewed, reproduced or translated for research or private study but not for sale or for use in conjunction with commercial purposes. Any use of information in the Web site should be accompanied by an acknowledgment of UNDP as the source, citing the uniform resource locator (URL) of the article. Reproduction or translation of substantial portions of the Web site, or any use other than for educational or other non-commercial purposes, require explicit, prior authorization in writing. Applications and enquiries should be addressed to the programme responsible for the page used.",Number of years of schooling that a child of school entrance age can expect to receive if prevailing patterns of age-specific enrollment rates persist throughout the child’s life.,,,,,,,,,,,,,,,,,,,,,,,,,,,,,,,,,,,,,8.6,,7.5,7.5,7.3,7.1,6.8,6.6,6.2,6.0,,,,,4.4,,,,,,,,,,2.0,,,,,,,,,,2.2,,,,,,,,,,,,,,,,,,,,,,,,,,,,,,
PSP070,"Median age by major area, region and country, 1950-2010",esa-unpd-wpp2012,Years,"Median age by major area, region and country",http://esa.un.org/wpp/Excel-Data/population.htm,"The United Nations maintains this web site (the “Site”) as a courtesy to those who may choose to access the Site (“Users”). The information presented herein is for informative purposes only. The United Nations grants permission to Users to visit the Site and to download and copy the information, documents and materials (collectively, “Materials”) from the Site for the User’s personal, non-commercial use, without any right to resell or redistribute them or to compile or create derivative works therefrom, subject to the terms and conditions outlined below, and also subject to more specific restrictions that may apply to specific Material within this Site.","Age that divides the population in two parts of equal size, that is, there are as many persons with ages above the median as there are with ages below the median. It is expressed as years.",,,,,,,,,,,,,,,,,,,,,,,,,,,,,,,,,,,,,,,,,16.537,,,,,16.736,,,,,16.753,,,,,16.729,,,,,16.712,,,,,17.612,,,,,18.241,,,,,18.866,,,,,19.311,,,,,19.76,,,,,19.942,,,,,20.452,,,,,20.85
PSP100,"Percentage of Population Residing in Urban Areas by Major Area, Region and Country, 1950-2050",esa-unpd-wup2011,Percentage,"Percentage of Population Residing in Urban Areas by Major Area, Region and Country, 1950-2050",http://esa.un.org/wpp/Excel-Data/population.htm,"The United Nations maintains this web site (the “Site”) as a courtesy to those who may choose to access the Site (“Users”). The information presented herein is for informative purposes only. The United Nations grants permission to Users to visit the Site and to download and copy the information, documents and materials (collectively, “Materials”) from the Site for the User’s personal, non-commercial use, without any right to resell or redistribute them or to compile or create derivative works therefrom, subject to the terms and conditions outlined below, and also subject to more specific restrictions that may apply to specific Material within this Site.",For information about the method of calculation please visit http://esa.un.org/wpp/Excel-Data/population.htm,59.19,,,,,56.22,,,,,53.204,,,,,50.165,,,,,47.11,,,,,43.972,,,,,40.765,,,,,37.521,,,,,34.277,,,,,31.094,,,,,28.078,,,,,25.519,,,,,23.322,,,,,21.013,,,,,18.484,,,,,16.244,,,,,14.33,,,,,12.608,,,,,11.066,,,,,9.692,,,,,8.472
PSP090,Population density ,world-bank,People per square km,Population density,http://data.worldbank.org/indicator/EN.POP.DNST,"You are free to copy, distribute, adapt, display or include the data in other products for commercial and noncommercial purposes at no cost subject to certain limitations summarized below.
You must include attribution for the data you use in the manner indicated in the metadata included with the data.
You must not claim or imply that The World Bank endorses your use of the data by or use The World Bank’s logo(s) or trademark(s) in conjunction with such use.
Other parties may have ownership interests in some of the materials contained on The World Bank Web site. For example, we maintain a list of some specific data within the Datasets that you may not redistribute or reuse without first contacting the original content provider, as well as information regarding how to contact the original content provider. Before incorporating any data in other products, please check the list: Terms of use: Restricted Data
The World Bank makes no warranties with respect to the data and you agree The World Bank shall not be liable to you in connection with your use of the data.
This is only a summary of the Terms of Use for Datasets Listed in The World Bank Data Catalogue. Please read the actual agreement that controls your use of the Datasets, which is available here: Terms of use for datasets. Also see World Bank Terms and Conditions.","Population density is midyear population divided by land area in square kilometers. Population is based on the de facto definition of population, which counts all residents regardless of legal status or citizenship--except for refugees not permanently settled in the country of asylum, who are generally considered part of the population of their country of origin. Land area is a country's total area, excluding area under inland water bodies, national claims to continental shelf, and exclusive economic zones. In most cases the definition of inland water bodies includes major rivers and lakes. Food and Agriculture Organization and World Bank population estimates.",,,,,,,,,,,,,,,,,,,,,,,,,,,,,,,,,,,,,,12.540383055098,12.1731631958957,11.8151574754751,11.4621173751629,11.1124464222785,10.7674206476041,10.4292192199575,10.1013325793524,9.78639228316901,9.48453601488293,9.19507371802752,8.91882575664446,8.65665838926724,8.40899941812341,8.17684786795499,7.95971529024168,7.75473983559937,7.55796802137372,7.36676501200633,7.17875248936641,6.99508928937297,6.82085822699743,6.66328440652685,6.52690646538654,6.41405682721543,6.32122702202116,6.24000360599579,6.15868840098673,6.06889172997648,5.96730509182996,5.85636581188176,5.7404633704587,5.62659585802211,5.51983461592047,5.42133438235029,5.32924626492595,5.24212704578795,5.15757218138159,5.07390980093264,4.99073422991501,4.90894041091961,4.829668330342,4.75456445307698,4.68475729189716,4.62053204828756,4.56131422155566,4.50631295126169,4.45435383014121,4.40450011883395,4.35656332210557,4.31054671813406,4.2659323547972,4.22215146821397,,,,,,,,,,,
PSE140,"Age dependency ratio, old ",world-bank,Percentage,"Age dependency ratio, old, is the ratio of older dependents (people older than 64) to the working-age population (those ages 15-64).",http://data.worldbank.org/indicator/SP.POP.DPND.OL,"You are free to copy, distribute, adapt, display or include the data in other products for commercial and noncommercial purposes at no cost subject to certain limitations summarized below.
You must include attribution for the data you use in the manner indicated in the metadata included with the data.
You must not claim or imply that The World Bank endorses your use of the data by or use The World Bank’s logo(s) or trademark(s) in conjunction with such use.
Other parties may have ownership interests in some of the materials contained on The World Bank Web site. For example, we maintain a list of some specific data within the Datasets that you may not redistribute or reuse without first contacting the original content provider, as well as information regarding how to contact the original content provider. Before incorporating any data in other products, please check the list: Terms of use: Restricted Data
The World Bank makes no warranties with respect to the data and you agree The World Bank shall not be liable to you in connection with your use of the data.
This is only a summary of the Terms of Use for Datasets Listed in The World Bank Data Catalogue. Please read the actual agreement that controls your use of the Datasets, which is available here: Terms of use for datasets. Also see World Bank Terms and Conditions.","Age dependency ratio, old, is the ratio of older dependents (people older than 64) to the working-age population (those ages 15-64). Data are shown as the proportion of dependents per 100 working-age population. World Bank staff estimates from various sources including census reports, the United Nations Population Division's World Population Prospects, national statistical offices, household surveys conducted by national agencies, and ICF International.",,,,,,,,,,,,,,,,,,,,,,,,,,,,,,,,,,,,,,5.58738099238957,5.6278390452454,5.69922781774779,5.76423832022788,5.82055364397081,5.86965146292479,5.92007270864571,5.9842321509584,6.07217683673944,6.18940572156897,6.33445681237853,6.50140049507901,6.67946160067248,6.85856605844317,7.03418667179295,7.20535881734863,7.36939840996967,7.5249745921161,7.66980256478023,7.80422856556904,7.92361125670823,8.01402005514936,8.05619711954787,8.03596569851884,7.94418082745901,7.78828580493627,7.59057107778845,7.38134453986628,7.18156391952768,6.99742417684504,6.82460327156433,6.65908595748237,6.494140288809,6.32543576421657,6.15486967767608,5.98662830505936,5.82079441330329,5.65698542327817,5.49481282447504,5.33463387145685,5.17733652475938,5.0223860354929,4.86981094657888,4.7201861256348,4.57358532982107,4.43214258073085,4.30148884848535,4.1889251235862,4.0995352742977,4.03613454679581,3.99784383273622,3.98114508561201,3.98048546998434,3.99179709195517,,,,,,,,,,
PSE160,MPI: Population living below $1.25 PPP per day,data.undp.org,Percentage,Percentage of the population living below the international poverty line $1.25 (in purchasing power parity terms) a day,https://data.undp.org/dataset/MPI-Population-living-below-1-25-PPP-per-day-/ehe9-pgud,"The information in the various pages of the UNDP Web site is issued by the United Nations Development Programme for general distribution. The information presented is protected under the Berne Convention for the Protection of Literature and Artistic works, under other international conventions and under national laws on copyright and neighboring rights. Extracts of the information in the Web site may be reviewed, reproduced or translated for research or private study but not for sale or for use in conjunction with commercial purposes. Any use of information in the Web site should be accompanied by an acknowledgment of UNDP as the source, citing the uniform resource locator (URL) of the article. Reproduction or translation of substantial portions of the Web site, or any use other than for educational or other non-commercial purposes, require explicit, prior authorization in writing. Applications and enquiries should be addressed to the programme responsible for the page used.","Percentage of the population living below the international poverty line $1.25 (in purchasing power parity terms) a day. Source: World Bank (2012a). ""World Development Indicators 2012."" Washington, D.C.: World Bank. http://data.worldbank.org. Accessed April, 2012. http://data.worldbank.org/data-catalog/world-development-indicators Data in the tables are those available to the Human Development Report Office as of 15 October 2012, unless otherwise specified.",,,,,,,,,,,,,,,,,,,,,,,,,,,,,,,,,,,,,50.43,,50.4,,50.4,,,,51.4,,,,,,,,,,,,,,,,,,,,,,,,,,,,,,,,,,,,,,,,,,,,,,,,,,,,,,,,
PCX140,Percentage of population with access to electricity,world-bank,Percentage,Percentage of population with access to electricity.,http://data.worldbank.org/indicator/EG.ELC.ACCS.ZS,"You are free to copy, distribute, adapt, display or include the data in other products for commercial and noncommercial purposes at no cost subject to certain limitations summarized below.
You must include attribution for the data you use in the manner indicated in the metadata included with the data.
You must not claim or imply that The World Bank endorses your use of the data by or use The World Bank’s logo(s) or trademark(s) in conjunction with such use.
Other parties may have ownership interests in some of the materials contained on The World Bank Web site. For example, we maintain a list of some specific data within the Datasets that you may not redistribute or reuse without first contacting the original content provider, as well as information regarding how to contact the original content provider. Before incorporating any data in other products, please check the list: Terms of use: Restricted Data
The World Bank makes no warranties with respect to the data and you agree The World Bank shall not be liable to you in connection with your use of the data.
This is only a summary of the Terms of Use for Datasets Listed in The World Bank Data Catalogue. Please read the actual agreement that controls your use of the Datasets, which is available here: Terms of use for datasets. Also see World Bank Terms and Conditions.","Access to electricity is the percentage of population with access to electricity. Electrification data are collected from industry, national surveys and international sources.",,,,,,,,,,,,,,,,,,,,,,,,,,,,,,,,,,,,,,,,,16.6,,,,,,,,,,16.7,,,,,,,,,,12.03774,,,,,,,,,,,,,,,,,,,,,,,,,,,,,,,,,,,,,,,,
PSE120,GNI (current US$),world-bank,Current International US$,Gross national income in current dollars,http://data.worldbank.org/indicator/NY.GNP.MKTP.CD,"You are free to copy, distribute, adapt, display or include the data in other products for commercial and noncommercial purposes at no cost subject to certain limitations summarized below.
You must include attribution for the data you use in the manner indicated in the metadata included with the data.
You must not claim or imply that The World Bank endorses your use of the data by or use The World Bank’s logo(s) or trademark(s) in conjunction with such use.
Other parties may have ownership interests in some of the materials contained on The World Bank Web site. For example, we maintain a list of some specific data within the Datasets that you may not redistribute or reuse without first contacting the original content provider, as well as information regarding how to contact the original content provider. Before incorporating any data in other products, please check the list: Terms of use: Restricted Data
The World Bank makes no warranties with respect to the data and you agree The World Bank shall not be liable to you in connection with your use of the data.
This is only a summary of the Terms of Use for Datasets Listed in The World Bank Data Catalogue. Please read the actual agreement that controls your use of the Datasets, which is available here: Terms of use for datasets. Also see World Bank Terms and Conditions.",GNI (formerly GNP) is the sum of value added by all resident producers plus any product taxes (less subsidies) not included in the valuation of output plus net receipts of primary income (compensation of employees and property income) from abroad. Data are in current U.S. dollars.,,,,,,,,,,,,,,,,,,,,,,,,,,,,,,,,,,,,,,1.02727410735973E10,9.80767455417188E9,1.01945992882439E10,9.00327548172927E9,8.50750351651234E9,8.42509387984236E9,6.84660426972304E9,5.86522855114348E9,5.09867078716952E9,4.67920782900549E9,4.20259826622534E9,3.10264802853068E9,2.46371777550772E9,2.39240394917573E9,2.52582999081987E9,2.54604791382023E9,2.42203899171886E9,2.56923805216963E9,2.41881948029365E9,1.73947551254665E9,2.68017764865697E9,2.84530547412641E9,2.4201710372669E9,2.40532026543844E9,,1.92162294472235E9,1.91141460694759E9,1.65377494357927E9,1.28775363103185E9,1.28970450762595E9,1.26430581332854E9,1.30069951410061E9,1.4579688705805E9,1.76805553594989E9,1.5817195598629E9,1.23348008132126E9,1.04987922987318E9,9.3139792696667E8,8.19675358376986E8,5.3392398994678E8,5.61341721110447E8,4.85815786533743E8,4.28500053906829E8,3.54124048449181E8,3.372015253727E8,3.41790655961112E8,2.74847728561775E8,,,,,,,,,,,,,,,,,
