Indicator ID,Indicator name,Source dataset,Units,Dataset summary,More Info,Terms of Use,HDX Methodology,2050,2049,2048,2047,2046,2045,2044,2043,2042,2041,2040,2039,2038,2037,2036,2035,2034,2033,2032,2031,2030,2029,2028,2027,2026,2025,2024,2023,2022,2021,2020,2019,2018,2017,2016,2015,2014,2013,2012,2011,2010,2009,2008,2007,2006,2005,2004,2003,2002,2001,2000,1999,1998,1997,1996,1995,1994,1993,1992,1991,1990,1989,1988,1987,1986,1985,1984,1983,1982,1981,1980,1979,1978,1977,1976,1975,1974,1973,1972,1971,1970,1969,1968,1967,1966,1965,1964,1963,1962,1961,1960,1959,1958,1957,1956,1955,1954,1953,1952,1951,1950
CH100,Total cost of damage done by disasters,emdat,US$,Total cost of damage done by disasters,http://www.emdat.be/explanatory-notes,"The EM-DAT database is protected by the law of June 30th, 1994 on copyrights and the law of August 31st, 1998 on the legal protection of databases. Access to the EM-DAT database is made available free of charge by the UCL. The reproduction and communication of the information from EM-DAT is authorized by any means and in all forms, provided that the source is clearly mentioned and as follows:
 
“EM-DAT: The OFDA/CRED International Disaster Database – www.emdat.be – Université catholique de Louvain – Brussels – Belgium.”

","Several institutions have developed methodologies to quantify these losses in their specific domain. However, there is no standard procedure to determine a global figure for economic impact. Estimated damage are given (000’) US$.",,,,,,,,,,,,,,,,,,,,,,,,,,,,,,,,,,,,,,,,,,,0.0,,,,0.0,0.0,500000.0,,0.0,,0.0,,,,,,,,,,,6000000.0,,,,,,,,,,,,,,,,,,,,,,,,,,,,,,,,,,,,,
CH070,Number of disasters,emdat,Disasters,Total number of disasters,http://www.emdat.be/explanatory-notes,"The EM-DAT database is protected by the law of June 30th, 1994 on copyrights and the law of August 31st, 1998 on the legal protection of databases. Access to the EM-DAT database is made available free of charge by the UCL. The reproduction and communication of the information from EM-DAT is authorized by any means and in all forms, provided that the source is clearly mentioned and as follows:
 
“EM-DAT: The OFDA/CRED International Disaster Database – www.emdat.be – Université catholique de Louvain – Brussels – Belgium.”

",For a disaster to be entered into the database at least one of the following criteria must be fulfilled: Ten (10) or more people reported killed. Hundred (100) or more people reported affected. Declaration of a state of emergency. Call for international assistance.,,,,,,,,,,,,,,,,,,,,,,,,,,,,,,,,,,,,,,,,,,,1.0,,,,1.0,1.0,2.0,,1.0,,1.0,,,,,,,,,,,1.0,,,,,,,,,,,,,,,,,,,,,,,,,,,,,,,,,,,,,
CH090,People affected by disasters,emdat,People,Total number of people affected by disasters,http://www.emdat.be/explanatory-notes,"The EM-DAT database is protected by the law of June 30th, 1994 on copyrights and the law of August 31st, 1998 on the legal protection of databases. Access to the EM-DAT database is made available free of charge by the UCL. The reproduction and communication of the information from EM-DAT is authorized by any means and in all forms, provided that the source is clearly mentioned and as follows:
 
“EM-DAT: The OFDA/CRED International Disaster Database – www.emdat.be – Université catholique de Louvain – Brussels – Belgium.”

",People requiring immediate assistance during a period of emergency; it can also include displaced or evacuated people.,,,,,,,,,,,,,,,,,,,,,,,,,,,,,,,,,,,,,,,,,,,0.0,,,,6000.0,0.0,1300.0,,3431.0,,28800.0,,,,,,,,,,,0.0,,,,,,,,,,,,,,,,,,,,,,,,,,,,,,,,,,,,,
CH080,People killed in disasters,emdat,People,Total number of people killed in disasters,http://www.emdat.be/explanatory-notes,"The EM-DAT database is protected by the law of June 30th, 1994 on copyrights and the law of August 31st, 1998 on the legal protection of databases. Access to the EM-DAT database is made available free of charge by the UCL. The reproduction and communication of the information from EM-DAT is authorized by any means and in all forms, provided that the source is clearly mentioned and as follows:
 
“EM-DAT: The OFDA/CRED International Disaster Database – www.emdat.be – Université catholique de Louvain – Brussels – Belgium.”

",Persons confirmed as dead and persons missing and presumed dead (official figures when available).,,,,,,,,,,,,,,,,,,,,,,,,,,,,,,,,,,,,,,,,,,,0.0,,,,1.0,0.0,47.0,,19.0,,0.0,,,,,,,,,,,5.0,,,,,,,,,,,,,,,,,,,,,,,,,,,,,,,,,,,,,
PSE210,GINI index,world-bank,Index,GINI Index,http://data.worldbank.org/indicator/SI.POV.GINI,"You are free to copy, distribute, adapt, display or include the data in other products for commercial and noncommercial purposes at no cost subject to certain limitations summarized below.
You must include attribution for the data you use in the manner indicated in the metadata included with the data.
You must not claim or imply that The World Bank endorses your use of the data by or use The World Bank’s logo(s) or trademark(s) in conjunction with such use.
Other parties may have ownership interests in some of the materials contained on The World Bank Web site. For example, we maintain a list of some specific data within the Datasets that you may not redistribute or reuse without first contacting the original content provider, as well as information regarding how to contact the original content provider. Before incorporating any data in other products, please check the list: Terms of use: Restricted Data
The World Bank makes no warranties with respect to the data and you agree The World Bank shall not be liable to you in connection with your use of the data.
This is only a summary of the Terms of Use for Datasets Listed in The World Bank Data Catalogue. Please read the actual agreement that controls your use of the Datasets, which is available here: Terms of use for datasets. Also see World Bank Terms and Conditions.","Gini index measures the extent to which the distribution of income or consumption expenditure among individuals or households within an economy deviates from a perfectly equal distribution. A Lorenz curve plots the cumulative percentages of total income received against the cumulative number of recipients, starting with the poorest individual or household. The Gini index measures the area between the Lorenz curve and a hypothetical line of absolute equality, expressed as a percentage of the maximum area under the line. Thus a Gini index of 0 represents perfect equality, while an index of 100 implies perfect inequality.",,,,,,,,,,,,,,,,,,,,,,,,,,,,,,,,,,,,,,,,,,,,,,,,,,,61.1,,,,,,,,,,,,,,,,,,,,,,,,,,,,,,,,,,,,,,,,,,,,,,,,,,
PSE220,Human Development Index rank,data.undp.org,Index,Human development index rank,http://hdr.undp.org/en/statistics/hdi,"The information in the various pages of the UNDP Web site is issued by the United Nations Development Programme for general distribution. The information presented is protected under the Berne Convention for the Protection of Literature and Artistic works, under other international conventions and under national laws on copyright and neighboring rights. Extracts of the information in the Web site may be reviewed, reproduced or translated for research or private study but not for sale or for use in conjunction with commercial purposes. Any use of information in the Web site should be accompanied by an acknowledgment of UNDP as the source, citing the uniform resource locator (URL) of the article. Reproduction or translation of substantial portions of the Web site, or any use other than for educational or other non-commercial purposes, require explicit, prior authorization in writing. Applications and enquiries should be addressed to the programme responsible for the page used.","The Human Development Index (HDI) is a composite statistic of life expectancy, education, and income indices used to rank countries into four tiers of human development. It was created by the Pakistani economist Mahbub ul Haq and the Indian economist Amartya Sen in 1990 and was published by the United Nations Development Programme.",,,,,,,,,,,,,,,,,,,,,,,,,,,,,,,,,,,,,124.0,,117.0,,,,,,,,,,,,,,,,,,,,,,,,,,,,,,,,,,,,,,,,,,,,,,,,,,,,,,,,,,,,,,
PVE030,Expected Years of Schooling (of children),data.undp.org,Years,Expected years of schooling,https://data.undp.org/dataset/Expected-Years-of-Schooling-of-children-years-/qnam-f624,"The information in the various pages of the UNDP Web site is issued by the United Nations Development Programme for general distribution. The information presented is protected under the Berne Convention for the Protection of Literature and Artistic works, under other international conventions and under national laws on copyright and neighboring rights. Extracts of the information in the Web site may be reviewed, reproduced or translated for research or private study but not for sale or for use in conjunction with commercial purposes. Any use of information in the Web site should be accompanied by an acknowledgment of UNDP as the source, citing the uniform resource locator (URL) of the article. Reproduction or translation of substantial portions of the Web site, or any use other than for educational or other non-commercial purposes, require explicit, prior authorization in writing. Applications and enquiries should be addressed to the programme responsible for the page used.",Number of years of schooling that a child of school entrance age can expect to receive if prevailing patterns of age-specific enrollment rates persist throughout the child’s life.,,,,,,,,,,,,,,,,,,,,,,,,,,,,,,,,,,,,,11.4,,11.4,11.4,11.4,11.4,,,,,,,,,,,,,,,,,,,,,,,,,,,,,,,,,,,,,,,,,,,,,,,,,,,,,,,,,,,
PVE010,Public expenditure on education (% of GDP),data.undp.org,Percentage,Public expenditure on education as percentage of Gross Domestic Product,https://data.undp.org/dataset/Public-expenditure-on-education-of-GDP-/bkr7-unqh,"The information in the various pages of the UNDP Web site is issued by the United Nations Development Programme for general distribution. The information presented is protected under the Berne Convention for the Protection of Literature and Artistic works, under other international conventions and under national laws on copyright and neighboring rights. Extracts of the information in the Web site may be reviewed, reproduced or translated for research or private study but not for sale or for use in conjunction with commercial purposes. Any use of information in the Web site should be accompanied by an acknowledgment of UNDP as the source, citing the uniform resource locator (URL) of the article. Reproduction or translation of substantial portions of the Web site, or any use other than for educational or other non-commercial purposes, require explicit, prior authorization in writing. Applications and enquiries should be addressed to the programme responsible for the page used.","Public expenditure on education as % of GDP is the total public expenditure (current and capital) on education expressed as a percentage of the Gross Domestic Product (GDP) in a given year. Public expenditure on education includes government spending on educational institutions (both public and private), education administration, and transfers/subsidies for private entities (students/households and other privates entities).",,,,,,,,,,,,,,,,,,,,,,,,,,,,,,,,,,,,,,,,,,,,,,,,,,,6.7,,,,,,,,,,,,,,,,,,,,,,,,,,,,,,,,,,,,,,,,,,,,,,,,,,
PSP080,"Population density by major area, region and country, 1950-2010",esa-unpd-wpp2012,People per square km,Population per square Kilometer.,http://esa.un.org/wpp/Excel-Data/population.htm,"The United Nations maintains this web site (the “Site”) as a courtesy to those who may choose to access the Site (“Users”). The information presented herein is for informative purposes only. The United Nations grants permission to Users to visit the Site and to download and copy the information, documents and materials (collectively, “Materials”) from the Site for the User’s personal, non-commercial use, without any right to resell or redistribute them or to compile or create derivative works therefrom, subject to the terms and conditions outlined below, and also subject to more specific restrictions that may apply to specific Material within this Site.","For information about the method of calculation, please visit http://unstats.un.org/unsd/demographic/standmeth/default.htm",,,,,,,,,,,,,,,,,,,,,,,,,,,,,,,,,,,,,,,,,147.605,148.124,148.858,149.711,150.55,151.279,151.816,152.16,152.397,152.664,153.034,153.573,154.182,154.567,154.333,153.214,151.078,148.058,144.462,140.741,137.224,134.033,131.083,128.239,125.282,122.064,118.578,114.926,111.192,107.496,103.942,100.499,97.181,94.174,91.718,89.952,88.999,88.731,88.744,88.472,87.511,85.708,83.197,80.234,77.209,74.413,71.913,69.623,67.503,65.464,63.446,61.429,59.437,57.51,55.687,53.983,52.385,50.846,49.282,47.578,45.584
PSP070,"Median age by major area, region and country, 1950-2010",esa-unpd-wpp2012,Years,"Median age by major area, region and country",http://esa.un.org/wpp/Excel-Data/population.htm,"The United Nations maintains this web site (the “Site”) as a courtesy to those who may choose to access the Site (“Users”). The information presented herein is for informative purposes only. The United Nations grants permission to Users to visit the Site and to download and copy the information, documents and materials (collectively, “Materials”) from the Site for the User’s personal, non-commercial use, without any right to resell or redistribute them or to compile or create derivative works therefrom, subject to the terms and conditions outlined below, and also subject to more specific restrictions that may apply to specific Material within this Site.","Age that divides the population in two parts of equal size, that is, there are as many persons with ages above the median as there are with ages below the median. It is expressed as years.",,,,,,,,,,,,,,,,,,,,,,,,,,,,,,,,,,,,,,,,,20.193,,,,,19.489,,,,,18.867,,,,,17.764,,,,,17.569,,,,,16.912,,,,,16.272,,,,,16.134,,,,,16.759,,,,,16.596,,,,,17.472,,,,,18.46,,,,,19.77
PSP100,"Percentage of Population Residing in Urban Areas by Major Area, Region and Country, 1950-2050",esa-unpd-wup2011,Percentage,"Percentage of Population Residing in Urban Areas by Major Area, Region and Country, 1950-2050",http://esa.un.org/wpp/Excel-Data/population.htm,"The United Nations maintains this web site (the “Site”) as a courtesy to those who may choose to access the Site (“Users”). The information presented herein is for informative purposes only. The United Nations grants permission to Users to visit the Site and to download and copy the information, documents and materials (collectively, “Materials”) from the Site for the User’s personal, non-commercial use, without any right to resell or redistribute them or to compile or create derivative works therefrom, subject to the terms and conditions outlined below, and also subject to more specific restrictions that may apply to specific Material within this Site.",For information about the method of calculation please visit http://esa.un.org/wpp/Excel-Data/population.htm,33.636,,,,,31.774,,,,,29.968,,,,,28.223,,,,,26.541,,,,,25.003,,,,,23.832,,,,,23.01,,,,,22.514,,,,,22.33,,,,,22.33,,,,,25.068,,,,,25.818,,,,,26.149,,,,,26.445,,,,,25.858,,,,,24.808,,,,,23.537,,,,,22.312,,,,,21.133,,,,,20.0
PSP060,Population growth ,world-bank,Percentage,Population growth (annual %),http://data.worldbank.org/indicator/SP.POP.GROW,"You are free to copy, distribute, adapt, display or include the data in other products for commercial and noncommercial purposes at no cost subject to certain limitations summarized below.
You must include attribution for the data you use in the manner indicated in the metadata included with the data.
You must not claim or imply that The World Bank endorses your use of the data by or use The World Bank’s logo(s) or trademark(s) in conjunction with such use.
Other parties may have ownership interests in some of the materials contained on The World Bank Web site. For example, we maintain a list of some specific data within the Datasets that you may not redistribute or reuse without first contacting the original content provider, as well as information regarding how to contact the original content provider. Before incorporating any data in other products, please check the list: Terms of use: Restricted Data
The World Bank makes no warranties with respect to the data and you agree The World Bank shall not be liable to you in connection with your use of the data.
This is only a summary of the Terms of Use for Datasets Listed in The World Bank Data Catalogue. Please read the actual agreement that controls your use of the Datasets, which is available here: Terms of use for datasets. Also see World Bank Terms and Conditions.","Population growth (annual %) is the exponential rate of growth of midyear population from year t-1 to t, expressed as a percentage. Derived from total population. Population source: (1) United Nations Population Division. World Population Prospects, (2) United Nations Statistical Division. Population and Vital Statistics Report (various years), (3) Census reports and other statistical publications from national statistical offices, (4) Eurostat: Demographic Statistics, (5) Secretariat of the Pacific Community: Statistics and Demography Programme, and (6) U.S. Census Bureau: International Database.",,,,,,,,,,,,,,,,,,,,,,,,,,,,,,,,,,,,,,0.148832561878852,-0.0280438452850696,-0.188366723490568,-0.350671354813665,-0.494050822411876,-0.57158007661967,-0.558870054081314,-0.483284246604654,-0.3543686412481,-0.225876538809589,-0.156221529533676,-0.174641539019907,-0.242311395354531,-0.351239454569137,-0.396216104053682,-0.249144272604244,0.151258052892315,0.728124829857354,1.40349567302133,2.01917390747193,2.45935190079468,2.60938225965234,2.53074270561309,2.3527778613484,2.22564543568845,2.19296432796267,2.33305707159825,2.60212680919398,2.89724344928422,3.12861046592062,3.30265944491872,3.38101107454645,3.3621934146775,3.36856058474754,3.35692429578272,3.14324139955089,2.64238031724415,1.94467126336766,1.06510165256295,0.301364381779349,-0.0144477353426251,0.307061854545122,1.09115539469473,2.08231208012893,2.97396486163667,3.62636485842524,3.84213735951654,3.68891590638111,3.4173553451972,3.23706276385871,3.09180888244661,3.06635124899453,3.13192071427237,3.23087123839025,,,,,,,,,,
PSE090,"GNI per capita, PPP ",world-bank,Current International US$,Gross national income per capita in PPP,http://data.worldbank.org/indicator/NY.GNP.PCAP.PP.CD,"You are free to copy, distribute, adapt, display or include the data in other products for commercial and noncommercial purposes at no cost subject to certain limitations summarized below.
You must include attribution for the data you use in the manner indicated in the metadata included with the data.
You must not claim or imply that The World Bank endorses your use of the data by or use The World Bank’s logo(s) or trademark(s) in conjunction with such use.
Other parties may have ownership interests in some of the materials contained on The World Bank Web site. For example, we maintain a list of some specific data within the Datasets that you may not redistribute or reuse without first contacting the original content provider, as well as information regarding how to contact the original content provider. Before incorporating any data in other products, please check the list: Terms of use: Restricted Data
The World Bank makes no warranties with respect to the data and you agree The World Bank shall not be liable to you in connection with your use of the data.
This is only a summary of the Terms of Use for Datasets Listed in The World Bank Data Catalogue. Please read the actual agreement that controls your use of the Datasets, which is available here: Terms of use for datasets. Also see World Bank Terms and Conditions.",GNI per capita based on purchasing power parity (PPP). PPP GNI is gross national income (GNI) converted to international dollars using purchasing power parity rates. An international dollar has the same purchasing power over GNI as a U.S. dollar has in the United States. GNI is the sum of value added by all resident producers plus any product taxes (less subsidies) not included in the valuation of output plus net receipts of primary income (compensation of employees and property income) from abroad. Data are in current international dollars.,,,,,,,,,,,,,,,,,,,,,,,,,,,,,,,,,,,,,,3680.0,3670.0,3540.0,3390.0,3330.0,3160.0,3200.0,3140.0,3040.0,2860.0,2840.0,2730.0,2680.0,2580.0,2400.0,2340.0,2400.0,2390.0,2440.0,2380.0,2380.0,,,,,,,,,,,,,,,,,,,,,,,,,,,,,,,,,,,,,,,,,,,
PSP090,Population density ,world-bank,People per square km,Population density,http://data.worldbank.org/indicator/EN.POP.DNST,"You are free to copy, distribute, adapt, display or include the data in other products for commercial and noncommercial purposes at no cost subject to certain limitations summarized below.
You must include attribution for the data you use in the manner indicated in the metadata included with the data.
You must not claim or imply that The World Bank endorses your use of the data by or use The World Bank’s logo(s) or trademark(s) in conjunction with such use.
Other parties may have ownership interests in some of the materials contained on The World Bank Web site. For example, we maintain a list of some specific data within the Datasets that you may not redistribute or reuse without first contacting the original content provider, as well as information regarding how to contact the original content provider. Before incorporating any data in other products, please check the list: Terms of use: Restricted Data
The World Bank makes no warranties with respect to the data and you agree The World Bank shall not be liable to you in connection with your use of the data.
This is only a summary of the Terms of Use for Datasets Listed in The World Bank Data Catalogue. Please read the actual agreement that controls your use of the Datasets, which is available here: Terms of use for datasets. Also see World Bank Terms and Conditions.","Population density is midyear population divided by land area in square kilometers. Population is based on the de facto definition of population, which counts all residents regardless of legal status or citizenship--except for refugees not permanently settled in the country of asylum, who are generally considered part of the population of their country of origin. Land area is a country's total area, excluding area under inland water bodies, national claims to continental shelf, and exclusive economic zones. In most cases the definition of inland water bodies includes major rivers and lakes. Food and Agriculture Organization and World Bank population estimates.",,,,,,,,,,,,,,,,,,,,,,,,,,,,,,,,,,,,,,147.927142857143,147.707142857143,147.748571428571,148.027142857143,148.547142857143,149.282857142857,150.138571428571,150.98,151.711428571429,152.25,152.594285714286,152.832857142857,153.1,153.471428571429,154.011428571429,154.622857142857,155.008571428571,154.774285714286,153.651428571429,151.51,148.481428571429,144.874285714286,141.142857142857,137.615714285714,134.415714285714,131.457142857143,128.605714285714,125.64,122.412857142857,118.917142857143,115.254285714286,111.51,107.802857142857,104.238571428571,100.785714285714,97.4585714285714,94.4428571428571,91.98,90.2085714285714,89.2528571428571,88.9842857142857,88.9971428571429,88.7242857142857,87.7614285714286,85.9528571428571,83.4342857142857,80.4628571428571,77.43,74.6257142857143,72.1185714285714,69.8214285714286,67.6957142857143,65.6514285714286,,,,,,,,,,,
PSP010,"Total population (both sexes combined) by major area, region and country, annually for 1950-2010",esa-unpd-wpp2012,People,Total Population - Both Sexes.,http://esa.un.org/wpp/Excel-Data/population.htm,"The United Nations maintains this web site (the “Site”) as a courtesy to those who may choose to access the Site (“Users”). The information presented herein is for informative purposes only. The United Nations grants permission to Users to visit the Site and to download and copy the information, documents and materials (collectively, “Materials”) from the Site for the User’s personal, non-commercial use, without any right to resell or redistribute them or to compile or create derivative works therefrom, subject to the terms and conditions outlined below, and also subject to more specific restrictions that may apply to specific Material within this Site.","Total Population - Both Sexes. De facto population in a country, area or region as of 1 July of the year indicated. Figures are presented in thousands.",,,,,,,,,,,,,,,,,,,,,,,,,,,,,,,,,,,,,,,,,103619.0,103983.0,104498.0,105097.0,105686.0,106198.0,106575.0,106816.0,106983.0,107170.0,107430.0,107808.0,108236.0,108506.0,108342.0,107556.0,106057.0,103937.0,101412.0,98800.0,96331.0,94091.0,92020.0,90024.0,87948.0,85689.0,83242.0,80678.0,78057.0,75462.0,72967.0,70550.0,68221.0,66110.0,64385.99999999999,63146.0,62477.0,62289.0,62298.0,62107.0,61433.0,60167.0,58404.0,56324.0,54201.0,52238.0,50483.0,48875.0,47387.0,45956.0,44539.0,43123.0,41725.0,40372.0,39092.0,37896.0,36774.0,35694.0,34596.0,33400.0,32000.0
