Indicator ID,Indicator name,Source dataset,Units,Dataset summary,More Info,Terms of Use,HDX Methodology,2050,2049,2048,2047,2046,2045,2044,2043,2042,2041,2040,2039,2038,2037,2036,2035,2034,2033,2032,2031,2030,2029,2028,2027,2026,2025,2024,2023,2022,2021,2020,2019,2018,2017,2016,2015,2014,2013,2012,2011,2010,2009,2008,2007,2006,2005,2004,2003,2002,2001,2000,1999,1998,1997,1996,1995,1994,1993,1992,1991,1990,1989,1988,1987,1986,1985,1984,1983,1982,1981,1980,1979,1978,1977,1976,1975,1974,1973,1972,1971,1970,1969,1968,1967,1966,1965,1964,1963,1962,1961,1960,1959,1958,1957,1956,1955,1954,1953,1952,1951,1950
PSE130,"Household final consumption expenditure, PPP ",world-bank,Constant (2005) international US$,Household final consumption expenditure in PPP,http://data.worldbank.org/indicator/NE.CON.PRVT.PP.KD,"You are free to copy, distribute, adapt, display or include the data in other products for commercial and noncommercial purposes at no cost subject to certain limitations summarized below.
You must include attribution for the data you use in the manner indicated in the metadata included with the data.
You must not claim or imply that The World Bank endorses your use of the data by or use The World Bank’s logo(s) or trademark(s) in conjunction with such use.
Other parties may have ownership interests in some of the materials contained on The World Bank Web site. For example, we maintain a list of some specific data within the Datasets that you may not redistribute or reuse without first contacting the original content provider, as well as information regarding how to contact the original content provider. Before incorporating any data in other products, please check the list: Terms of use: Restricted Data
The World Bank makes no warranties with respect to the data and you agree The World Bank shall not be liable to you in connection with your use of the data.
This is only a summary of the Terms of Use for Datasets Listed in The World Bank Data Catalogue. Please read the actual agreement that controls your use of the Datasets, which is available here: Terms of use for datasets. Also see World Bank Terms and Conditions.","Household final consumption expenditure (formerly private consumption) is the market value of all goods and services, including durable products (such as cars, washing machines, and home computers), purchased by households. It excludes purchases of dwellings but includes imputed rent for owner-occupied dwellings. It also includes payments and fees to governments to obtain permits and licenses. Here, household consumption expenditure includes the expenditures of nonprofit institutions serving households, even when reported separately by the country. Data are converted to constant 2005 international dollars using purchasing power parity rates.",,,,,,,,,,,,,,,,,,,,,,,,,,,,,,,,,,,,,,,3.43131681260751E10,3.23715987293495E10,2.89271978345784E10,2.72524212022287E10,2.63561585856362E10,2.51254781127778E10,2.37073459201784E10,2.19336458712677E10,1.97222050470865E10,1.85783703501388E10,1.80852826942563E10,1.71145010157109E10,1.65864266901898E10,1.63124375686237E10,1.56209776269308E10,1.36763100610701E10,1.2581360090956E10,1.17413618953371E10,1.12590126536256E10,1.10808844775704E10,1.08833751261617E10,1.08669712374087E10,1.06572550109385E10,,,,,,,,,,,,,,,,,,,,,,,,,,,,,,,,,,,,,,,,
PVE110,Mean years of schooling (of adults),data.undp.org,Years,Mean years of schooling,https://data.undp.org/dataset/Mean-years-of-schooling-of-adults-years-/m67k-vi5c,"The information in the various pages of the UNDP Web site is issued by the United Nations Development Programme for general distribution. The information presented is protected under the Berne Convention for the Protection of Literature and Artistic works, under other international conventions and under national laws on copyright and neighboring rights. Extracts of the information in the Web site may be reviewed, reproduced or translated for research or private study but not for sale or for use in conjunction with commercial purposes. Any use of information in the Web site should be accompanied by an acknowledgment of UNDP as the source, citing the uniform resource locator (URL) of the article. Reproduction or translation of substantial portions of the Web site, or any use other than for educational or other non-commercial purposes, require explicit, prior authorization in writing. Applications and enquiries should be addressed to the programme responsible for the page used.","Average number of years of education received by people ages 25 and older, converted from education attainment levels using official durations of each level.",,,,,,,,,,,,,,,,,,,,,,,,,,,,,,,,,,,,,5.11,,5.1,5.1,5.1,5.0,5.0,4.9,4.8,4.8,,,,,4.6,,,,,,,,,,3.6,,,,,,,,,,2.5,,,,,,,,,,,,,,,,,,,,,,,,,,,,,,
PSE030,"GDP per capita, PPP ",world-bank,Current International US$,Gross domestic product per capita in PPP,http://data.worldbank.org/indicator/NY.GDP.PCAP.PP.CD,"You are free to copy, distribute, adapt, display or include the data in other products for commercial and noncommercial purposes at no cost subject to certain limitations summarized below.
You must include attribution for the data you use in the manner indicated in the metadata included with the data.
You must not claim or imply that The World Bank endorses your use of the data by or use The World Bank’s logo(s) or trademark(s) in conjunction with such use.
Other parties may have ownership interests in some of the materials contained on The World Bank Web site. For example, we maintain a list of some specific data within the Datasets that you may not redistribute or reuse without first contacting the original content provider, as well as information regarding how to contact the original content provider. Before incorporating any data in other products, please check the list: Terms of use: Restricted Data
The World Bank makes no warranties with respect to the data and you agree The World Bank shall not be liable to you in connection with your use of the data.
This is only a summary of the Terms of Use for Datasets Listed in The World Bank Data Catalogue. Please read the actual agreement that controls your use of the Datasets, which is available here: Terms of use for datasets. Also see World Bank Terms and Conditions.",GDP per capita based on purchasing power parity (PPP). PPP GDP is gross domestic product converted to international dollars using purchasing power parity rates. An international dollar has the same purchasing power over GDP as the U.S. dollar has in the United States. GDP at purchaser's prices is the sum of gross value added by all resident producers in the economy plus any product taxes and minus any subsidies not included in the value of the products. It is calculated without making deductions for depreciation of fabricated assets or for depletion and degradation of natural resources. Data are in current international dollars.,,,,,,,,,,,,,,,,,,,,,,,,,,,,,,,,,,,,,,2443.07223107863,2312.76840134863,2227.14073305681,2083.98229090368,1994.78849460836,1934.78934148983,1851.56144510064,1732.68294836585,1620.17702890357,1502.86234540937,1393.47273349126,1312.21934211516,1237.40311710481,1170.66454060576,1118.21041829848,1077.59395077742,1053.62418072699,1026.64623643583,991.307928676541,965.785166367989,961.139222830433,958.887513227845,963.800020754803,944.449053329481,576.035601427431,551.786103436905,,,,,,,,,,,,,,,,,,,,,,,,,,,,,,,,,,,,,,
PSE110,GNI per capita in PPP terms (constant 2005 international $),data.undp.org,Constant (2005) international US$,Gross national income in PPP terms (constant 2005 international $),http://data.worldbank.org/indicator/NY.GDP.PCAP.PP.KD,"The information in the various pages of the UNDP Web site is issued by the United Nations Development Programme for general distribution. The information presented is protected under the Berne Convention for the Protection of Literature and Artistic works, under other international conventions and under national laws on copyright and neighboring rights. Extracts of the information in the Web site may be reviewed, reproduced or translated for research or private study but not for sale or for use in conjunction with commercial purposes. Any use of information in the Web site should be accompanied by an acknowledgment of UNDP as the source, citing the uniform resource locator (URL) of the article. Reproduction or translation of substantial portions of the Web site, or any use other than for educational or other non-commercial purposes, require explicit, prior authorization in writing. Applications and enquiries should be addressed to the programme responsible for the page used.",GDP per capita based on purchasing power parity (PPP). PPP GDP is gross domestic product converted to international dollars using purchasing power parity rates. An international dollar has the same purchasing power over GDP as the U.S. dollar has in the United States. GDP at purchaser's prices is the sum of gross value added by all resident producers in the economy plus any product taxes and minus any subsidies not included in the value of the products. It is calculated without making deductions for depreciation of fabricated assets or for depletion and degradation of natural resources. Data are in constant 2005 international dollars.,,,,,,,,,,,,,,,,,,,,,,,,,,,,,,,,,,,,,,,1383.0,1324.0,1288.0,1230.0,1197.0,1149.0,1095.0,1050.0,,,,,857.0,,,,,,,,,,817.0,,,,,,,,,,,,,,,,,,,,,,,,,,,,,,,,,,,,,,,,
PVW010,Proportion of the population using improved drinking water sources,mdgs,Percentage,Proportion of the population using improved drinking water sources,http://unstats.un.org/unsd/mdg/Metadata.aspx?IndicatorId=0&SeriesId=665,"The United Nations maintains this web site (the “Site”) as a courtesy to those who may choose to access the Site (“Users”). The information presented herein is for informative purposes only. The United Nations grants permission to Users to visit the Site and to download and copy the information, documents and materials (collectively, “Materials”) from the Site for the User’s personal, non-commercial use, without any right to resell or redistribute them or to compile or create derivative works therefrom, subject to the terms and conditions outlined below, and also subject to more specific restrictions that may apply to specific Material within this Site.","The proportion of the population using an improved drinking water source, total, urban, and rural, is the percentage of the population who use any of the following types of water supply for drinking: piped water into dwelling, plot or yard; public tap/standpipe; borehole/tube well; protected dug well; protected spring; rainwater collection and bottled water (if a secondary available source is also improved). It does not include unprotected well, unprotected spring, water provided by carts with small tanks/drums, tanker truck-provided water and bottled water (if secondary source is not an improved source) or surface water taken directly from rivers, ponds, streams, lakes, dams, or irrigation channels. Definitions and a detailed description of these facilities can be found at the website of the WHO/UNICEF Joint Monitoring Programme for Water Supply and Sanitation at www.wssinfo.org.",,,,,,,,,,,,,,,,,,,,,,,,,,,,,,,,,,,,56.0,56.0,55.0,55.0,55.0,55.0,55.0,55.0,55.0,55.0,55.0,55.0,55.0,54.0,54.0,54.0,54.0,54.0,54.0,54.0,54.0,54.0,54.0,54.0,54.0,54.0,,,,,,,,,,,,,,,,,,,,,,,,,,,,,,,,,,,,,,,,
PVX040,Incidence of Conflict,acled,Incidents,Incidence of conflict,http://www.acleddata.com,"If using ACLED data, please cite: Raleigh, Clionadh, Andrew Linke, Håvard Hegre and Joakim Karlsen. 2010. Introducing ACLED-Armed Conflict Location and Event Data. Journal of Peace Research 47(5) 1-10.","The Armed Conflict Location and Event Database (ACLED) project codes reported information on the exact location, date, and other characteristics of politically violent events in unstable and warring states. ACLED focuses specifically on: 
- Tracking rebel, militia and government activity over time and space 
- Locating rebel group bases, headquarters, strongholds and presence 
- Distinguishing between territorial transfers of military control from governments 
to rebel groups and vice versa 
- Recording violent acts between militias 
- Collecting information on rioting and protesting 
- Non-violent events that are crucial to the dynamics of political violence (e.g. rallies, recruitment drives, peace talks, high-level arrests) 
ACLED data cover all countries on the African continent from 1997-present. Real-time data is available for African states. Data for additional countries including Haiti, Laos, Cambodia, Nepal, Myanmar are available from 1997-early 2010. Data for Afghanistan and Pakistan is available from 2006-2009 and Lebanon from 2006-2012.

Total number of incidents of all types are summed by country by year.  Non-violent incident categories are excluded from the sum.",,,,,,,,,,,,,,,,,,,,,,,,,,,,,,,,,,,,,106.0,111.0,139.0,90.0,7.0,14.0,37.0,10.0,21.0,125.0,63.0,11.0,36.0,60.0,32.0,15.0,10.0,16.0,,,,,,,,,,,,,,,,,,,,,,,,,,,,,,,,,,,,,,,,,,,,,,,
PVE130,Total net enrolment ratio in primary education,mdgs,Percentage,Total net enrolment ratio in primary education,http://mdgs.un.org/unsd/mdg/Metadata.aspx?IndicatorId=0&SeriesId=589,"The United Nations maintains this web site (the “Site”) as a courtesy to those who may choose to access the Site (“Users”). The information presented herein is for informative purposes only. The United Nations grants permission to Users to visit the Site and to download and copy the information, documents and materials (collectively, “Materials”) from the Site for the User’s personal, non-commercial use, without any right to resell or redistribute them or to compile or create derivative works therefrom, subject to the terms and conditions outlined below, and also subject to more specific restrictions that may apply to specific Material within this Site.",Net primary enrolment rate in primary education is the number of children of official primary school age (according to ISCED971) who are enrolled in primary education as a percentage of the total children of the official school age population. Total net primary enrolment rate also includes children of primary school age enrolled in secondary education. Where more than one system of primary education exists within the country the most widespread or common structure is used for determining the official school age group.,,,,,,,,,,,,,,,,,,,,,,,,,,,,,,,,,,,,,,84.5,87.6,,91.6,,97.8,,96.2,90.6,86.0,81.5,72.9,57.8,53.0,49.3,48.7,49.1,48.7,48.6,48.7,49.9,50.7,50.6,51.3,,,,,,,,,,,,,,,,,,,,,,,,,,,,,,,,,,,,,,,,
PVX020,GNA Crisis Index,echo,Index,GNA crisis index,http://ec.europa.eu,"Copyright notice

© European Union, 1995-2014 

Reuse is authorised, provided the source is acknowledged. The reuse policy of the European Commission is implemented by a Decision of 12 December 2011  [728KB] . 

The general principle of reuse can be subject to conditions which may be specified in individual copyright notices. Therefore users are advised to refer to the copyright notices of the individual websites maintained under Europa and of the individual documents. Reuse is not applicable to documents subject to intellectual property rights of third parties. ","The GNA Final Index lists countries in ranking order. The GNA Vulnerability Index and the GNA Crisis Index are shown, as well as the various dimensions. Each dimension has a value that is the result of combining indicators. Note that all values are the result of ranking countries. If countries are in the top quartile (25%), they score 3; in the bottom quartile, they score 1; in the middle 2 quartiles, they score 2.  Index value is taken directly from the source dataset. For the calculation methods see the Methodological notes on http://ec.europa.eu/echo/policies/strategy_en.htm.",,,,,,,,,,,,,,,,,,,,,,,,,,,,,,,,,,,,,,,0.0,,,,,,,,,,,,,,,,,,,,,,,,,,,,,,,,,,,,,,,,,,,,,,,,,,,,,,,,,,,,,,
PVW040,Proportion of the population using improved sanitation facilities,mdgs,Percentage,Proportion of the population using improved sanitation facilities,http://mdgs.un.org/unsd/mdg/Metadata.aspx?IndicatorId=0&SeriesId=668,"The United Nations maintains this web site (the “Site”) as a courtesy to those who may choose to access the Site (“Users”). The information presented herein is for informative purposes only. The United Nations grants permission to Users to visit the Site and to download and copy the information, documents and materials (collectively, “Materials”) from the Site for the User’s personal, non-commercial use, without any right to resell or redistribute them or to compile or create derivative works therefrom, subject to the terms and conditions outlined below, and also subject to more specific restrictions that may apply to specific Material within this Site.","The proportion of the population using an improved sanitation facility, total, urban, rural, is the percentage of the population with access to facilities that hygienically separate human excreta from human contact. Improved facilities include flush/pour flush toilets or latrines connected to a sewer, -septic tank, or -pit, ventilated improved pit latrines, pit latrines with a slab or platform of any material which covers the pit entirely, except for the drop hole and composting toilets/latrines. Unimproved facilities include public or shared facilities of an otherwise acceptable type, flush/pour-flush toilets or latrines which discharge directly into an open sewer or ditch, pit latrines without a slab, bucket latrines, hanging toilets or latrines which directly discharge in water bodies or in the open and the practice of open defecation in the bush, field or bodies or water. Definitions and a detailed description of these facilities can be found at the website of the WHO/UNICEF Joint Monitoring Programme for Water Supply and Sanitation at www.wssinfo.org.",,,,,,,,,,,,,,,,,,,,,,,,,,,,,,,,,,,,16.0,15.0,15.0,14.0,14.0,13.0,13.0,12.0,12.0,11.0,11.0,11.0,10.0,10.0,10.0,9.0,9.0,9.0,8.0,8.0,8.0,8.0,7.0,7.0,7.0,7.0,,,,,,,,,,,,,,,,,,,,,,,,,,,,,,,,,,,,,,,,
PVF020,Per capita food supply,faostat3,kcal/capita/day,"Estimates of per capita food supplies available for human consumption during the reference period in terms of quantity, caloric value, protein and fat content.",http://faostat3.fao.org/faostat-gateway/go/to/browse/C/*/E,"Content on www.fao.org, its affiliated websites and specific pages (collectively the FAO website) is protected by copyright. To ensure wide dissemination of its information, FAO is committed to making its content freely available and encourages the use, reproduction and dissemination of the text, multimedia and data products presented. Except where otherwise indicated, content may be copied, printed and downloaded for private study, research and teaching purposes, or for use in non-commercial products or services, provided that appropriate acknowledgement of FAO as the source and copyright holder is given and that FAO's endorsement of users' views, products or services is not stated or implied in any way. FAO encourages unrestricted use of news releases provided on the FAO website, and no formal permission is required to reproduce these materials.

All requests for translation and adaptation rights, and for resale and other commercial use rights should be addressed to copyright@fao.org or submitted via the online Licence Request Form when downloading.

RECOMMENDED CITATION:

[© FAO] [Year of publication] [Title of content] [Page number (for publications)] [Location on FAO website] [Date accessed and/or downloaded]","Estimates of per capita food supplies available for human consumption during the reference period in terms of quantity, caloric value, protein and fat content. Calorie supplies are reported in kilocalories (1 calorie = 4.19 kilojoules). Per capita supplies in terms of product weight are derived from the total supplies available for human consumption (i.e. Food) by dividing the quantities of Food by the total population actually partaking of the food supplies during the reference period, i.e. the present in-area (de facto) population within the present geographical boundaries of the country. In other words, nationals living abroad during the reference period are excluded, but foreigners living in the country are included. Adjustments are made wherever possible for part-time presence or absence, such as temporary migrants, tourists and refugees supported by special schemes (if it has not been possible to allow for the amounts provided by such schemes under imports). In almost all cases, the population figures used are the mid-year estimates published by the United Nations Population Division. Per capita supply figures shown in the commodity balances therefore represent only the average supply available for the population as a whole and do not necessarily indicate what is actually consumed by individuals. Even if they are taken as approximation to per capita consumption, it is important to note that the amount of food actually consumed may be lower than the quantity shown here, depending on the degree of losses of edible food and nutrients in the household, e.g. during storage, in preparation and cooking etc. In many cases commodities are not consumed in the primary form in which they are presented in the commodity balance, e.g. cereals enter the household mainly in processed form like flour, meal, husked or milled rice. To take this fact into account, the caloric value, the protein and fat content shown against primary commodities in the commodity balances have been derived by applying the appropriate food composition factors to the quantities of the processed commodities and not by multiplying the quantities shown in the commodity balance with the food composition factors relating to primary commodities.",,,,,,,,,,,,,,,,,,,,,,,,,,,,,,,,,,,,,,,,2167.0,2073.0,2125.0,2124.0,2216.0,2145.0,2139.0,2108.0,2035.0,2083.0,2035.0,2004.0,2059.0,2076.0,2003.0,2040.0,2030.0,2084.0,2100.0,2145.0,2231.0,2187.0,2272.0,2219.0,2271.0,2262.0,2257.0,2239.0,2202.0,2231.0,2198.0,2224.0,2235.0,2206.0,2218.0,2219.0,2167.0,1900.0,1815.0,1694.0,1677.0,1713.0,1708.0,1707.0,1714.0,1819.0,1742.0,1700.0,1782.0,1758.0,1746.0,,,,,,,,,,,
PVX010,GNA Vulnerability Index,echo,Index,GNA vulnerability index,http://ec.europa.eu,"Copyright notice

© European Union, 1995-2014 

Reuse is authorised, provided the source is acknowledged. The reuse policy of the European Commission is implemented by a Decision of 12 December 2011  [728KB] . 

The general principle of reuse can be subject to conditions which may be specified in individual copyright notices. Therefore users are advised to refer to the copyright notices of the individual websites maintained under Europa and of the individual documents. Reuse is not applicable to documents subject to intellectual property rights of third parties. ","The GNA Final Index lists countries in ranking order. The GNA Vulnerability Index and the GNA Crisis Index are shown, as well as the various dimensions. Each dimension has a value that is the result of combining indicators. Note that all values are the result of ranking countries. If countries are in the top quartile (25%), they score 3; in the bottom quartile, they score 1; in the middle 2 quartiles, they score 2. Index value is taken directly from the source dataset. For the calculation methods see the Methodological notes on http://ec.europa.eu/echo/policies/strategy_en.htm",,,,,,,,,,,,,,,,,,,,,,,,,,,,,,,,,,,,,,,3.0,,,,,,,,,,,,,,,,,,,,,,,,,,,,,,,,,,,,,,,,,,,,,,,,,,,,,,,,,,,,,,
PVN050,Children under 5 moderately or severely underweight,mdgs,Percentage,Percentage of children under 5 moderately or severely underweight,http://mdgs.un.org/unsd/mdg/Metadata.aspx?IndicatorId=0&SeriesId=559,"The United Nations maintains this web site (the “Site”) as a courtesy to those who may choose to access the Site (“Users”). The information presented herein is for informative purposes only. The United Nations grants permission to Users to visit the Site and to download and copy the information, documents and materials (collectively, “Materials”) from the Site for the User’s personal, non-commercial use, without any right to resell or redistribute them or to compile or create derivative works therefrom, subject to the terms and conditions outlined below, and also subject to more specific restrictions that may apply to specific Material within this Site.","Prevalence of (moderately and severely) underweight children is the percentage of children aged 0-59 months whose weights for age are less than two standard deviations below the median weight for age of the international reference population. The international reference population, often referred to as the NCHS/WHO reference population, was formulated by the National Center for Health Statistics (NCHS) as a reference for the United States and later adopted by the World Health Organization (WHO).

The NCHS/WHO reference standard represents the distribution of height and weight by age and sex in a well-nourished population. In a well-nourished population, 2.3 percent of children fall below minus two standard deviations.

A new standard reference population, the WHO Child Growth Standards, was released in April 2006 and is also being used to estimate underweight prevalence (see Comments and Limitations below).

Percentage of children under five that are underweight =        (Number of children under age five that fall below minus two standard deviations from the median weight for age of the NCHS/WHO standard (moderate and severe))*100/ Total number of children under age five that were weighted.",,,,,,,,,,,,,,,,,,,,,,,,,,,,,,,,,,,,,13.4,,,13.6,16.2,15.9,,,,16.7,16.7,,,,,25.3,,,26.9,,,,25.1,,,,,,,,,,,,,,,,,,,,,,,,,,,,,,,,,,,,,,,,,,
