Indicator ID,Indicator name,Source dataset,Units,Dataset summary,More Info,Terms of Use,HDX Methodology,2050,2049,2048,2047,2046,2045,2044,2043,2042,2041,2040,2039,2038,2037,2036,2035,2034,2033,2032,2031,2030,2029,2028,2027,2026,2025,2024,2023,2022,2021,2020,2019,2018,2017,2016,2015,2014,2013,2012,2011,2010,2009,2008,2007,2006,2005,2004,2003,2002,2001,2000,1999,1998,1997,1996,1995,1994,1993,1992,1991,1990,1989,1988,1987,1986,1985,1984,1983,1982,1981,1980,1979,1978,1977,1976,1975,1974,1973,1972,1971,1970,1969,1968,1967,1966,1965,1964,1963,1962,1961,1960,1959,1958,1957,1956,1955,1954,1953,1952,1951,1950
PCH110,Number of infant deaths,world-bank,Deaths,Number of infants dying before reaching one year of age,http://data.worldbank.org/indicator/SP.DYN.IMRT.IN,"You are free to copy, distribute, adapt, display or include the data in other products for commercial and noncommercial purposes at no cost subject to certain limitations summarized below.
You must include attribution for the data you use in the manner indicated in the metadata included with the data.
You must not claim or imply that The World Bank endorses your use of the data by or use The World Bank’s logo(s) or trademark(s) in conjunction with such use.
Other parties may have ownership interests in some of the materials contained on The World Bank Web site. For example, we maintain a list of some specific data within the Datasets that you may not redistribute or reuse without first contacting the original content provider, as well as information regarding how to contact the original content provider. Before incorporating any data in other products, please check the list: Terms of use: Restricted Data
The World Bank makes no warranties with respect to the data and you agree The World Bank shall not be liable to you in connection with your use of the data.
This is only a summary of the Terms of Use for Datasets Listed in The World Bank Data Catalogue. Please read the actual agreement that controls your use of the Datasets, which is available here: Terms of use for datasets. Also see World Bank Terms and Conditions.","Infant mortality rate (IMR) is the number of deaths of children less than one year of age per 1000 live births. The rate for a given region is the number of children dying under one year of age, divided by the number of live births during the year, multiplied by 1,000.",,,,,,,,,,,,,,,,,,,,,,,,,,,,,,,,,,,,72069.0,72398.0,73156.0,73236.0,74016.0,75614.0,79535.0,82636.0,86578.0,91065.0,94649.0,97783.0,100530.0,102805.0,105094.0,107584.0,110463.0,113358.0,116048.0,117614.0,118158.0,117509.0,115933.0,113737.0,111370.0,109333.0,107437.0,105882.0,104559.0,103125.0,101576.0,99543.0,97437.0,95242.0,93396.0,91853.0,90451.0,89338.0,88508.0,87643.0,86781.0,85682.0,84486.0,83295.0,82066.0,80903.0,79477.0,78077.0,76899.0,75763.0,74859.0,73874.0,73012.0,72192.0,71112.0,69926.0,,,,,,,,,,
TT026F,Percentage of children less than 5 wasted (Female),who-gho,Percentage,Percentage of (weight-for-height less than -2 standard deviations of the WHO Child Growth Standards median) among children aged 0-5 years,http://apps.who.int/gho/indicatorregistry/App_Main/view_indicator.aspx?iid=302,The information in this database is provided as a service to our users. Any use of information in the web site should be accompanied by an acknowledgment of WHO as the source. The responsibility for the interpretation and use of the material lies with the user. In no event shall the World Health Organization be liable for any damages arising from the use of the information linked to this section.,"Percentage of children aged <5 years wasted = (Number of children aged 0-5 years that fall below minus two standard deviations from the median weight-for-height of the WHO Child Growth Standards / Total number of children aged 0-5 years that were measured) * 100
Children`s weight and height are measured using standard technology, e.g. children less than 24 months are measured lying down, while standing height is measured for children 24 months and older.

The data sources include national nutrition surveys, any other nationally-representative population-based surveys with nutrition modules, and national surveillance systems.",,,,,,,,,,,,,,,,,,,,,,,,,,,,,,,,,,,,,,,,6.8,4.0,2.7,,,,3.1,,,,,,5.1,,,7.3,,,,6.8,,,,,,,,,,,,,,,,,,,,,,,,,,,,,,,,,,,,,,,,,,
TT033U5,"Proportion of births attended by skilled health personnel (5 years before survey, urban)",who-gho,Percentage,The proportion of births attended by skilled health personnel.,http://apps.who.int/gho/indicatorregistry/App_Main/view_indicator.aspx?iid=25,The information in this database is provided as a service to our users. Any use of information in the web site should be accompanied by an acknowledgment of WHO as the source. The responsibility for the interpretation and use of the material lies with the user. In no event shall the World Health Organization be liable for any damages arising from the use of the information linked to this section.,"The percentage of births attended by skilled health personnel is calculated as the number of births attended by skilled health personnel (doctors, nurses or midwives) expressed as total number of births in the same period.

Births attended by skilled health personnel = (Number of births attended by skilled health personnel / Total number of live births) x 100

In household surveys, such as the Demographic and Health Surveys, the Multiple Indicator Cluster Surveys, and the Reproductive Health Surveys, the respondent is asked about each live birth and who had helped them during delivery for a period up to five years before the interview. 

Service/facility records could be used where a high proportion of births occur in health facilities and therefore they are recorded.",,,,,,,,,,,,,,,,,,,,,,,,,,,,,,,,,,,,,,,,,83.0,,,,,,80.9,,,,,83.3,,,80.1,,,,,,,,,,,,,,,,,,,,,,,,,,,,,,,,,,,,,,,,,,,,,,
TT024F,Percentage of children less than 5 stunted (Female),who-gho,Percentage,Percentage of stunting (height-for-age less than -2 standard deviations of the WHO Child Growth Standards median) among children aged 0-5 years,http://apps.who.int/gho/indicatorregistry/App_Main/view_indicator.aspx?iid=72,The information in this database is provided as a service to our users. Any use of information in the web site should be accompanied by an acknowledgment of WHO as the source. The responsibility for the interpretation and use of the material lies with the user. In no event shall the World Health Organization be liable for any damages arising from the use of the information linked to this section.,"Percentage of children aged <5 years stunted for age = (Number of children aged 0-5 years that fall below minus two standard deviations from the median height-for-age of the WHO Child Growth Standards / Total number of children aged 0-5 years that were measured) * 100.

Children`s weight and height are measured using standard technology, e.g. children less than 24 months are measured lying down, while standing height is measured for children 24 months and older.

The data sources include national nutrition surveys, any other nationally-representative population-based surveys with nutrition modules, and national surveillance systems.",,,,,,,,,,,,,,,,,,,,,,,,,,,,,,,,,,,,,,,,34.2,39.2,40.7,,,,41.8,,,,,,45.5,,,46.7,,,,47.0,,,,,,,,,,,,,,,,,,,,,,,,,,,,,,,,,,,,,,,,,,
TT037R5,Antenatal care coverage - at least four visits in the five years preceding the study (Rural),who-gho,Percentage,The percentage of women aged 15-49 with a live birth in a given time period that received antenatal care four or more times.,http://apps.who.int/gho/indicatorregistry/App_Main/view_indicator.aspx?iid=80,The information in this database is provided as a service to our users. Any use of information in the web site should be accompanied by an acknowledgment of WHO as the source. The responsibility for the interpretation and use of the material lies with the user. In no event shall the World Health Organization be liable for any damages arising from the use of the information linked to this section.,"WHO and UNICEF compiles empirical data from household surveys. At the global level, data from facility reporting are not used. Before data are included into the global databases, UNICEF and WHO undertake a process of data verification that includes correspondence with field offices to clarify any questions regarding estimates.

Predominant type of statistics: adjusted",,,,,,,,,,,,,,,,,,,,,,,,,,,,,,,,,,,,,,,,,39.2,,,,,,58.6,,,,,65.3,,,68.1,,,,,,,,,,,,,,,,,,,,,,,,,,,,,,,,,,,,,,,,,,,,,,
TT019,Total number of reported deaths of cholera,who-gho,Deaths,Reported cholera deaths.,http://apps.who.int/gho/indicatorregistry/App_Main/view_indicator.aspx?iid=2446,The information in this database is provided as a service to our users. Any use of information in the web site should be accompanied by an acknowledgment of WHO as the source. The responsibility for the interpretation and use of the material lies with the user. In no event shall the World Health Organization be liable for any damages arising from the use of the information linked to this section.,WHO transmits data as reported by national authorities (Ministries of Health).,,,,,,,,,,,,,,,,,,,,,,,,,,,,,,,,,,,,,,17.0,4.0,11.0,59.0,113.0,88.0,65.0,254.0,94.0,272.0,32.0,297.0,52.0,156.0,584.0,608.0,2231.0,36.0,96.0,155.0,74.0,2173.0,572.0,81.0,232.0,580.0,232.0,215.0,250.0,338.0,127.0,324.0,330.0,587.0,305.0,733.0,26.0,,,6.0,,,,,,,,,,,,,,,,,,,,,,,,
PVH080,"Mortality rate, adult, female ",world-bank,"Deaths per 1,000 female adults","Mortality rate, adult, female",http://esa.un.org/wpp/unpp/panel_population.htm,"You are free to copy, distribute, adapt, display or include the data in other products for commercial and noncommercial purposes at no cost subject to certain limitations summarized below.
You must include attribution for the data you use in the manner indicated in the metadata included with the data.
You must not claim or imply that The World Bank endorses your use of the data by or use The World Bank’s logo(s) or trademark(s) in conjunction with such use.
Other parties may have ownership interests in some of the materials contained on The World Bank Web site. For example, we maintain a list of some specific data within the Datasets that you may not redistribute or reuse without first contacting the original content provider, as well as information regarding how to contact the original content provider. Before incorporating any data in other products, please check the list: Terms of use: Restricted Data
The World Bank makes no warranties with respect to the data and you agree The World Bank shall not be liable to you in connection with your use of the data.
This is only a summary of the Terms of Use for Datasets Listed in The World Bank Data Catalogue. Please read the actual agreement that controls your use of the Datasets, which is available here: Terms of use for datasets. Also see World Bank Terms and Conditions.","Adult mortality rate is the probability of dying between the ages of 15 and 60--that is, the probability of a 15-year-old dying before reaching age 60, if subject to current age-specific mortality rates between those ages.",,,,,,,,,,,,,,,,,,,,,,,,,,,,,,,,,,,,,,267.7052,270.576,288.4838,306.3916,324.2994,342.2072,360.115,375.6594,391.2038,406.7482,422.2926,437.837,436.762,435.687,434.612,433.537,432.462,420.4888,408.5156,396.5424,384.5692,372.596,362.0732,351.5504,341.0276,330.5048,319.982,318.9616,317.9412,316.9208,315.9004,314.88,316.1572,317.4344,318.7116,319.9888,321.266,325.5582,329.8504,334.1426,338.4348,342.727,346.2224,349.7178,353.2132,356.7086,360.204,363.3362,366.4684,369.6006,372.7328,375.865,378.5974,381.3298,,,,,,,,,,
TT037R3,Antenatal care coverage - at least four visits in the three years preceding the study (Rural),who-gho,Percentage,The percentage of women aged 15-49 with a live birth in a given time period that received antenatal care four or more times.,http://apps.who.int/gho/indicatorregistry/App_Main/view_indicator.aspx?iid=80,The information in this database is provided as a service to our users. Any use of information in the web site should be accompanied by an acknowledgment of WHO as the source. The responsibility for the interpretation and use of the material lies with the user. In no event shall the World Health Organization be liable for any damages arising from the use of the information linked to this section.,"WHO and UNICEF compiles empirical data from household surveys. At the global level, data from facility reporting are not used. Before data are included into the global databases, UNICEF and WHO undertake a process of data verification that includes correspondence with field offices to clarify any questions regarding estimates.

Predominant type of statistics: adjusted",,,,,,,,,,,,,,,,,,,,,,,,,,,,,,,,,,,,,,,,,36.3,,,,,,57.1,,,,,64.6,,,67.6,,,,,,,,,,,,,,,,,,,,,,,,,,,,,,,,,,,,,,,,,,,,,,
PVX100,Total number of people affected by disasters,emdat,People,"Total affected includes the total number of injured, homeless, and affected people.",http://www.emdat.be/explanatory-notes,"The EM-DAT database is protected by the law of June 30th, 1994 on copyrights and the law of August 31st, 1998 on the legal protection of databases. Access to the EM-DAT database is made available free of charge by the UCL. The reproduction and communication of the information from EM-DAT is authorized by any means and in all forms, provided that the source is clearly mentioned and as follows:
 
“EM-DAT: The OFDA/CRED International Disaster Database – www.emdat.be – Université catholique de Louvain – Brussels – Belgium.”

",Please visit http://www.emdat.be/explanatory-notes for explanatory notes.,,,,,,,,,,,,,,,,,,,,,,,,,,,,,,,,,,,,,,0.0,140.0,1068153.0,129.0,70648.0,10179.0,373.0,3722994.0,16151.0,254003.0,1902167.0,3654.0,1611.0,3623.0,629.0,45343.0,52533.0,3000024.0,21850.0,9647.0,201823.0,47.0,1733.0,962868.0,141056.0,116500.0,500.0,6000.0,118.0,1900074.0,79.0,40000.0,,0.0,90000.0,9000.0,26050.0,,,68000.0,,,,,,57000.0,53483.0,,,14400.0,,,,,,,,,,,,,,
TT016,Total number of suspected meningitis deaths reported,who-gho,Deaths,Suspected meningitis deaths,http://apps.who.int/gho/indicatorregistry/App_Main/view_indicator.aspx?iid=2478,The information in this database is provided as a service to our users. Any use of information in the web site should be accompanied by an acknowledgment of WHO as the source. The responsibility for the interpretation and use of the material lies with the user. In no event shall the World Health Organization be liable for any damages arising from the use of the information linked to this section.,WHO transmits data as reported by national authorities (Ministries of Health),,,,,,,,,,,,,,,,,,,,,,,,,,,,,,,,,,,,,,,,,,,,0.0,100.0,,,40.0,84.0,14.0,88.0,59.0,,26.0,,,,268.0,,,56.0,,,,,,,,114.0,,,,196.0,,,,,,,,,,,,,,,,,,,,,,,,,,,,
TT015,Total number of suspected meningitis cases reported,who-gho,Cases,"Suspected cases of meningitis, as per the meningitis clinical case definition.",http://apps.who.int/gho/indicatorregistry/App_Main/view_indicator.aspx?iid=49,The information in this database is provided as a service to our users. Any use of information in the web site should be accompanied by an acknowledgment of WHO as the source. The responsibility for the interpretation and use of the material lies with the user. In no event shall the World Health Organization be liable for any damages arising from the use of the information linked to this section.,"WHO compiles data as reported by National Authorities.

Predominant type of statistics: unadjusted",,,,,,,,,,,,,,,,,,,,,,,,,,,,,,,,,,,,,,,,,,,,44.0,533.0,,,125.0,857.0,119.0,462.0,560.0,,194.0,1286.0,,,2289.0,4279.0,6923.0,686.0,1249.0,,,,,,,679.0,124.0,,,6412.0,,,,124.0,,,,391.0,264.0,254.0,316.0,213.0,331.0,,,,,,,,,,,,,,,
TT018,Total number of reported cases of cholera,who-gho,Cases,"Confirmed cholera cases, including those confirmed clinically, epidemiologically, or by laboratory investigation.",http://apps.who.int/gho/indicatorregistry/App_Main/view_indicator.aspx?iid=42,The information in this database is provided as a service to our users. Any use of information in the web site should be accompanied by an acknowledgment of WHO as the source. The responsibility for the interpretation and use of the material lies with the user. In no event shall the World Health Organization be liable for any damages arising from the use of the information linked to this section.,WHO transmits data as reported by national authorities (ministries of health). Type of statistics: unadjusted,,,,,,,,,,,,,,,,,,,,,,,,,,,,,,,,,,,,,,270.0,286.0,942.0,4469.0,7700.0,2911.0,1609.0,14297.0,2945.0,10319.0,710.0,11920.0,1300.0,4637.0,12266.0,14488.0,40249.0,1464.0,2957.0,2240.0,792.0,18526.0,5676.0,2230.0,2150.0,5267.0,1892.0,1231.0,1984.0,2600.0,1816.0,4071.0,4241.0,5196.0,2559.0,6608.0,297.0,,,10.0,,,,,,,,,,,,,,,,,,,,,,,,
TT031U3,Antenatal care coverage - at least one visit in the three years preceding the study (Urban),who-gho,Percentage,"The percentage of women aged 15-49 with a live birth in a given time period that received antenatal care provided by skilled health personnel (doctors, nurses, or midwives) at least once during pregnancy.",http://apps.who.int/gho/indicatorregistry/App_Main/view_indicator.aspx?iid=81,The information in this database is provided as a service to our users. Any use of information in the web site should be accompanied by an acknowledgment of WHO as the source. The responsibility for the interpretation and use of the material lies with the user. In no event shall the World Health Organization be liable for any damages arising from the use of the information linked to this section.,UNICEF and the WHO produce regional and global estimates. These are based on population-weighted averages weighted by the total number of births. These estimates are presented only if available data cover at least 50% of total births in the regional or global groupings.,,,,,,,,,,,,,,,,,,,,,,,,,,,,,,,,,,,,,,,,,98.5,,,,,,96.4,,,,,74.8,,,75.9,,,,,,,,,,,,,,,,,,,,,,,,,,,,,,,,,,,,,,,,,,,,,,
TT014,Percentage of seats held by women in national parliament,mdgs,Percentage,"The proportion of seats held by women in national parliaments is the number of seats held by women members in single or lower chambers of national parliaments, expressed as a percentage of all occupied seats.",http://mdgs.un.org/unsd/mdg/Metadata.aspx?IndicatorId=0&SeriesId=557,"The United Nations maintains this web site (the “Site”) as a courtesy to those who may choose to access the Site (“Users”). The information presented herein is for informative purposes only. The United Nations grants permission to Users to visit the Site and to download and copy the information, documents and materials (collectively, “Materials”) from the Site for the User’s personal, non-commercial use, without any right to resell or redistribute them or to compile or create derivative works therefrom, subject to the terms and conditions outlined below, and also subject to more specific restrictions that may apply to specific Material within this Site.","The proportion of seats held by women in national parliaments is the number of seats held by women members in single or lower chambers of national parliaments, expressed as a percentage of all occupied seats.

National parliaments can be bicameral or unicameral. This indicator covers the single chamber in unicameral parliaments and the lower chamber in bicameral parliaments. It does not cover the upper chamber of bicameral parliaments. Seats are usually won by members in general parliamentary elections. Seats may also be filled by nomination, appointment, indirect election, rotation of members and by-election.

Seats refer to the number of parliamentary mandates, or the number of members of parliament.

The proportion of seats held by women in national parliament is derived by dividing the total number of seats occupied by women by the total number of seats in parliament.

There is no weighting or normalising of statistics.",,,,,,,,,,,,,,,,,,,,,,,,,,,,,,,,,,,,36.0,36.0,36.0,36.0,36.0,30.7,30.4,30.4,30.4,30.4,21.4,21.4,22.3,22.3,,16.4,17.5,17.5,17.5,,,,,,,,,,,,,,,,,,,,,,,,,,,,,,,,,,,,,,,,,,,,,,,
TT036,Share of women in wage employment in the non-agricultural sector (%),world-bank,Percentage,"Share of women employed in the nonagricultural sector is the share of female workers in the nonagricultural sector (industry and services), expressed as a percentage of total employment in the nonagricultural sector.",http://databank.worldbank.org/data/views/reports/tableview.aspx,"You are free to copy, distribute, adapt, display or include the data in other products for commercial and noncommercial purposes at no cost subject to certain limitations summarized below.
You must include attribution for the data you use in the manner indicated in the metadata included with the data.
You must not claim or imply that The World Bank endorses your use of the data by or use The World Bank’s logo(s) or trademark(s) in conjunction with such use.
Other parties may have ownership interests in some of the materials contained on The World Bank Web site. For example, we maintain a list of some specific data within the Datasets that you may not redistribute or reuse without first contacting the original content provider, as well as information regarding how to contact the original content provider. Before incorporating any data in other products, please check the list: Terms of use: Restricted Data
The World Bank makes no warranties with respect to the data and you agree The World Bank shall not be liable to you in connection with your use of the data.
This is only a summary of the Terms of Use for Datasets Listed in The World Bank Data Catalogue. Please read the actual agreement that controls your use of the Datasets, which is available here: Terms of use for datasets. Also see World Bank Terms and Conditions.","Employment is defined as persons above a specified age who performed any work at all, in the reference period, for pay or profit (or pay in kind), or were temporarily absent from a job for such reasons as illness, maternity or parental leave, holiday, training or industrial dispute. Unpaid family workers who work for at least one hour should be included in the count of employment, although many countries use a higher hour limit in their definition.The labor force is the supply of labor available for producing goods and services in an economy. It includes people who are currently employed and people who are unemployed but seeking work as well as first-time job-seekers. Not everyone who works is included, however. Unpaid workers, family workers, and students are often omitted, and some countries do not count members of the armed forces. Labor force size tends to vary during the year as seasonal workers enter and leave. Usually active population is measured in relation to a long reference period such as a year, and the currently active population (labor force) is measured in relation to a short reference period such as one day or one week. Labor force statistics by gender is important to monitor gender disparities in employment patterns. Estimates of women in the labor force and employment are generally lower than those of men and are not comparable internationally, reflecting that demographic, social, legal, and cultural trends and norms determine whether women's activities are regarded as economic.",,,,,,,,,,,,,,,,,,,,,,,,,,,,,,,,,,,,,,,,31.1,,,,,30.5,,,,,,,,,,,,,,,,,,,,,,,,,,,,,,,,,,,,,,,,,,,,,,,,,,,,,,,,
TT013,Total number of children with fever who received treatment with antimalarial,who-gho,People,Percentage of children aged < 5 years with fever in malaria-risk areas being treated with effective antimalarial drugs.,http://apps.who.int/gho/indicatorregistry/App_Main/view_indicator.aspx?iid=14,The information in this database is provided as a service to our users. Any use of information in the web site should be accompanied by an acknowledgment of WHO as the source. The responsibility for the interpretation and use of the material lies with the user. In no event shall the World Health Organization be liable for any damages arising from the use of the information linked to this section.,"Data from nationally-representative household surveys, including Multiple Indicator Cluster Surveys (MICS), Demographic Health Surveys (DHS) and Malaria Indicator Surveys (MIS), are compiled in the UNICEF global databases.

The data are reviewed in collaboration with Roll Back Malaria (RBM) partnership, launched in 1998 by the World Health Organization (WHO), the United Nations Children’s Fund (UNICEF), the United Nations Development Programme (UNDP) and the World Bank. 

Predominant type of statistics: adjusted",,,,,,,,,,,,,,,,,,,,,,,,,,,,,,,,,,,,,,,,,59.1,,,,,58.2,,,,,,53.4,,,,,,,,,,,,,,,,,,,,,,,,,,,,,,,,,,,,,,,,,,,,,,,,,
