Indicator ID,Indicator name,Source dataset,Units,Dataset summary,More Info,Terms of Use,HDX Methodology,2050,2049,2048,2047,2046,2045,2044,2043,2042,2041,2040,2039,2038,2037,2036,2035,2034,2033,2032,2031,2030,2029,2028,2027,2026,2025,2024,2023,2022,2021,2020,2019,2018,2017,2016,2015,2014,2013,2012,2011,2010,2009,2008,2007,2006,2005,2004,2003,2002,2001,2000,1999,1998,1997,1996,1995,1994,1993,1992,1991,1990,1989,1988,1987,1986,1985,1984,1983,1982,1981,1980,1979,1978,1977,1976,1975,1974,1973,1972,1971,1970,1969,1968,1967,1966,1965,1964,1963,1962,1961,1960,1959,1958,1957,1956,1955,1954,1953,1952,1951,1950
PVF020,Per capita food supply,faostat3,kcal/capita/day,"Estimates of per capita food supplies available for human consumption during the reference period in terms of quantity, caloric value, protein and fat content.",http://faostat3.fao.org/faostat-gateway/go/to/browse/C/*/E,"Content on www.fao.org, its affiliated websites and specific pages (collectively the FAO website) is protected by copyright. To ensure wide dissemination of its information, FAO is committed to making its content freely available and encourages the use, reproduction and dissemination of the text, multimedia and data products presented. Except where otherwise indicated, content may be copied, printed and downloaded for private study, research and teaching purposes, or for use in non-commercial products or services, provided that appropriate acknowledgement of FAO as the source and copyright holder is given and that FAO's endorsement of users' views, products or services is not stated or implied in any way. FAO encourages unrestricted use of news releases provided on the FAO website, and no formal permission is required to reproduce these materials.

All requests for translation and adaptation rights, and for resale and other commercial use rights should be addressed to copyright@fao.org or submitted via the online Licence Request Form when downloading.

RECOMMENDED CITATION:

[© FAO] [Year of publication] [Title of content] [Page number (for publications)] [Location on FAO website] [Date accessed and/or downloaded]","Estimates of per capita food supplies available for human consumption during the reference period in terms of quantity, caloric value, protein and fat content. Calorie supplies are reported in kilocalories (1 calorie = 4.19 kilojoules). Per capita supplies in terms of product weight are derived from the total supplies available for human consumption (i.e. Food) by dividing the quantities of Food by the total population actually partaking of the food supplies during the reference period, i.e. the present in-area (de facto) population within the present geographical boundaries of the country. In other words, nationals living abroad during the reference period are excluded, but foreigners living in the country are included. Adjustments are made wherever possible for part-time presence or absence, such as temporary migrants, tourists and refugees supported by special schemes (if it has not been possible to allow for the amounts provided by such schemes under imports). In almost all cases, the population figures used are the mid-year estimates published by the United Nations Population Division. Per capita supply figures shown in the commodity balances therefore represent only the average supply available for the population as a whole and do not necessarily indicate what is actually consumed by individuals. Even if they are taken as approximation to per capita consumption, it is important to note that the amount of food actually consumed may be lower than the quantity shown here, depending on the degree of losses of edible food and nutrients in the household, e.g. during storage, in preparation and cooking etc. In many cases commodities are not consumed in the primary form in which they are presented in the commodity balance, e.g. cereals enter the household mainly in processed form like flour, meal, husked or milled rice. To take this fact into account, the caloric value, the protein and fat content shown against primary commodities in the commodity balances have been derived by applying the appropriate food composition factors to the quantities of the processed commodities and not by multiplying the quantities shown in the commodity balance with the food composition factors relating to primary commodities.",,,,,,,,,,,,,,,,,,,,,,,,,,,,,,,,,,,,,,,,3024.0,3029.0,3026.0,3070.0,3094.0,3079.0,3065.0,3105.0,3108.0,3103.0,3086.0,3037.0,2982.0,2971.0,2967.0,2991.0,2967.0,3005.0,3008.0,3000.0,2989.0,2969.0,2978.0,3012.0,2949.0,3055.0,3099.0,3047.0,3108.0,3132.0,3138.0,2999.0,2848.0,2809.0,2728.0,2688.0,2715.0,2638.0,2614.0,2574.0,2535.0,2539.0,2511.0,2492.0,2457.0,2411.0,2369.0,2353.0,2300.0,2286.0,2300.0,,,,,,,,,,,
PVX010,GNA Vulnerability Index,echo,Index,GNA vulnerability index,http://ec.europa.eu,"Copyright notice

© European Union, 1995-2014 

Reuse is authorised, provided the source is acknowledged. The reuse policy of the European Commission is implemented by a Decision of 12 December 2011  [728KB] . 

The general principle of reuse can be subject to conditions which may be specified in individual copyright notices. Therefore users are advised to refer to the copyright notices of the individual websites maintained under Europa and of the individual documents. Reuse is not applicable to documents subject to intellectual property rights of third parties. ","The GNA Final Index lists countries in ranking order. The GNA Vulnerability Index and the GNA Crisis Index are shown, as well as the various dimensions. Each dimension has a value that is the result of combining indicators. Note that all values are the result of ranking countries. If countries are in the top quartile (25%), they score 3; in the bottom quartile, they score 1; in the middle 2 quartiles, they score 2. Index value is taken directly from the source dataset. For the calculation methods see the Methodological notes on http://ec.europa.eu/echo/policies/strategy_en.htm",,,,,,,,,,,,,,,,,,,,,,,,,,,,,,,,,,,,,,,2.0,,,,,,,,,,,,,,,,,,,,,,,,,,,,,,,,,,,,,,,,,,,,,,,,,,,,,,,,,,,,,,
PVN050,Children under 5 moderately or severely underweight,mdgs,Percentage,Percentage of children under 5 moderately or severely underweight,http://mdgs.un.org/unsd/mdg/Metadata.aspx?IndicatorId=0&SeriesId=559,"The United Nations maintains this web site (the “Site”) as a courtesy to those who may choose to access the Site (“Users”). The information presented herein is for informative purposes only. The United Nations grants permission to Users to visit the Site and to download and copy the information, documents and materials (collectively, “Materials”) from the Site for the User’s personal, non-commercial use, without any right to resell or redistribute them or to compile or create derivative works therefrom, subject to the terms and conditions outlined below, and also subject to more specific restrictions that may apply to specific Material within this Site.","Prevalence of (moderately and severely) underweight children is the percentage of children aged 0-59 months whose weights for age are less than two standard deviations below the median weight for age of the international reference population. The international reference population, often referred to as the NCHS/WHO reference population, was formulated by the National Center for Health Statistics (NCHS) as a reference for the United States and later adopted by the World Health Organization (WHO).

The NCHS/WHO reference standard represents the distribution of height and weight by age and sex in a well-nourished population. In a well-nourished population, 2.3 percent of children fall below minus two standard deviations.

A new standard reference population, the WHO Child Growth Standards, was released in April 2006 and is also being used to estimate underweight prevalence (see Comments and Limitations below).

Percentage of children under five that are underweight =        (Number of children under age five that fall below minus two standard deviations from the median weight for age of the NCHS/WHO standard (moderate and severe))*100/ Total number of children under age five that were weighted.",,,,,,,,,,,,,,,,,,,,,,,,,,,,,,,,,,,,,,,2.8,,,,,,3.4,,,,,,,6.0,6.0,,10.3,,,,,,,,,,,,,,,,,,,,,,,,,,,,,,,,,,,,,,,,,,,,,,
PVH140,"Children under five mortality rate per 1,000 live births",mdgs,"Deaths per 1,000 live births","Children under five mortality rate per 1,000 live births",http://mdgs.un.org/unsd/mdg/Metadata.aspx?IndicatorId=0&SeriesId=561,"The United Nations maintains this web site (the “Site”) as a courtesy to those who may choose to access the Site (“Users”). The information presented herein is for informative purposes only. The United Nations grants permission to Users to visit the Site and to download and copy the information, documents and materials (collectively, “Materials”) from the Site for the User’s personal, non-commercial use, without any right to resell or redistribute them or to compile or create derivative works therefrom, subject to the terms and conditions outlined below, and also subject to more specific restrictions that may apply to specific Material within this Site.","The under-five mortality rate (U5MR) is the probability (expressed as a rate per 1,000 live births) of a child born in a specified year dying before reaching the age of five if subject to current age-specific mortality rates.

A live birth is the complete expulsion or extraction from its mother of a product of conception, irrespective of the duration of the pregnancy, which, after such separation, breathes or shows any other evidence of life—such as beating of the heart, pulsation of the umbilical cord, or definite movement of voluntary muscles—whether or not the umbilical cord has been cut or the placenta is attached. Each product of such a birth is considered a live birth.",,,,,,,,,,,,,,,,,,,,,,,,,,,,,,,,,,,,,,14.5,15.3,16.0,16.8,17.4,17.9,18.4,18.9,19.5,20.4,21.4,22.6,24.0,25.6,27.3,29.0,30.9,32.9,35.0,37.1,39.3,41.6,44.0,46.4,,,,,,,,,,,,,,,,,,,,,,,,,,,,,,,,,,,,,,,,
PCX100,Internet users ,world-bank,Internet users per 100 people,Internet users are people with access to the worldwide network.,http://data.worldbank.org/indicator/IT.NET.USER.P2,"You are free to copy, distribute, adapt, display or include the data in other products for commercial and noncommercial purposes at no cost subject to certain limitations summarized below.
You must include attribution for the data you use in the manner indicated in the metadata included with the data.
You must not claim or imply that The World Bank endorses your use of the data by or use The World Bank’s logo(s) or trademark(s) in conjunction with such use.
Other parties may have ownership interests in some of the materials contained on The World Bank Web site. For example, we maintain a list of some specific data within the Datasets that you may not redistribute or reuse without first contacting the original content provider, as well as information regarding how to contact the original content provider. Before incorporating any data in other products, please check the list: Terms of use: Restricted Data
The World Bank makes no warranties with respect to the data and you agree The World Bank shall not be liable to you in connection with your use of the data.
This is only a summary of the Terms of Use for Datasets Listed in The World Bank Data Catalogue. Please read the actual agreement that controls your use of the Datasets, which is available here: Terms of use for datasets. Also see World Bank Terms and Conditions.","The Internet is a world-wide public computer network. It provides access to a number of communication services including the World Wide Web and carries e-mail, news, entertainment and data files, irrespective of the device used (not assumed to be only via a computer - it may also be by mobile-cellular telephone, other wireless devices, games machine, digital TV etc.). Access can be via a fixed or mobile network.

Individuals using the Internet refers to those that used the Internet in the last 12 months from any location. As of 2013, the definition has been updated and the reference period is the last three months instead of 12. While some countries already used the narrower reference period in the past, most countries may still take some time to adhere to the new reference period. Data are based on surveys generally carried out by national statistical offices or estimated based on the number of Internet subscriptions.",,,,,,,,,,,,,,,,,,,,,,,,,,,,,,,,,,,,,,43.46,39.75,37.1762954125184,31.05,26.34,21.71,20.81,19.52,17.21,14.1,12.9,11.9,7.0380231165045,5.08138415338066,1.85743622125093,1.26578327821238,0.627311539559522,0.20040628032987,0.102564189852775,0.0433391667851826,0.0283050415762566,0.0173078098676624,0.00588069493112912,0.0,,,,,,,,,,,,,,,,,,,,,,,,,,,,,,,,,,,,,,,,
PCX130,Logistics performance index: Overall ,world-bank,Range (1=low to 5=high),Logistics performance index,Details of the survey methodology and index construction methodology are in Arvis and others' Connecting to Compete 2010: Trade Logistics in the Global Economy (2010). http://data.worldbank.org/indicator/LP.LPI.OVRL.XQ,"You are free to copy, distribute, adapt, display or include the data in other products for commercial and noncommercial purposes at no cost subject to certain limitations summarized below.
You must include attribution for the data you use in the manner indicated in the metadata included with the data.
You must not claim or imply that The World Bank endorses your use of the data by or use The World Bank’s logo(s) or trademark(s) in conjunction with such use.
Other parties may have ownership interests in some of the materials contained on The World Bank Web site. For example, we maintain a list of some specific data within the Datasets that you may not redistribute or reuse without first contacting the original content provider, as well as information regarding how to contact the original content provider. Before incorporating any data in other products, please check the list: Terms of use: Restricted Data
The World Bank makes no warranties with respect to the data and you agree The World Bank shall not be liable to you in connection with your use of the data.
This is only a summary of the Terms of Use for Datasets Listed in The World Bank Data Catalogue. Please read the actual agreement that controls your use of the Datasets, which is available here: Terms of use for datasets. Also see World Bank Terms and Conditions.","Logistics Performance Index overall score reflects perceptions of a country's logistics based on efficiency of customs clearance process, quality of trade- and transport-related infrastructure, ease of arranging competitively priced shipments, quality of logistics services, ability to track and trace consignments, and frequency with which shipments reach the consignee within the scheduled time. The index ranges from 1 to 5, with a higher score representing better performance. Data are from Logistics Performance Index surveys conducted by the World Bank in partnership with academic and international institutions and private companies and individuals engaged in international logistics. 2009 round of surveys covered more than 5,000 country assessments by nearly 1,000 international freight forwarders. Respondents evaluate eight markets on six core dimensions on a scale from 1 (worst) to 5 (best). The markets are chosen based on the most important export and import markets of the respondent's country, random selection, and, for landlocked countries, neighboring countries that connect them with international markets. Scores for the six areas are averaged across all respondents and aggregated to a single score using principal components analysis.",,,,,,,,,,,,,,,,,,,,,,,,,,,,,,,,,,,,,3.128319,,3.06,,3.05,,,2.87,,,,,,,,,,,,,,,,,,,,,,,,,,,,,,,,,,,,,,,,,,,,,,,,,,,,,,,,,
PCX051,Mobile cellular subscriptions per 100 inhabitants,mdgs,Mobile cellular subscriptions per 100 people,Mobile cellular telephone subscriptions per 100 inhabitants.,http://mdgs.un.org/unsd/mdg/SeriesDetail.aspx?srid=756&crid=,"The United Nations maintains this web site (the “Site”) as a courtesy to those who may choose to access the Site (“Users”). The information presented herein is for informative purposes only. The United Nations grants permission to Users to visit the Site and to download and copy the information, documents and materials (collectively, “Materials”) from the Site for the User’s personal, non-commercial use, without any right to resell or redistribute them or to compile or create derivative works therefrom, subject to the terms and conditions outlined below, and also subject to more specific restrictions that may apply to specific Material within this Site.","Mobile cellular telephone subscriptions are subscriptions to a public mobile telephone service using cellular technology, which provide access to the public switched telephone network. Post-paid and prepaid subscriptions are included.",,,,,,,,,,,,,,,,,,,,,,,,,,,,,,,,,,,,,82.54,84.82,83.35,79.24,77.52,71.46,65.5,58.63,49.41,42.56,35.15,27.85,24.29,20.65,13.55,7.56,3.33,1.76,1.05,0.72,0.61,0.42,0.35,0.18,0.07,,,,,,,,,,,,,,,,,,,,,,,,,,,,,,,,,,,,,,,,
PVL030,"Roads, total network ",world-bank,km,"Roads, total network",http://data.worldbank.org/indicator/IS.ROD.TOTL.KM,"You are free to copy, distribute, adapt, display or include the data in other products for commercial and noncommercial purposes at no cost subject to certain limitations summarized below.
You must include attribution for the data you use in the manner indicated in the metadata included with the data.
You must not claim or imply that The World Bank endorses your use of the data by or use The World Bank’s logo(s) or trademark(s) in conjunction with such use.
Other parties may have ownership interests in some of the materials contained on The World Bank Web site. For example, we maintain a list of some specific data within the Datasets that you may not redistribute or reuse without first contacting the original content provider, as well as information regarding how to contact the original content provider. Before incorporating any data in other products, please check the list: Terms of use: Restricted Data
The World Bank makes no warranties with respect to the data and you agree The World Bank shall not be liable to you in connection with your use of the data.
This is only a summary of the Terms of Use for Datasets Listed in The World Bank Data Catalogue. Please read the actual agreement that controls your use of the Datasets, which is available here: Terms of use for datasets. Also see World Bank Terms and Conditions.","Total road network includes motorways, highways, and main or national roads, secondary or regional roads, and all other roads in a country. A motorway is a road designed and built for motor traffic that separates the traffic flowing in opposite directions.",,,,,,,,,,,,,,,,,,,,,,,,,,,,,,,,,,,,,,,,374262.0,371936.0,366807.0,364612.0,360075.0,356945.0,355796.0,352072.0,349037.0,337168.0,330005.0,323065.0,329532.0,318952.0,323977.0,312301.0,307983.0,303414.0,243203.0,243856.0,242294.0,239235.0,,,,,,,,,,,,,,,,,,,,,,,,,,,,,,,,,,,,,,,,
PCX080,Fixed telephone lines per 100 inhabitants,mdgs,Fixed telephone lines per 100 people,Fixed telephone lines per 100 inhabitants.,http://data.worldbank.org/indicator/IT.MLT.MAIN.P2,"The United Nations maintains this web site (the “Site”) as a courtesy to those who may choose to access the Site (“Users”). The information presented herein is for informative purposes only. The United Nations grants permission to Users to visit the Site and to download and copy the information, documents and materials (collectively, “Materials”) from the Site for the User’s personal, non-commercial use, without any right to resell or redistribute them or to compile or create derivative works therefrom, subject to the terms and conditions outlined below, and also subject to more specific restrictions that may apply to specific Material within this Site.",Telephone lines are fixed telephone lines that connect a subscriber's terminal equipment to the public switched telephone network and that have a port on a telephone exchange. Integrated services digital network channels ands fixed wireless subscribers are included.,,,,,,,,,,,,,,,,,,,,,,,,,,,,,,,,,,,,,17.04,17.2,17.04,16.75,16.9,16.75,17.82,17.61,17.71,17.62,16.52,15.11,14.03,13.08,11.87,10.68,9.86,9.35,9.08,9.23,9.08,8.31,7.52,6.85,6.22,,,,,,,,,,,,,,,,,,,,,,,,,,,,,,,,,,,,,,,,
PVL040,Rail lines ,world-bank,km,Rail lines,http://data.worldbank.org/indicator/IS.RRS.TOTL.KM,"You are free to copy, distribute, adapt, display or include the data in other products for commercial and noncommercial purposes at no cost subject to certain limitations summarized below.
You must include attribution for the data you use in the manner indicated in the metadata included with the data.
You must not claim or imply that The World Bank endorses your use of the data by or use The World Bank’s logo(s) or trademark(s) in conjunction with such use.
Other parties may have ownership interests in some of the materials contained on The World Bank Web site. For example, we maintain a list of some specific data within the Datasets that you may not redistribute or reuse without first contacting the original content provider, as well as information regarding how to contact the original content provider. Before incorporating any data in other products, please check the list: Terms of use: Restricted Data
The World Bank makes no warranties with respect to the data and you agree The World Bank shall not be liable to you in connection with your use of the data.
This is only a summary of the Terms of Use for Datasets Listed in The World Bank Data Catalogue. Please read the actual agreement that controls your use of the Datasets, which is available here: Terms of use for datasets. Also see World Bank Terms and Conditions.","Rail lines are the length of railway route available for train service, irrespective of the number of parallel tracks.",,,,,,,,,,,,,,,,,,,,,,,,,,,,,,,,,,,,,,,26704.0,26704.0,26704.0,26704.0,26677.0,26662.0,26662.0,26662.0,,,,,,,,,26613.0,20688.0,20477.0,20445.0,20425.0,20324.0,20351.0,20351.0,15825.0,15783.0,15783.0,15488.0,15486.0,15480.0,15482.0,14124.0,14225.0,,,,,,,,,,,,,,,,,,,,,,,,,,,,,,
PCX090,Mobile cellular subscriptions ,world-bank,Mobile cellular subscribers per 100 people,Mobile cellular subscriptions,http://data.worldbank.org/indicator/IT.CEL.SETS.P2,"You are free to copy, distribute, adapt, display or include the data in other products for commercial and noncommercial purposes at no cost subject to certain limitations summarized below.
You must include attribution for the data you use in the manner indicated in the metadata included with the data.
You must not claim or imply that The World Bank endorses your use of the data by or use The World Bank’s logo(s) or trademark(s) in conjunction with such use.
Other parties may have ownership interests in some of the materials contained on The World Bank Web site. For example, we maintain a list of some specific data within the Datasets that you may not redistribute or reuse without first contacting the original content provider, as well as information regarding how to contact the original content provider. Before incorporating any data in other products, please check the list: Terms of use: Restricted Data
The World Bank makes no warranties with respect to the data and you agree The World Bank shall not be liable to you in connection with your use of the data.
This is only a summary of the Terms of Use for Datasets Listed in The World Bank Data Catalogue. Please read the actual agreement that controls your use of the Datasets, which is available here: Terms of use for datasets. Also see World Bank Terms and Conditions.","Mobile cellular telephone subscriptions are subscriptions to a public mobile telephone service using cellular technology, which provide access to the public switched telephone network. Post-paid and prepaid subscriptions are included",,,,,,,,,,,,,,,,,,,,,,,,,,,,,,,,,,,,,,85.8364013608529,83.3507082650968,79.2411829391876,77.5182632596037,71.4581751168363,65.4994811210096,58.6272950897596,49.408753526036,42.5611567174915,35.1532182529869,27.8537176060571,24.29476814893,20.6546273069979,13.5528941437453,7.55656591659192,3.32688984273134,1.75895661731274,1.05132086754228,0.721767370602474,0.608553990916788,0.421293923943775,0.348322481105733,0.183067274908137,0.0742660606542486,0.0100798178081232,0.00181520417924865,0.0,0.0,0.0,0.0,0.0,0.0,0.0,0.0,0.0,0.0,0.0,0.0,0.0,,,,,0.0,,,,,0.0,,,,,0.0,,,,,,,,,,
