Indicator ID,Indicator name,Source dataset,Units,Dataset summary,More Info,Terms of Use,HDX Methodology,2050,2049,2048,2047,2046,2045,2044,2043,2042,2041,2040,2039,2038,2037,2036,2035,2034,2033,2032,2031,2030,2029,2028,2027,2026,2025,2024,2023,2022,2021,2020,2019,2018,2017,2016,2015,2014,2013,2012,2011,2010,2009,2008,2007,2006,2005,2004,2003,2002,2001,2000,1999,1998,1997,1996,1995,1994,1993,1992,1991,1990,1989,1988,1987,1986,1985,1984,1983,1982,1981,1980,1979,1978,1977,1976,1975,1974,1973,1972,1971,1970,1969,1968,1967,1966,1965,1964,1963,1962,1961,1960,1959,1958,1957,1956,1955,1954,1953,1952,1951,1950
CH100,Total cost of damage done by disasters,emdat,US$,Total cost of damage done by disasters,http://www.emdat.be/explanatory-notes,"The EM-DAT database is protected by the law of June 30th, 1994 on copyrights and the law of August 31st, 1998 on the legal protection of databases. Access to the EM-DAT database is made available free of charge by the UCL. The reproduction and communication of the information from EM-DAT is authorized by any means and in all forms, provided that the source is clearly mentioned and as follows:
 
“EM-DAT: The OFDA/CRED International Disaster Database – www.emdat.be – Université catholique de Louvain – Brussels – Belgium.”

","Several institutions have developed methodologies to quantify these losses in their specific domain. However, there is no standard procedure to determine a global figure for economic impact. Estimated damage are given (000’) US$.",,,,,,,,,,,,,,,,,,,,,,,,,,,,,,,,,,,,,,0.0,5.82E7,5.0E8,1.05E8,0.0,0.0,50000.0,3000000.0,0.0,1.3165E9,2.9E7,0.0,0.0,3000000.0,0.0,0.0,420000.0,0.0,400000.0,0.0,310000.0,2.5275E8,3.0E7,0.0,3.5E7,0.0,0.0,934000.0,0.0,2000000.0,0.0,1000000.0,0.0,0.0,0.0,1.0E8,0.0,,,0.0,,,,,8500000.0,,3000000.0,5000000.0,,3.73E7,,,,,,,0.0,,,,,,,
CH070,Number of disasters,emdat,Disasters,Total number of disasters,http://www.emdat.be/explanatory-notes,"The EM-DAT database is protected by the law of June 30th, 1994 on copyrights and the law of August 31st, 1998 on the legal protection of databases. Access to the EM-DAT database is made available free of charge by the UCL. The reproduction and communication of the information from EM-DAT is authorized by any means and in all forms, provided that the source is clearly mentioned and as follows:
 
“EM-DAT: The OFDA/CRED International Disaster Database – www.emdat.be – Université catholique de Louvain – Brussels – Belgium.”

",For a disaster to be entered into the database at least one of the following criteria must be fulfilled: Ten (10) or more people reported killed. Hundred (100) or more people reported affected. Declaration of a state of emergency. Call for international assistance.,,,,,,,,,,,,,,,,,,,,,,,,,,,,,,,,,,,,,,3.0,3.0,5.0,3.0,4.0,4.0,4.0,1.0,2.0,3.0,1.0,3.0,3.0,5.0,2.0,3.0,5.0,2.0,3.0,3.0,4.0,2.0,2.0,3.0,2.0,1.0,3.0,3.0,1.0,4.0,1.0,3.0,2.0,1.0,1.0,3.0,3.0,,,2.0,,,,,1.0,,2.0,1.0,,1.0,,,,,,,1.0,,,,,,,
CH090,People affected by disasters,emdat,People,Total number of people affected by disasters,http://www.emdat.be/explanatory-notes,"The EM-DAT database is protected by the law of June 30th, 1994 on copyrights and the law of August 31st, 1998 on the legal protection of databases. Access to the EM-DAT database is made available free of charge by the UCL. The reproduction and communication of the information from EM-DAT is authorized by any means and in all forms, provided that the source is clearly mentioned and as follows:
 
“EM-DAT: The OFDA/CRED International Disaster Database – www.emdat.be – Université catholique de Louvain – Brussels – Belgium.”

",People requiring immediate assistance during a period of emergency; it can also include displaced or evacuated people.,,,,,,,,,,,,,,,,,,,,,,,,,,,,,,,,,,,,,,188946.0,2247000.0,294943.0,239183.0,355007.0,826905.0,406000.0,333000.0,145000.0,731130.0,695000.0,500000.0,1000000.0,775113.0,5936.0,289485.0,6695.0,0.0,0.0,0.0,290130.0,394810.0,100000.0,440000.0,300000.0,806000.0,2200000.0,104485.0,8000.0,185000.0,1000000.0,2130000.0,20000.0,0.0,0.0,1002000.0,250728.0,,,0.0,,,,,1000000.0,,247000.0,252347.0,,280000.0,,,,,,,250000.0,,,,,,,
CH080,People killed in disasters,emdat,People,Total number of people killed in disasters,http://www.emdat.be/explanatory-notes,"The EM-DAT database is protected by the law of June 30th, 1994 on copyrights and the law of August 31st, 1998 on the legal protection of databases. Access to the EM-DAT database is made available free of charge by the UCL. The reproduction and communication of the information from EM-DAT is authorized by any means and in all forms, provided that the source is clearly mentioned and as follows:
 
“EM-DAT: The OFDA/CRED International Disaster Database – www.emdat.be – Université catholique de Louvain – Brussels – Belgium.”

",Persons confirmed as dead and persons missing and presumed dead (official figures when available).,,,,,,,,,,,,,,,,,,,,,,,,,,,,,,,,,,,,,,117.0,53.0,254.0,52.0,349.0,57.0,55.0,25.0,39.0,35493.0,235.0,25.0,13.0,52.0,7.0,58.0,211.0,20.0,123.0,0.0,133.0,15.0,47.0,58.0,377.0,0.0,77.0,104.0,0.0,51.0,3.0,54.0,7.0,0.0,0.0,750.0,27.0,,,218.0,,,,,62.0,,26.0,23.0,,206.0,,,,,,,200.0,,,,,,,
PVE040,"Adult literacy rate, both sexes",data.undp.org,Percentage,"Adult literacy rate, both sexes",https://data.undp.org/dataset/Adult-literacy-rate-both-sexes-aged-15-and-above-/x22y-8m6h,"The information in the various pages of the UNDP Web site is issued by the United Nations Development Programme for general distribution. The information presented is protected under the Berne Convention for the Protection of Literature and Artistic works, under other international conventions and under national laws on copyright and neighboring rights. Extracts of the information in the Web site may be reviewed, reproduced or translated for research or private study but not for sale or for use in conjunction with commercial purposes. Any use of information in the Web site should be accompanied by an acknowledgment of UNDP as the source, citing the uniform resource locator (URL) of the article. Reproduction or translation of substantial portions of the Web site, or any use other than for educational or other non-commercial purposes, require explicit, prior authorization in writing. Applications and enquiries should be addressed to the programme responsible for the page used.","Percentage of the population ages 15 and older who can, with understanding, both read and write a short simple statement on their everyday life.",,,,,,,,,,,,,,,,,,,,,,,,,,,,,,,,,,,,,91.2,,,,91.2,,,,,,,,,,,,,,,,,,,,,,,,,,,,,,,,,,,,,,,,,,,,,,,,,,,,,,,,,,,,
PSE240,"GII: Gender Inequality Index, value",data.undp.org,Index,"A composite measure reflecting inequality in achievements between women and men in three dimensions: reproductive health, empowerment and the labour market. ",See Technical notes at http://hdr.undp.org/en/media/HDR_2012_EN_TechNotes.pdf for details on how the Gender Inequality Index is calculated. ,"The information in the various pages of the UNDP Web site is issued by the United Nations Development Programme for general distribution. The information presented is protected under the Berne Convention for the Protection of Literature and Artistic works, under other international conventions and under national laws on copyright and neighboring rights. Extracts of the information in the Web site may be reviewed, reproduced or translated for research or private study but not for sale or for use in conjunction with commercial purposes. Any use of information in the Web site should be accompanied by an acknowledgment of UNDP as the source, citing the uniform resource locator (URL) of the article. Reproduction or translation of substantial portions of the Web site, or any use other than for educational or other non-commercial purposes, require explicit, prior authorization in writing. Applications and enquiries should be addressed to the programme responsible for the page used.","There is no country with perfect gender equality – hence all countries suffer some loss in their HDI achievement when gender inequality is taken into account, through use of the GII metric. The Gender Inequality Index is similar in method to the Inequality-adjusted Human Development Index (IHDI). It can be interpreted as a percentage loss to potential human development due to shortfalls in the dimensions included. Since the Gender Inequality Index includes different dimensions than the HDI, it cannot be interpreted as a loss in HDI itself. Unlike the HDI, higher GII values indicate lower achievement. The world average score on the GII is 0.463, reflecting a percentage loss in achievement across the three dimensions due to gender inequality of 46.3%. Regional averages range from 28.0% in Europe and Central Asia, to nearly 58% in Sub-Saharan Africa. At the country level losses due to gender inequality range from 4.5% in the Netherlands, to 74.7% in Yemen. Sub-Saharan Africa, South Asia and the Arab States suffer the largest losses due to gender inequality (57.7%, 56.8% and 55.5% respectively).",,,,,,,,,,,,,,,,,,,,,,,,,,,,,,,,,,,,,,,0.402,,0.412,,,,,0.446,,,,,,,,,,,,,,,,,,,,,,,,,,,,,,,,,,,,,,,,,,,,,,,,,,,,,,,
PSE210,GINI index,world-bank,Index,GINI Index,http://data.worldbank.org/indicator/SI.POV.GINI,"You are free to copy, distribute, adapt, display or include the data in other products for commercial and noncommercial purposes at no cost subject to certain limitations summarized below.
You must include attribution for the data you use in the manner indicated in the metadata included with the data.
You must not claim or imply that The World Bank endorses your use of the data by or use The World Bank’s logo(s) or trademark(s) in conjunction with such use.
Other parties may have ownership interests in some of the materials contained on The World Bank Web site. For example, we maintain a list of some specific data within the Datasets that you may not redistribute or reuse without first contacting the original content provider, as well as information regarding how to contact the original content provider. Before incorporating any data in other products, please check the list: Terms of use: Restricted Data
The World Bank makes no warranties with respect to the data and you agree The World Bank shall not be liable to you in connection with your use of the data.
This is only a summary of the Terms of Use for Datasets Listed in The World Bank Data Catalogue. Please read the actual agreement that controls your use of the Datasets, which is available here: Terms of use for datasets. Also see World Bank Terms and Conditions.","Gini index measures the extent to which the distribution of income or consumption expenditure among individuals or households within an economy deviates from a perfectly equal distribution. A Lorenz curve plots the cumulative percentages of total income received against the cumulative number of recipients, starting with the poorest individual or household. The Gini index measures the area between the Lorenz curve and a hypothetical line of absolute equality, expressed as a percentage of the maximum area under the line. Thus a Gini index of 0 represents perfect equality, while an index of 100 implies perfect inequality.",,,,,,,,,,,,,,,,,,,,,,,,,,,,,,,,,,,,,,,,,36.4,,,40.26,,,,,41.06,,,,,,35.41,,,,,32.48,,,,,,32.47,,,,,,,,,,,,,,,,,,,,,,,,,,,,,,,,,,,
PSE220,Human Development Index rank,data.undp.org,Index,Human development index rank,http://hdr.undp.org/en/statistics/hdi,"The information in the various pages of the UNDP Web site is issued by the United Nations Development Programme for general distribution. The information presented is protected under the Berne Convention for the Protection of Literature and Artistic works, under other international conventions and under national laws on copyright and neighboring rights. Extracts of the information in the Web site may be reviewed, reproduced or translated for research or private study but not for sale or for use in conjunction with commercial purposes. Any use of information in the Web site should be accompanied by an acknowledgment of UNDP as the source, citing the uniform resource locator (URL) of the article. Reproduction or translation of substantial portions of the Web site, or any use other than for educational or other non-commercial purposes, require explicit, prior authorization in writing. Applications and enquiries should be addressed to the programme responsible for the page used.","The Human Development Index (HDI) is a composite statistic of life expectancy, education, and income indices used to rank countries into four tiers of human development. It was created by the Pakistani economist Mahbub ul Haq and the Indian economist Amartya Sen in 1990 and was published by the United Nations Development Programme.",,,,,,,,,,,,,,,,,,,,,,,,,,,,,,,,,,,,,73.0,,92.0,,,,,,,,,,,,,,,,,,,,,,,,,,,,,,,,,,,,,,,,,,,,,,,,,,,,,,,,,,,,,,
PVE010,Public expenditure on education (% of GDP),data.undp.org,Percentage,Public expenditure on education as percentage of Gross Domestic Product,https://data.undp.org/dataset/Public-expenditure-on-education-of-GDP-/bkr7-unqh,"The information in the various pages of the UNDP Web site is issued by the United Nations Development Programme for general distribution. The information presented is protected under the Berne Convention for the Protection of Literature and Artistic works, under other international conventions and under national laws on copyright and neighboring rights. Extracts of the information in the Web site may be reviewed, reproduced or translated for research or private study but not for sale or for use in conjunction with commercial purposes. Any use of information in the Web site should be accompanied by an acknowledgment of UNDP as the source, citing the uniform resource locator (URL) of the article. Reproduction or translation of substantial portions of the Web site, or any use other than for educational or other non-commercial purposes, require explicit, prior authorization in writing. Applications and enquiries should be addressed to the programme responsible for the page used.","Public expenditure on education as % of GDP is the total public expenditure (current and capital) on education expressed as a percentage of the Gross Domestic Product (GDP) in a given year. Public expenditure on education includes government spending on educational institutions (both public and private), education administration, and transfers/subsidies for private entities (students/households and other privates entities).",,,,,,,,,,,,,,,,,,,,,,,,,,,,,,,,,,,,,,,,,,2.1,,,,,,,,,,,,,,,,,,,2.4,,,,,,,,,,2.7,,,,,,,,,,,,,,,,,,,,,,,,,,,,,,
PVE030,Expected Years of Schooling (of children),data.undp.org,Years,Expected years of schooling,https://data.undp.org/dataset/Expected-Years-of-Schooling-of-children-years-/qnam-f624,"The information in the various pages of the UNDP Web site is issued by the United Nations Development Programme for general distribution. The information presented is protected under the Berne Convention for the Protection of Literature and Artistic works, under other international conventions and under national laws on copyright and neighboring rights. Extracts of the information in the Web site may be reviewed, reproduced or translated for research or private study but not for sale or for use in conjunction with commercial purposes. Any use of information in the Web site should be accompanied by an acknowledgment of UNDP as the source, citing the uniform resource locator (URL) of the article. Reproduction or translation of substantial portions of the Web site, or any use other than for educational or other non-commercial purposes, require explicit, prior authorization in writing. Applications and enquiries should be addressed to the programme responsible for the page used.",Number of years of schooling that a child of school entrance age can expect to receive if prevailing patterns of age-specific enrollment rates persist throughout the child’s life.,,,,,,,,,,,,,,,,,,,,,,,,,,,,,,,,,,,,,13.6,,12.7,12.7,12.7,12.7,12.7,12.7,12.7,12.7,,,,,12.4,,,,,,,,,,11.4,,,,,,,,,,10.0,,,,,,,,,,,,,,,,,,,,,,,,,,,,,,
PSP080,"Population density by major area, region and country, 1950-2010",esa-unpd-wpp2012,People per square km,Population per square Kilometer.,http://esa.un.org/wpp/Excel-Data/population.htm,"The United Nations maintains this web site (the “Site”) as a courtesy to those who may choose to access the Site (“Users”). The information presented herein is for informative purposes only. The United Nations grants permission to Users to visit the Site and to download and copy the information, documents and materials (collectively, “Materials”) from the Site for the User’s personal, non-commercial use, without any right to resell or redistribute them or to compile or create derivative works therefrom, subject to the terms and conditions outlined below, and also subject to more specific restrictions that may apply to specific Material within this Site.","For information about the method of calculation, please visit http://unstats.un.org/unsd/demographic/standmeth/default.htm",,,,,,,,,,,,,,,,,,,,,,,,,,,,,,,,,,,,,,,,,316.397,314.002,311.727,309.433,306.928,304.089,300.832,297.241,293.566,290.156,287.249,284.942,283.124,281.571,279.954,278.032,275.743,273.147,270.284,267.229,264.045,260.721,257.243,253.672,250.084,246.536,243.061,239.642,236.229,232.743,229.129,225.369,221.487,217.531,213.567,209.643,205.783,201.971,198.16,194.28,190.288,186.169,181.955,177.707,173.508,169.423,165.48,161.671,157.977,154.366,150.818,147.334,143.938,140.663,137.545,134.614,131.891,129.384,127.092,125.001,123.088
PSP070,"Median age by major area, region and country, 1950-2010",esa-unpd-wpp2012,Years,"Median age by major area, region and country",http://esa.un.org/wpp/Excel-Data/population.htm,"The United Nations maintains this web site (the “Site”) as a courtesy to those who may choose to access the Site (“Users”). The information presented herein is for informative purposes only. The United Nations grants permission to Users to visit the Site and to download and copy the information, documents and materials (collectively, “Materials”) from the Site for the User’s personal, non-commercial use, without any right to resell or redistribute them or to compile or create derivative works therefrom, subject to the terms and conditions outlined below, and also subject to more specific restrictions that may apply to specific Material within this Site.","Age that divides the population in two parts of equal size, that is, there are as many persons with ages above the median as there are with ages below the median. It is expressed as years.",,,,,,,,,,,,,,,,,,,,,,,,,,,,,,,,,,,,,,,,,30.529,,,,,28.991,,,,,27.536,,,,,25.778,,,,,24.212,,,,,22.764,,,,,21.689,,,,,20.576,,,,,19.636,,,,,19.076,,,,,19.201,,,,,20.174,,,,,21.577
PSP100,"Percentage of Population Residing in Urban Areas by Major Area, Region and Country, 1950-2050",esa-unpd-wup2011,Percentage,"Percentage of Population Residing in Urban Areas by Major Area, Region and Country, 1950-2050",http://esa.un.org/wpp/Excel-Data/population.htm,"The United Nations maintains this web site (the “Site”) as a courtesy to those who may choose to access the Site (“Users”). The information presented herein is for informative purposes only. The United Nations grants permission to Users to visit the Site and to download and copy the information, documents and materials (collectively, “Materials”) from the Site for the User’s personal, non-commercial use, without any right to resell or redistribute them or to compile or create derivative works therefrom, subject to the terms and conditions outlined below, and also subject to more specific restrictions that may apply to specific Material within this Site.",For information about the method of calculation please visit http://esa.un.org/wpp/Excel-Data/population.htm,30.295,,,,,27.501,,,,,24.873,,,,,22.419,,,,,20.142,,,,,18.042,,,,,16.441,,,,,15.468,,,,,15.041,,,,,15.127,,,,,15.709,,,,,16.44,,,,,17.199,,,,,17.984,,,,,18.779,,,,,19.483,,,,,19.514,,,,,17.626,,,,,16.431,,,,,15.647,,,,,15.327
PSP060,Population growth ,world-bank,Percentage,Population growth (annual %),http://data.worldbank.org/indicator/SP.POP.GROW,"You are free to copy, distribute, adapt, display or include the data in other products for commercial and noncommercial purposes at no cost subject to certain limitations summarized below.
You must include attribution for the data you use in the manner indicated in the metadata included with the data.
You must not claim or imply that The World Bank endorses your use of the data by or use The World Bank’s logo(s) or trademark(s) in conjunction with such use.
Other parties may have ownership interests in some of the materials contained on The World Bank Web site. For example, we maintain a list of some specific data within the Datasets that you may not redistribute or reuse without first contacting the original content provider, as well as information regarding how to contact the original content provider. Before incorporating any data in other products, please check the list: Terms of use: Restricted Data
The World Bank makes no warranties with respect to the data and you agree The World Bank shall not be liable to you in connection with your use of the data.
This is only a summary of the Terms of Use for Datasets Listed in The World Bank Data Catalogue. Please read the actual agreement that controls your use of the Datasets, which is available here: Terms of use for datasets. Also see World Bank Terms and Conditions.","Population growth (annual %) is the exponential rate of growth of midyear population from year t-1 to t, expressed as a percentage. Derived from total population. Population source: (1) United Nations Population Division. World Population Prospects, (2) United Nations Statistical Division. Population and Vital Statistics Report (various years), (3) Census reports and other statistical publications from national statistical offices, (4) Eurostat: Demographic Statistics, (5) Secretariat of the Pacific Community: Statistics and Demography Programme, and (6) U.S. Census Bureau: International Database.",,,,,,,,,,,,,,,,,,,,,,,,,,,,,,,,,,,,,,0.75960278006556,,1.04042169671805,0.987770481670205,1.1459047856621,0.884345986018276,0.907342616060452,1.08350004344043,1.06963838728116,1.3572524967932,1.32306229866305,0.65751337151655,-1.60957589780875,0.241102899960162,1.43765689672583,1.15657746735501,1.25733284398069,1.09674273271011,1.36011200975422,1.37886643077727,1.25457849908178,0.916617837880189,1.47018574774242,1.12294324220775,1.3523422946709,1.37088159267271,1.51387506589766,1.78302449562906,1.52014375830428,1.19924067808428,1.44385613528232,2.32344106875205,0.675815236905491,1.88239241758098,1.96782569210428,1.76316241077443,1.6269927567937,1.62425942526027,1.5833041729167,1.46353323165381,1.77254949140123,1.33851945576535,1.39662641501244,2.11588286056429,2.14494281702322,2.43945416076675,2.28166496490929,2.43342538694607,2.3656334949831,2.98835362423048,1.32225469845284,2.66863636102587,2.71148987969663,2.77667549163387,,,,,,,,,,
