Indicator ID,Indicator name,Source dataset,Units,Dataset summary,More Info,Terms of Use,HDX Methodology,2050,2049,2048,2047,2046,2045,2044,2043,2042,2041,2040,2039,2038,2037,2036,2035,2034,2033,2032,2031,2030,2029,2028,2027,2026,2025,2024,2023,2022,2021,2020,2019,2018,2017,2016,2015,2014,2013,2012,2011,2010,2009,2008,2007,2006,2005,2004,2003,2002,2001,2000,1999,1998,1997,1996,1995,1994,1993,1992,1991,1990,1989,1988,1987,1986,1985,1984,1983,1982,1981,1980,1979,1978,1977,1976,1975,1974,1973,1972,1971,1970,1969,1968,1967,1966,1965,1964,1963,1962,1961,1960,1959,1958,1957,1956,1955,1954,1953,1952,1951,1950
PVW010,Proportion of the population using improved drinking water sources,mdgs,Percentage,Proportion of the population using improved drinking water sources,http://unstats.un.org/unsd/mdg/Metadata.aspx?IndicatorId=0&SeriesId=665,"The United Nations maintains this web site (the “Site”) as a courtesy to those who may choose to access the Site (“Users”). The information presented herein is for informative purposes only. The United Nations grants permission to Users to visit the Site and to download and copy the information, documents and materials (collectively, “Materials”) from the Site for the User’s personal, non-commercial use, without any right to resell or redistribute them or to compile or create derivative works therefrom, subject to the terms and conditions outlined below, and also subject to more specific restrictions that may apply to specific Material within this Site.","The proportion of the population using an improved drinking water source, total, urban, and rural, is the percentage of the population who use any of the following types of water supply for drinking: piped water into dwelling, plot or yard; public tap/standpipe; borehole/tube well; protected dug well; protected spring; rainwater collection and bottled water (if a secondary available source is also improved). It does not include unprotected well, unprotected spring, water provided by carts with small tanks/drums, tanker truck-provided water and bottled water (if secondary source is not an improved source) or surface water taken directly from rivers, ponds, streams, lakes, dams, or irrigation channels. Definitions and a detailed description of these facilities can be found at the website of the WHO/UNICEF Joint Monitoring Programme for Water Supply and Sanitation at www.wssinfo.org.",,,,,,,,,,,,,,,,,,,,,,,,,,,,,,,,,,,,98.0,98.0,98.0,98.0,98.0,98.0,98.0,98.0,98.0,98.0,97.0,97.0,97.0,97.0,97.0,97.0,96.0,96.0,96.0,96.0,96.0,96.0,96.0,,,,,,,,,,,,,,,,,,,,,,,,,,,,,,,,,,,,,,,,,,,
PVE130,Total net enrolment ratio in primary education,mdgs,Percentage,Total net enrolment ratio in primary education,http://mdgs.un.org/unsd/mdg/Metadata.aspx?IndicatorId=0&SeriesId=589,"The United Nations maintains this web site (the “Site”) as a courtesy to those who may choose to access the Site (“Users”). The information presented herein is for informative purposes only. The United Nations grants permission to Users to visit the Site and to download and copy the information, documents and materials (collectively, “Materials”) from the Site for the User’s personal, non-commercial use, without any right to resell or redistribute them or to compile or create derivative works therefrom, subject to the terms and conditions outlined below, and also subject to more specific restrictions that may apply to specific Material within this Site.",Net primary enrolment rate in primary education is the number of children of official primary school age (according to ISCED971) who are enrolled in primary education as a percentage of the total children of the official school age population. Total net primary enrolment rate also includes children of primary school age enrolled in secondary education. Where more than one system of primary education exists within the country the most widespread or common structure is used for determining the official school age group.,,,,,,,,,,,,,,,,,,,,,,,,,,,,,,,,,,,,,,,,,97.8,96.2,98.7,98.7,97.3,98.8,94.7,,,,87.5,91.4,,,,,92.6,88.9,88.5,,,,,,,,,,,,,,,,,,,,,,,,,,,,,,,,,,,,,,,,,,
PVW040,Proportion of the population using improved sanitation facilities,mdgs,Percentage,Proportion of the population using improved sanitation facilities,http://mdgs.un.org/unsd/mdg/Metadata.aspx?IndicatorId=0&SeriesId=668,"The United Nations maintains this web site (the “Site”) as a courtesy to those who may choose to access the Site (“Users”). The information presented herein is for informative purposes only. The United Nations grants permission to Users to visit the Site and to download and copy the information, documents and materials (collectively, “Materials”) from the Site for the User’s personal, non-commercial use, without any right to resell or redistribute them or to compile or create derivative works therefrom, subject to the terms and conditions outlined below, and also subject to more specific restrictions that may apply to specific Material within this Site.","The proportion of the population using an improved sanitation facility, total, urban, rural, is the percentage of the population with access to facilities that hygienically separate human excreta from human contact. Improved facilities include flush/pour flush toilets or latrines connected to a sewer, -septic tank, or -pit, ventilated improved pit latrines, pit latrines with a slab or platform of any material which covers the pit entirely, except for the drop hole and composting toilets/latrines. Unimproved facilities include public or shared facilities of an otherwise acceptable type, flush/pour-flush toilets or latrines which discharge directly into an open sewer or ditch, pit latrines without a slab, bucket latrines, hanging toilets or latrines which directly discharge in water bodies or in the open and the practice of open defecation in the bush, field or bodies or water. Definitions and a detailed description of these facilities can be found at the website of the WHO/UNICEF Joint Monitoring Programme for Water Supply and Sanitation at www.wssinfo.org.",,,,,,,,,,,,,,,,,,,,,,,,,,,,,,,,,,,,92.0,92.0,92.0,92.0,92.0,91.0,91.0,91.0,91.0,90.0,90.0,90.0,89.0,89.0,89.0,89.0,88.0,88.0,88.0,88.0,88.0,88.0,,,,,,,,,,,,,,,,,,,,,,,,,,,,,,,,,,,,,,,,,,,,
PVF020,Per capita food supply,faostat3,kcal/capita/day,"Estimates of per capita food supplies available for human consumption during the reference period in terms of quantity, caloric value, protein and fat content.",http://faostat3.fao.org/faostat-gateway/go/to/browse/C/*/E,"Content on www.fao.org, its affiliated websites and specific pages (collectively the FAO website) is protected by copyright. To ensure wide dissemination of its information, FAO is committed to making its content freely available and encourages the use, reproduction and dissemination of the text, multimedia and data products presented. Except where otherwise indicated, content may be copied, printed and downloaded for private study, research and teaching purposes, or for use in non-commercial products or services, provided that appropriate acknowledgement of FAO as the source and copyright holder is given and that FAO's endorsement of users' views, products or services is not stated or implied in any way. FAO encourages unrestricted use of news releases provided on the FAO website, and no formal permission is required to reproduce these materials.

All requests for translation and adaptation rights, and for resale and other commercial use rights should be addressed to copyright@fao.org or submitted via the online Licence Request Form when downloading.

RECOMMENDED CITATION:

[© FAO] [Year of publication] [Title of content] [Page number (for publications)] [Location on FAO website] [Date accessed and/or downloaded]","Estimates of per capita food supplies available for human consumption during the reference period in terms of quantity, caloric value, protein and fat content. Calorie supplies are reported in kilocalories (1 calorie = 4.19 kilojoules). Per capita supplies in terms of product weight are derived from the total supplies available for human consumption (i.e. Food) by dividing the quantities of Food by the total population actually partaking of the food supplies during the reference period, i.e. the present in-area (de facto) population within the present geographical boundaries of the country. In other words, nationals living abroad during the reference period are excluded, but foreigners living in the country are included. Adjustments are made wherever possible for part-time presence or absence, such as temporary migrants, tourists and refugees supported by special schemes (if it has not been possible to allow for the amounts provided by such schemes under imports). In almost all cases, the population figures used are the mid-year estimates published by the United Nations Population Division. Per capita supply figures shown in the commodity balances therefore represent only the average supply available for the population as a whole and do not necessarily indicate what is actually consumed by individuals. Even if they are taken as approximation to per capita consumption, it is important to note that the amount of food actually consumed may be lower than the quantity shown here, depending on the degree of losses of edible food and nutrients in the household, e.g. during storage, in preparation and cooking etc. In many cases commodities are not consumed in the primary form in which they are presented in the commodity balance, e.g. cereals enter the household mainly in processed form like flour, meal, husked or milled rice. To take this fact into account, the caloric value, the protein and fat content shown against primary commodities in the commodity balances have been derived by applying the appropriate food composition factors to the quantities of the processed commodities and not by multiplying the quantities shown in the commodity balance with the food composition factors relating to primary commodities.",,,,,,,,,,,,,,,,,,,,,,,,,,,,,,,,,,,,,,,,2575.0,2584.0,2614.0,2585.0,2603.0,2623.0,2646.0,2661.0,2686.0,2725.0,2764.0,2777.0,2704.0,2601.0,2651.0,2536.0,2535.0,2421.0,2420.0,2503.0,2607.0,2714.0,2777.0,2788.0,2737.0,2741.0,2702.0,2655.0,2686.0,2749.0,2499.0,2627.0,2264.0,2177.0,2216.0,2360.0,2341.0,2398.0,2456.0,2517.0,2594.0,2615.0,2592.0,2551.0,2497.0,2557.0,2447.0,2428.0,2378.0,2389.0,2447.0,,,,,,,,,,,
PVH140,"Children under five mortality rate per 1,000 live births",mdgs,"Deaths per 1,000 live births","Children under five mortality rate per 1,000 live births",http://mdgs.un.org/unsd/mdg/Metadata.aspx?IndicatorId=0&SeriesId=561,"The United Nations maintains this web site (the “Site”) as a courtesy to those who may choose to access the Site (“Users”). The information presented herein is for informative purposes only. The United Nations grants permission to Users to visit the Site and to download and copy the information, documents and materials (collectively, “Materials”) from the Site for the User’s personal, non-commercial use, without any right to resell or redistribute them or to compile or create derivative works therefrom, subject to the terms and conditions outlined below, and also subject to more specific restrictions that may apply to specific Material within this Site.","The under-five mortality rate (U5MR) is the probability (expressed as a rate per 1,000 live births) of a child born in a specified year dying before reaching the age of five if subject to current age-specific mortality rates.

A live birth is the complete expulsion or extraction from its mother of a product of conception, irrespective of the duration of the pregnancy, which, after such separation, breathes or shows any other evidence of life—such as beating of the heart, pulsation of the umbilical cord, or definite movement of voluntary muscles—whether or not the umbilical cord has been cut or the placenta is attached. Each product of such a birth is considered a live birth.",,,,,,,,,,,,,,,,,,,,,,,,,,,,,,,,,,,,,,12.9,13.3,13.6,13.9,14.3,14.6,14.9,15.1,15.3,15.4,15.5,15.6,15.6,15.8,16.1,16.5,17.1,17.9,18.7,19.7,20.6,21.5,22.5,23.5,,,,,,,,,,,,,,,,,,,,,,,,,,,,,,,,,,,,,,,,
PCX100,Internet users ,world-bank,Internet users per 100 people,Internet users are people with access to the worldwide network.,http://data.worldbank.org/indicator/IT.NET.USER.P2,"You are free to copy, distribute, adapt, display or include the data in other products for commercial and noncommercial purposes at no cost subject to certain limitations summarized below.
You must include attribution for the data you use in the manner indicated in the metadata included with the data.
You must not claim or imply that The World Bank endorses your use of the data by or use The World Bank’s logo(s) or trademark(s) in conjunction with such use.
Other parties may have ownership interests in some of the materials contained on The World Bank Web site. For example, we maintain a list of some specific data within the Datasets that you may not redistribute or reuse without first contacting the original content provider, as well as information regarding how to contact the original content provider. Before incorporating any data in other products, please check the list: Terms of use: Restricted Data
The World Bank makes no warranties with respect to the data and you agree The World Bank shall not be liable to you in connection with your use of the data.
This is only a summary of the Terms of Use for Datasets Listed in The World Bank Data Catalogue. Please read the actual agreement that controls your use of the Datasets, which is available here: Terms of use for datasets. Also see World Bank Terms and Conditions.","The Internet is a world-wide public computer network. It provides access to a number of communication services including the World Wide Web and carries e-mail, news, entertainment and data files, irrespective of the device used (not assumed to be only via a computer - it may also be by mobile-cellular telephone, other wireless devices, games machine, digital TV etc.). Access can be via a fixed or mobile network.

Individuals using the Internet refers to those that used the Internet in the last 12 months from any location. As of 2013, the definition has been updated and the reference period is the last three months instead of 12. While some countries already used the narrower reference period in the past, most countries may still take some time to adhere to the new reference period. Data are based on surveys generally carried out by national statistical offices or estimated based on the number of Internet subscriptions.",,,,,,,,,,,,,,,,,,,,,,,,,,,,,,,,,,,,,,72.0,71.7482028146963,65.0,43.0,33.88,31.54,27.0,26.0,25.0,22.0,20.0,18.0,11.8,8.0,3.76455782177031,2.33559071038067,1.36295390281695,1.74695069755741,0.960030720983071,,,,,0.0,,,,,,,,,,,,,,,,,,,,,,,,,,,,,,,,,,,,,,,,
PCX130,Logistics performance index: Overall ,world-bank,Range (1=low to 5=high),Logistics performance index,Details of the survey methodology and index construction methodology are in Arvis and others' Connecting to Compete 2010: Trade Logistics in the Global Economy (2010). http://data.worldbank.org/indicator/LP.LPI.OVRL.XQ,"You are free to copy, distribute, adapt, display or include the data in other products for commercial and noncommercial purposes at no cost subject to certain limitations summarized below.
You must include attribution for the data you use in the manner indicated in the metadata included with the data.
You must not claim or imply that The World Bank endorses your use of the data by or use The World Bank’s logo(s) or trademark(s) in conjunction with such use.
Other parties may have ownership interests in some of the materials contained on The World Bank Web site. For example, we maintain a list of some specific data within the Datasets that you may not redistribute or reuse without first contacting the original content provider, as well as information regarding how to contact the original content provider. Before incorporating any data in other products, please check the list: Terms of use: Restricted Data
The World Bank makes no warranties with respect to the data and you agree The World Bank shall not be liable to you in connection with your use of the data.
This is only a summary of the Terms of Use for Datasets Listed in The World Bank Data Catalogue. Please read the actual agreement that controls your use of the Datasets, which is available here: Terms of use for datasets. Also see World Bank Terms and Conditions.","Logistics Performance Index overall score reflects perceptions of a country's logistics based on efficiency of customs clearance process, quality of trade- and transport-related infrastructure, ease of arranging competitively priced shipments, quality of logistics services, ability to track and trace consignments, and frequency with which shipments reach the consignee within the scheduled time. The index ranges from 1 to 5, with a higher score representing better performance. Data are from Logistics Performance Index surveys conducted by the World Bank in partnership with academic and international institutions and private companies and individuals engaged in international logistics. 2009 round of surveys covered more than 5,000 country assessments by nearly 1,000 international freight forwarders. Respondents evaluate eight markets on six core dimensions on a scale from 1 (worst) to 5 (best). The markets are chosen based on the most important export and import markets of the respondent's country, random selection, and, for landlocked countries, neighboring countries that connect them with international markets. Scores for the six areas are averaged across all respondents and aggregated to a single score using principal components analysis.",,,,,,,,,,,,,,,,,,,,,,,,,,,,,,,,,,,,,2.910966,,2.75,,2.75,,,,,,,,,,,,,,,,,,,,,,,,,,,,,,,,,,,,,,,,,,,,,,,,,,,,,,,,,,,,
PCX051,Mobile cellular subscriptions per 100 inhabitants,mdgs,Mobile cellular subscriptions per 100 people,Mobile cellular telephone subscriptions per 100 inhabitants.,http://mdgs.un.org/unsd/mdg/SeriesDetail.aspx?srid=756&crid=,"The United Nations maintains this web site (the “Site”) as a courtesy to those who may choose to access the Site (“Users”). The information presented herein is for informative purposes only. The United Nations grants permission to Users to visit the Site and to download and copy the information, documents and materials (collectively, “Materials”) from the Site for the User’s personal, non-commercial use, without any right to resell or redistribute them or to compile or create derivative works therefrom, subject to the terms and conditions outlined below, and also subject to more specific restrictions that may apply to specific Material within this Site.","Mobile cellular telephone subscriptions are subscriptions to a public mobile telephone service using cellular technology, which provide access to the public switched telephone network. Post-paid and prepaid subscriptions are included.",,,,,,,,,,,,,,,,,,,,,,,,,,,,,,,,,,,,,71.44,76.05,80.65,81.56,118.83,101.22,102.79,109.34,75.38,69.21,57.69,38.73,39.4,19.98,10.59,5.42,2.78,2.16,1.74,1.46,,0.89,0.98,0.77,0.75,,,,,,,,,,,,,,,,,,,,,,,,,,,,,,,,,,,,,,,,
PVL030,"Roads, total network ",world-bank,km,"Roads, total network",http://data.worldbank.org/indicator/IS.ROD.TOTL.KM,"You are free to copy, distribute, adapt, display or include the data in other products for commercial and noncommercial purposes at no cost subject to certain limitations summarized below.
You must include attribution for the data you use in the manner indicated in the metadata included with the data.
You must not claim or imply that The World Bank endorses your use of the data by or use The World Bank’s logo(s) or trademark(s) in conjunction with such use.
Other parties may have ownership interests in some of the materials contained on The World Bank Web site. For example, we maintain a list of some specific data within the Datasets that you may not redistribute or reuse without first contacting the original content provider, as well as information regarding how to contact the original content provider. Before incorporating any data in other products, please check the list: Terms of use: Restricted Data
The World Bank makes no warranties with respect to the data and you agree The World Bank shall not be liable to you in connection with your use of the data.
This is only a summary of the Terms of Use for Datasets Listed in The World Bank Data Catalogue. Please read the actual agreement that controls your use of the Datasets, which is available here: Terms of use for datasets. Also see World Bank Terms and Conditions.","Total road network includes motorways, highways, and main or national roads, secondary or regional roads, and all other roads in a country. A motorway is a road designed and built for motor traffic that separates the traffic flowing in opposite directions.",,,,,,,,,,,,,,,,,,,,,,,,,,,,,,,,,,,,,,,,,,,,,,,,,,,2693.0,2693.0,2693.0,2693.0,2500.0,2450.0,2400.0,2360.0,2310.0,2270.0,2220.0,,,,,,,,,,,,,,,,,,,,,,,,,,,,,,,,,,,,,,,,
PCX080,Fixed telephone lines per 100 inhabitants,mdgs,Fixed telephone lines per 100 people,Fixed telephone lines per 100 inhabitants.,http://data.worldbank.org/indicator/IT.MLT.MAIN.P2,"The United Nations maintains this web site (the “Site”) as a courtesy to those who may choose to access the Site (“Users”). The information presented herein is for informative purposes only. The United Nations grants permission to Users to visit the Site and to download and copy the information, documents and materials (collectively, “Materials”) from the Site for the User’s personal, non-commercial use, without any right to resell or redistribute them or to compile or create derivative works therefrom, subject to the terms and conditions outlined below, and also subject to more specific restrictions that may apply to specific Material within this Site.",Telephone lines are fixed telephone lines that connect a subscriber's terminal equipment to the public switched telephone network and that have a port on a telephone exchange. Integrated services digital network channels ands fixed wireless subscribers are included.,,,,,,,,,,,,,,,,,,,,,,,,,,,,,,,,,,,,,35.99,36.04,36.29,36.3,35.87,36.38,38.11,38.84,39.2,40.44,43.4,41.78,40.95,40.69,38.4,37.89,36.52,34.21,31.54,29.89,28.58,28.1,28.86,29.94,27.26,,,,,,,,,,,,,,,,,,,,,,,,,,,,,,,,,,,,,,,,
PCX090,Mobile cellular subscriptions ,world-bank,Mobile cellular subscribers per 100 people,Mobile cellular subscriptions,http://data.worldbank.org/indicator/IT.CEL.SETS.P2,"You are free to copy, distribute, adapt, display or include the data in other products for commercial and noncommercial purposes at no cost subject to certain limitations summarized below.
You must include attribution for the data you use in the manner indicated in the metadata included with the data.
You must not claim or imply that The World Bank endorses your use of the data by or use The World Bank’s logo(s) or trademark(s) in conjunction with such use.
Other parties may have ownership interests in some of the materials contained on The World Bank Web site. For example, we maintain a list of some specific data within the Datasets that you may not redistribute or reuse without first contacting the original content provider, as well as information regarding how to contact the original content provider. Before incorporating any data in other products, please check the list: Terms of use: Restricted Data
The World Bank makes no warranties with respect to the data and you agree The World Bank shall not be liable to you in connection with your use of the data.
This is only a summary of the Terms of Use for Datasets Listed in The World Bank Data Catalogue. Please read the actual agreement that controls your use of the Datasets, which is available here: Terms of use for datasets. Also see World Bank Terms and Conditions.","Mobile cellular telephone subscriptions are subscriptions to a public mobile telephone service using cellular technology, which provide access to the public switched telephone network. Post-paid and prepaid subscriptions are included",,,,,,,,,,,,,,,,,,,,,,,,,,,,,,,,,,,,,,76.0518742679676,80.653833745564,81.5628488989466,118.829230675344,101.218645272672,102.787506459207,109.340766966136,75.3785508697284,69.2127941462466,57.6944789081886,38.7258256659823,39.3992344008361,19.9848187323642,10.5870855289009,5.42219586834877,2.78415871636211,2.16144607714968,1.74423113530129,1.46402428137833,,0.885634717176002,0.977087302750501,0.773644016514619,0.749791291185856,0.0,0.0,0.0,0.0,0.0,0.0,0.0,0.0,0.0,0.0,0.0,0.0,0.0,0.0,0.0,,,,,0.0,,,,,0.0,,,,,0.0,,,,,,,,,,
