Indicator ID,Indicator name,Source dataset,Units,Dataset summary,More Info,Terms of Use,HDX Methodology,2050,2049,2048,2047,2046,2045,2044,2043,2042,2041,2040,2039,2038,2037,2036,2035,2034,2033,2032,2031,2030,2029,2028,2027,2026,2025,2024,2023,2022,2021,2020,2019,2018,2017,2016,2015,2014,2013,2012,2011,2010,2009,2008,2007,2006,2005,2004,2003,2002,2001,2000,1999,1998,1997,1996,1995,1994,1993,1992,1991,1990,1989,1988,1987,1986,1985,1984,1983,1982,1981,1980,1979,1978,1977,1976,1975,1974,1973,1972,1971,1970,1969,1968,1967,1966,1965,1964,1963,1962,1961,1960,1959,1958,1957,1956,1955,1954,1953,1952,1951,1950
PVE130,Total net enrolment ratio in primary education,mdgs,Percentage,Total net enrolment ratio in primary education,http://mdgs.un.org/unsd/mdg/Metadata.aspx?IndicatorId=0&SeriesId=589,"The United Nations maintains this web site (the “Site”) as a courtesy to those who may choose to access the Site (“Users”). The information presented herein is for informative purposes only. The United Nations grants permission to Users to visit the Site and to download and copy the information, documents and materials (collectively, “Materials”) from the Site for the User’s personal, non-commercial use, without any right to resell or redistribute them or to compile or create derivative works therefrom, subject to the terms and conditions outlined below, and also subject to more specific restrictions that may apply to specific Material within this Site.",Net primary enrolment rate in primary education is the number of children of official primary school age (according to ISCED971) who are enrolled in primary education as a percentage of the total children of the official school age population. Total net primary enrolment rate also includes children of primary school age enrolled in secondary education. Where more than one system of primary education exists within the country the most widespread or common structure is used for determining the official school age group.,,,,,,,,,,,,,,,,,,,,,,,,,,,,,,,,,,,,,,,86.0,87.5,89.5,92.4,92.9,91.8,,,,,,,,,,,,,,,,,,,,,,,,,,,,,,,,,,,,,,,,,,,,,,,,,,,,,,,,,
PVX020,GNA Crisis Index,echo,Index,GNA crisis index,http://ec.europa.eu,"Copyright notice

© European Union, 1995-2014 

Reuse is authorised, provided the source is acknowledged. The reuse policy of the European Commission is implemented by a Decision of 12 December 2011  [728KB] . 

The general principle of reuse can be subject to conditions which may be specified in individual copyright notices. Therefore users are advised to refer to the copyright notices of the individual websites maintained under Europa and of the individual documents. Reuse is not applicable to documents subject to intellectual property rights of third parties. ","The GNA Final Index lists countries in ranking order. The GNA Vulnerability Index and the GNA Crisis Index are shown, as well as the various dimensions. Each dimension has a value that is the result of combining indicators. Note that all values are the result of ranking countries. If countries are in the top quartile (25%), they score 3; in the bottom quartile, they score 1; in the middle 2 quartiles, they score 2.  Index value is taken directly from the source dataset. For the calculation methods see the Methodological notes on http://ec.europa.eu/echo/policies/strategy_en.htm.",,,,,,,,,,,,,,,,,,,,,,,,,,,,,,,,,,,,,,,0.0,,,,,,,,,,,,,,,,,,,,,,,,,,,,,,,,,,,,,,,,,,,,,,,,,,,,,,,,,,,,,,
PVW040,Proportion of the population using improved sanitation facilities,mdgs,Percentage,Proportion of the population using improved sanitation facilities,http://mdgs.un.org/unsd/mdg/Metadata.aspx?IndicatorId=0&SeriesId=668,"The United Nations maintains this web site (the “Site”) as a courtesy to those who may choose to access the Site (“Users”). The information presented herein is for informative purposes only. The United Nations grants permission to Users to visit the Site and to download and copy the information, documents and materials (collectively, “Materials”) from the Site for the User’s personal, non-commercial use, without any right to resell or redistribute them or to compile or create derivative works therefrom, subject to the terms and conditions outlined below, and also subject to more specific restrictions that may apply to specific Material within this Site.","The proportion of the population using an improved sanitation facility, total, urban, rural, is the percentage of the population with access to facilities that hygienically separate human excreta from human contact. Improved facilities include flush/pour flush toilets or latrines connected to a sewer, -septic tank, or -pit, ventilated improved pit latrines, pit latrines with a slab or platform of any material which covers the pit entirely, except for the drop hole and composting toilets/latrines. Unimproved facilities include public or shared facilities of an otherwise acceptable type, flush/pour-flush toilets or latrines which discharge directly into an open sewer or ditch, pit latrines without a slab, bucket latrines, hanging toilets or latrines which directly discharge in water bodies or in the open and the practice of open defecation in the bush, field or bodies or water. Definitions and a detailed description of these facilities can be found at the website of the WHO/UNICEF Joint Monitoring Programme for Water Supply and Sanitation at www.wssinfo.org.",,,,,,,,,,,,,,,,,,,,,,,,,,,,,,,,,,,,,,,,91.0,91.0,91.0,91.0,91.0,90.0,90.0,89.0,88.0,87.0,86.0,85.0,84.0,83.0,82.0,81.0,80.0,79.0,78.0,77.0,76.0,75.0,,,,,,,,,,,,,,,,,,,,,,,,,,,,,,,,,,,,,,,,
PVF020,Per capita food supply,faostat3,kcal/capita/day,"Estimates of per capita food supplies available for human consumption during the reference period in terms of quantity, caloric value, protein and fat content.",http://faostat3.fao.org/faostat-gateway/go/to/browse/C/*/E,"Content on www.fao.org, its affiliated websites and specific pages (collectively the FAO website) is protected by copyright. To ensure wide dissemination of its information, FAO is committed to making its content freely available and encourages the use, reproduction and dissemination of the text, multimedia and data products presented. Except where otherwise indicated, content may be copied, printed and downloaded for private study, research and teaching purposes, or for use in non-commercial products or services, provided that appropriate acknowledgement of FAO as the source and copyright holder is given and that FAO's endorsement of users' views, products or services is not stated or implied in any way. FAO encourages unrestricted use of news releases provided on the FAO website, and no formal permission is required to reproduce these materials.

All requests for translation and adaptation rights, and for resale and other commercial use rights should be addressed to copyright@fao.org or submitted via the online Licence Request Form when downloading.

RECOMMENDED CITATION:

[© FAO] [Year of publication] [Title of content] [Page number (for publications)] [Location on FAO website] [Date accessed and/or downloaded]","Estimates of per capita food supplies available for human consumption during the reference period in terms of quantity, caloric value, protein and fat content. Calorie supplies are reported in kilocalories (1 calorie = 4.19 kilojoules). Per capita supplies in terms of product weight are derived from the total supplies available for human consumption (i.e. Food) by dividing the quantities of Food by the total population actually partaking of the food supplies during the reference period, i.e. the present in-area (de facto) population within the present geographical boundaries of the country. In other words, nationals living abroad during the reference period are excluded, but foreigners living in the country are included. Adjustments are made wherever possible for part-time presence or absence, such as temporary migrants, tourists and refugees supported by special schemes (if it has not been possible to allow for the amounts provided by such schemes under imports). In almost all cases, the population figures used are the mid-year estimates published by the United Nations Population Division. Per capita supply figures shown in the commodity balances therefore represent only the average supply available for the population as a whole and do not necessarily indicate what is actually consumed by individuals. Even if they are taken as approximation to per capita consumption, it is important to note that the amount of food actually consumed may be lower than the quantity shown here, depending on the degree of losses of edible food and nutrients in the household, e.g. during storage, in preparation and cooking etc. In many cases commodities are not consumed in the primary form in which they are presented in the commodity balance, e.g. cereals enter the household mainly in processed form like flour, meal, husked or milled rice. To take this fact into account, the caloric value, the protein and fat content shown against primary commodities in the commodity balances have been derived by applying the appropriate food composition factors to the quantities of the processed commodities and not by multiplying the quantities shown in the commodity balance with the food composition factors relating to primary commodities.",,,,,,,,,,,,,,,,,,,,,,,,,,,,,,,,,,,,,,,,2396.0,2311.0,2310.0,2382.0,2416.0,2329.0,2326.0,2107.0,2071.0,2069.0,2085.0,2150.0,2158.0,2154.0,2163.0,2190.0,2188.0,2255.0,2376.0,2545.0,2532.0,2467.0,2489.0,2364.0,2266.0,2214.0,2191.0,2248.0,2023.0,1951.0,2045.0,1971.0,1745.0,1650.0,1711.0,1791.0,1857.0,1799.0,1863.0,1957.0,2165.0,2240.0,2055.0,2007.0,1959.0,2172.0,2222.0,2126.0,2052.0,2185.0,2008.0,,,,,,,,,,,
PVX010,GNA Vulnerability Index,echo,Index,GNA vulnerability index,http://ec.europa.eu,"Copyright notice

© European Union, 1995-2014 

Reuse is authorised, provided the source is acknowledged. The reuse policy of the European Commission is implemented by a Decision of 12 December 2011  [728KB] . 

The general principle of reuse can be subject to conditions which may be specified in individual copyright notices. Therefore users are advised to refer to the copyright notices of the individual websites maintained under Europa and of the individual documents. Reuse is not applicable to documents subject to intellectual property rights of third parties. ","The GNA Final Index lists countries in ranking order. The GNA Vulnerability Index and the GNA Crisis Index are shown, as well as the various dimensions. Each dimension has a value that is the result of combining indicators. Note that all values are the result of ranking countries. If countries are in the top quartile (25%), they score 3; in the bottom quartile, they score 1; in the middle 2 quartiles, they score 2. Index value is taken directly from the source dataset. For the calculation methods see the Methodological notes on http://ec.europa.eu/echo/policies/strategy_en.htm",,,,,,,,,,,,,,,,,,,,,,,,,,,,,,,,,,,,,,,1.0,,,,,,,,,,,,,,,,,,,,,,,,,,,,,,,,,,,,,,,,,,,,,,,,,,,,,,,,,,,,,,
PVH140,"Children under five mortality rate per 1,000 live births",mdgs,"Deaths per 1,000 live births","Children under five mortality rate per 1,000 live births",http://mdgs.un.org/unsd/mdg/Metadata.aspx?IndicatorId=0&SeriesId=561,"The United Nations maintains this web site (the “Site”) as a courtesy to those who may choose to access the Site (“Users”). The information presented herein is for informative purposes only. The United Nations grants permission to Users to visit the Site and to download and copy the information, documents and materials (collectively, “Materials”) from the Site for the User’s personal, non-commercial use, without any right to resell or redistribute them or to compile or create derivative works therefrom, subject to the terms and conditions outlined below, and also subject to more specific restrictions that may apply to specific Material within this Site.","The under-five mortality rate (U5MR) is the probability (expressed as a rate per 1,000 live births) of a child born in a specified year dying before reaching the age of five if subject to current age-specific mortality rates.

A live birth is the complete expulsion or extraction from its mother of a product of conception, irrespective of the duration of the pregnancy, which, after such separation, breathes or shows any other evidence of life—such as beating of the heart, pulsation of the umbilical cord, or definite movement of voluntary muscles—whether or not the umbilical cord has been cut or the placenta is attached. Each product of such a birth is considered a live birth.",,,,,,,,,,,,,,,,,,,,,,,,,,,,,,,,,,,,,,9.3,9.6,9.9,10.3,10.6,11.0,11.4,11.9,12.4,12.9,13.5,14.1,14.7,15.4,16.2,17.0,17.9,18.8,19.8,20.8,21.9,23.0,24.2,25.5,,,,,,,,,,,,,,,,,,,,,,,,,,,,,,,,,,,,,,,,
PCX100,Internet users ,world-bank,Internet users per 100 people,Internet users are people with access to the worldwide network.,http://data.worldbank.org/indicator/IT.NET.USER.P2,"You are free to copy, distribute, adapt, display or include the data in other products for commercial and noncommercial purposes at no cost subject to certain limitations summarized below.
You must include attribution for the data you use in the manner indicated in the metadata included with the data.
You must not claim or imply that The World Bank endorses your use of the data by or use The World Bank’s logo(s) or trademark(s) in conjunction with such use.
Other parties may have ownership interests in some of the materials contained on The World Bank Web site. For example, we maintain a list of some specific data within the Datasets that you may not redistribute or reuse without first contacting the original content provider, as well as information regarding how to contact the original content provider. Before incorporating any data in other products, please check the list: Terms of use: Restricted Data
The World Bank makes no warranties with respect to the data and you agree The World Bank shall not be liable to you in connection with your use of the data.
This is only a summary of the Terms of Use for Datasets Listed in The World Bank Data Catalogue. Please read the actual agreement that controls your use of the Datasets, which is available here: Terms of use for datasets. Also see World Bank Terms and Conditions.","The Internet is a world-wide public computer network. It provides access to a number of communication services including the World Wide Web and carries e-mail, news, entertainment and data files, irrespective of the device used (not assumed to be only via a computer - it may also be by mobile-cellular telephone, other wireless devices, games machine, digital TV etc.). Access can be via a fixed or mobile network.

Individuals using the Internet refers to those that used the Internet in the last 12 months from any location. As of 2013, the definition has been updated and the reference period is the last three months instead of 12. While some countries already used the narrower reference period in the past, most countries may still take some time to adhere to the new reference period. Data are based on surveys generally carried out by national statistical offices or estimated based on the number of Internet subscriptions.",,,,,,,,,,,,,,,,,,,,,,,,,,,,,,,,,,,,,,63.4,59.0,53.0,47.0,42.0,38.0,34.0,30.0,27.0,24.2665437161785,17.2286487816884,12.5,8.89928551450583,6.48222573702907,5.30068113752617,4.0717164999525,3.48053683800189,2.85844957694946,2.20076880190146,,,,,0.0,,,,,,,,,,,,,,,,,,,,,,,,,,,,,,,,,,,,,,,,
PCX051,Mobile cellular subscriptions per 100 inhabitants,mdgs,Mobile cellular subscriptions per 100 people,Mobile cellular telephone subscriptions per 100 inhabitants.,http://mdgs.un.org/unsd/mdg/SeriesDetail.aspx?srid=756&crid=,"The United Nations maintains this web site (the “Site”) as a courtesy to those who may choose to access the Site (“Users”). The information presented herein is for informative purposes only. The United Nations grants permission to Users to visit the Site and to download and copy the information, documents and materials (collectively, “Materials”) from the Site for the User’s personal, non-commercial use, without any right to resell or redistribute them or to compile or create derivative works therefrom, subject to the terms and conditions outlined below, and also subject to more specific restrictions that may apply to specific Material within this Site.","Mobile cellular telephone subscriptions are subscriptions to a public mobile telephone service using cellular technology, which provide access to the public switched telephone network. Post-paid and prepaid subscriptions are included.",,,,,,,,,,,,,,,,,,,,,,,,,,,,,,,,,,,,,120.02,127.09,143.01,199.66,192.55,156.34,160.04,133.16,132.0,104.16,66.08,56.98,47.74,31.66,28.33,11.18,2.02,1.94,1.85,,,,,,0.0,,,,,,,,,,,,,,,,,,,,,,,,,,,,,,,,,,,,,,,,
PVL030,"Roads, total network ",world-bank,km,"Roads, total network",http://data.worldbank.org/indicator/IS.ROD.TOTL.KM,"You are free to copy, distribute, adapt, display or include the data in other products for commercial and noncommercial purposes at no cost subject to certain limitations summarized below.
You must include attribution for the data you use in the manner indicated in the metadata included with the data.
You must not claim or imply that The World Bank endorses your use of the data by or use The World Bank’s logo(s) or trademark(s) in conjunction with such use.
Other parties may have ownership interests in some of the materials contained on The World Bank Web site. For example, we maintain a list of some specific data within the Datasets that you may not redistribute or reuse without first contacting the original content provider, as well as information regarding how to contact the original content provider. Before incorporating any data in other products, please check the list: Terms of use: Restricted Data
The World Bank makes no warranties with respect to the data and you agree The World Bank shall not be liable to you in connection with your use of the data.
This is only a summary of the Terms of Use for Datasets Listed in The World Bank Data Catalogue. Please read the actual agreement that controls your use of the Datasets, which is available here: Terms of use for datasets. Also see World Bank Terms and Conditions.","Total road network includes motorways, highways, and main or national roads, secondary or regional roads, and all other roads in a country. A motorway is a road designed and built for motor traffic that separates the traffic flowing in opposite directions.",,,,,,,,,,,,,,,,,,,,,,,,,,,,,,,,,,,,,,,,,,,,,,,,,1165.0,,,,,,,,,,,,,,,,,,,,,,,,,,,,,,,,,,,,,,,,,,,,,,,,,,,,
PCX080,Fixed telephone lines per 100 inhabitants,mdgs,Fixed telephone lines per 100 people,Fixed telephone lines per 100 inhabitants.,http://data.worldbank.org/indicator/IT.MLT.MAIN.P2,"The United Nations maintains this web site (the “Site”) as a courtesy to those who may choose to access the Site (“Users”). The information presented herein is for informative purposes only. The United Nations grants permission to Users to visit the Site and to download and copy the information, documents and materials (collectively, “Materials”) from the Site for the User’s personal, non-commercial use, without any right to resell or redistribute them or to compile or create derivative works therefrom, subject to the terms and conditions outlined below, and also subject to more specific restrictions that may apply to specific Material within this Site.",Telephone lines are fixed telephone lines that connect a subscriber's terminal equipment to the public switched telephone network and that have a port on a telephone exchange. Integrated services digital network channels ands fixed wireless subscribers are included.,,,,,,,,,,,,,,,,,,,,,,,,,,,,,,,,,,,,,35.64,36.82,37.23,40.25,41.64,43.28,44.52,44.91,44.93,44.18,46.5,46.97,47.54,47.19,49.33,48.0,45.82,42.92,39.86,37.88,36.49,29.61,26.52,21.9,25.81,,,,,,,,,,,,,,,,,,,,,,,,,,,,,,,,,,,,,,,,
PCX090,Mobile cellular subscriptions ,world-bank,Mobile cellular subscribers per 100 people,Mobile cellular subscriptions,http://data.worldbank.org/indicator/IT.CEL.SETS.P2,"You are free to copy, distribute, adapt, display or include the data in other products for commercial and noncommercial purposes at no cost subject to certain limitations summarized below.
You must include attribution for the data you use in the manner indicated in the metadata included with the data.
You must not claim or imply that The World Bank endorses your use of the data by or use The World Bank’s logo(s) or trademark(s) in conjunction with such use.
Other parties may have ownership interests in some of the materials contained on The World Bank Web site. For example, we maintain a list of some specific data within the Datasets that you may not redistribute or reuse without first contacting the original content provider, as well as information regarding how to contact the original content provider. Before incorporating any data in other products, please check the list: Terms of use: Restricted Data
The World Bank makes no warranties with respect to the data and you agree The World Bank shall not be liable to you in connection with your use of the data.
This is only a summary of the Terms of Use for Datasets Listed in The World Bank Data Catalogue. Please read the actual agreement that controls your use of the Datasets, which is available here: Terms of use for datasets. Also see World Bank Terms and Conditions.","Mobile cellular telephone subscriptions are subscriptions to a public mobile telephone service using cellular technology, which provide access to the public switched telephone network. Post-paid and prepaid subscriptions are included",,,,,,,,,,,,,,,,,,,,,,,,,,,,,,,,,,,,,,127.085625382008,143.013843200216,199.664216353571,192.553276856236,156.344148319815,160.039367772323,133.157576691115,132.000670923838,104.16035850542,66.0809124060794,56.9811134183724,47.7383481194552,31.6567897482652,28.3329899031527,11.1781801922647,2.02139988680161,1.93819913611696,1.85066552779557,,,,,,0.0,,0.0,0.0,0.0,0.0,0.0,0.0,0.0,0.0,0.0,0.0,0.0,0.0,0.0,0.0,,,,,0.0,,,,,0.0,,,,,0.0,,,,,,,,,,
CG300,Land area ,world-bank,Square km,"Land area is a country's total area, excluding area under inland water bodies, national claims to continental shelf, and exclusive economic zones.",http://data.worldbank.org/indicator/AG.LND.TOTL.K2,"You are free to copy, distribute, adapt, display or include the data in other products for commercial and noncommercial purposes at no cost subject to certain limitations summarized below.
You must include attribution for the data you use in the manner indicated in the metadata included with the data.
You must not claim or imply that The World Bank endorses your use of the data by or use The World Bank’s logo(s) or trademark(s) in conjunction with such use.
Other parties may have ownership interests in some of the materials contained on The World Bank Web site. For example, we maintain a list of some specific data within the Datasets that you may not redistribute or reuse without first contacting the original content provider, as well as information regarding how to contact the original content provider. Before incorporating any data in other products, please check the list: Terms of use: Restricted Data
The World Bank makes no warranties with respect to the data and you agree The World Bank shall not be liable to you in connection with your use of the data.
This is only a summary of the Terms of Use for Datasets Listed in The World Bank Data Catalogue. Please read the actual agreement that controls your use of the Datasets, which is available here: Terms of use for datasets. Also see World Bank Terms and Conditions.",In most cases the definition of inland water bodies includes major rivers and lakes.,,,,,,,,,,,,,,,,,,,,,,,,,,,,,,,,,,,,,440.0,440.0,440.0,440.0,440.0,440.0,440.0,440.0,440.0,440.0,440.0,440.0,440.0,440.0,440.0,440.0,440.0,440.0,440.0,440.0,440.0,440.0,440.0,440.0,440.0,440.0,440.0,440.0,440.0,440.0,440.0,440.0,440.0,440.0,440.0,440.0,440.0,440.0,440.0,440.0,440.0,440.0,440.0,440.0,440.0,440.0,440.0,440.0,440.0,440.0,440.0,440.0,440.0,440.0,,,,,,,,,,,
