Indicator ID,Indicator name,Source dataset,Units,Dataset summary,More Info,Terms of Use,HDX Methodology,2050,2049,2048,2047,2046,2045,2044,2043,2042,2041,2040,2039,2038,2037,2036,2035,2034,2033,2032,2031,2030,2029,2028,2027,2026,2025,2024,2023,2022,2021,2020,2019,2018,2017,2016,2015,2014,2013,2012,2011,2010,2009,2008,2007,2006,2005,2004,2003,2002,2001,2000,1999,1998,1997,1996,1995,1994,1993,1992,1991,1990,1989,1988,1987,1986,1985,1984,1983,1982,1981,1980,1979,1978,1977,1976,1975,1974,1973,1972,1971,1970,1969,1968,1967,1966,1965,1964,1963,1962,1961,1960,1959,1958,1957,1956,1955,1954,1953,1952,1951,1950
CH100,Total cost of damage done by disasters,emdat,US$,Total cost of damage done by disasters,http://www.emdat.be/explanatory-notes,"The EM-DAT database is protected by the law of June 30th, 1994 on copyrights and the law of August 31st, 1998 on the legal protection of databases. Access to the EM-DAT database is made available free of charge by the UCL. The reproduction and communication of the information from EM-DAT is authorized by any means and in all forms, provided that the source is clearly mentioned and as follows:
 
“EM-DAT: The OFDA/CRED International Disaster Database – www.emdat.be – Université catholique de Louvain – Brussels – Belgium.”

","Several institutions have developed methodologies to quantify these losses in their specific domain. However, there is no standard procedure to determine a global figure for economic impact. Estimated damage are given (000’) US$.",,,,,,,,,,,,,,,,,,,,,,,,,,,,,,,,,,,,,,,,,,0.0,5.0E8,,,,0.0,,,,,,0.0,,,,,,,,0.0,,,,,5000.0,,,,,,,,,,,,,,,,,,,,,,,,,,,,,,,,,,,
CH070,Number of disasters,emdat,Disasters,Total number of disasters,http://www.emdat.be/explanatory-notes,"The EM-DAT database is protected by the law of June 30th, 1994 on copyrights and the law of August 31st, 1998 on the legal protection of databases. Access to the EM-DAT database is made available free of charge by the UCL. The reproduction and communication of the information from EM-DAT is authorized by any means and in all forms, provided that the source is clearly mentioned and as follows:
 
“EM-DAT: The OFDA/CRED International Disaster Database – www.emdat.be – Université catholique de Louvain – Brussels – Belgium.”

",For a disaster to be entered into the database at least one of the following criteria must be fulfilled: Ten (10) or more people reported killed. Hundred (100) or more people reported affected. Declaration of a state of emergency. Call for international assistance.,,,,,,,,,,,,,,,,,,,,,,,,,,,,,,,,,,,,,,,,,,1.0,3.0,,,,1.0,,,,,,1.0,,,,,,,,1.0,,,,,1.0,,,,,,,,,,,,,,,,,,,,,,,,,,,,,,,,,,,
CH090,People affected by disasters,emdat,People,Total number of people affected by disasters,http://www.emdat.be/explanatory-notes,"The EM-DAT database is protected by the law of June 30th, 1994 on copyrights and the law of August 31st, 1998 on the legal protection of databases. Access to the EM-DAT database is made available free of charge by the UCL. The reproduction and communication of the information from EM-DAT is authorized by any means and in all forms, provided that the source is clearly mentioned and as follows:
 
“EM-DAT: The OFDA/CRED International Disaster Database – www.emdat.be – Université catholique de Louvain – Brussels – Belgium.”

",People requiring immediate assistance during a period of emergency; it can also include displaced or evacuated people.,,,,,,,,,,,,,,,,,,,,,,,,,,,,,,,,,,,,,,,,,,118.0,1500.0,,,,200.0,,,,,,0.0,,,,,,,,0.0,,,,,770.0,,,,,,,,,,,,,,,,,,,,,,,,,,,,,,,,,,,
CH080,People killed in disasters,emdat,People,Total number of people killed in disasters,http://www.emdat.be/explanatory-notes,"The EM-DAT database is protected by the law of June 30th, 1994 on copyrights and the law of August 31st, 1998 on the legal protection of databases. Access to the EM-DAT database is made available free of charge by the UCL. The reproduction and communication of the information from EM-DAT is authorized by any means and in all forms, provided that the source is clearly mentioned and as follows:
 
“EM-DAT: The OFDA/CRED International Disaster Database – www.emdat.be – Université catholique de Louvain – Brussels – Belgium.”

",Persons confirmed as dead and persons missing and presumed dead (official figures when available).,,,,,,,,,,,,,,,,,,,,,,,,,,,,,,,,,,,,,,,,,,85.0,4.0,,,,0.0,,,,,,43.0,,,,,,,,0.0,,,,,0.0,,,,,,,,,,,,,,,,,,,,,,,,,,,,,,,,,,,
PSP080,"Population density by major area, region and country, 1950-2010",esa-unpd-wpp2012,People per square km,Population per square Kilometer.,http://esa.un.org/wpp/Excel-Data/population.htm,"The United Nations maintains this web site (the “Site”) as a courtesy to those who may choose to access the Site (“Users”). The information presented herein is for informative purposes only. The United Nations grants permission to Users to visit the Site and to download and copy the information, documents and materials (collectively, “Materials”) from the Site for the User’s personal, non-commercial use, without any right to resell or redistribute them or to compile or create derivative works therefrom, subject to the terms and conditions outlined below, and also subject to more specific restrictions that may apply to specific Material within this Site.","For information about the method of calculation, please visit http://unstats.un.org/unsd/demographic/standmeth/default.htm",,,,,,,,,,,,,,,,,,,,,,,,,,,,,,,,,,,,,,,,,72.077,70.342,68.56,66.6,64.284,61.512,58.198,54.447,50.558,46.944,43.898,41.549,39.8,38.435,37.133,35.66,33.947,32.077,30.163,28.384,26.86,25.626,24.623,23.777,22.96,22.098,21.156,20.165,19.174,18.267,17.5,16.888,16.412,16.014,15.635,15.223,14.758,14.26,13.777,13.372,13.098,12.96,12.937,12.998,13.091,13.184,13.267,13.351,13.4,13.395,13.312,13.153,12.926,12.656,12.367,12.088,11.847,11.665,11.574,11.591,11.737
PCX140,Percentage of population with access to electricity,world-bank,Percentage,Percentage of population with access to electricity.,http://data.worldbank.org/indicator/EG.ELC.ACCS.ZS,"You are free to copy, distribute, adapt, display or include the data in other products for commercial and noncommercial purposes at no cost subject to certain limitations summarized below.
You must include attribution for the data you use in the manner indicated in the metadata included with the data.
You must not claim or imply that The World Bank endorses your use of the data by or use The World Bank’s logo(s) or trademark(s) in conjunction with such use.
Other parties may have ownership interests in some of the materials contained on The World Bank Web site. For example, we maintain a list of some specific data within the Datasets that you may not redistribute or reuse without first contacting the original content provider, as well as information regarding how to contact the original content provider. Before incorporating any data in other products, please check the list: Terms of use: Restricted Data
The World Bank makes no warranties with respect to the data and you agree The World Bank shall not be liable to you in connection with your use of the data.
This is only a summary of the Terms of Use for Datasets Listed in The World Bank Data Catalogue. Please read the actual agreement that controls your use of the Datasets, which is available here: Terms of use for datasets. Also see World Bank Terms and Conditions.","Access to electricity is the percentage of population with access to electricity. Electrification data are collected from industry, national surveys and international sources.",,,,,,,,,,,,,,,,,,,,,,,,,,,,,,,,,,,,,,,,,88.22938,,,,,,,,,,84.99329,,,,,,,,,,81.32185,,,,,,,,,,,,,,,,,,,,,,,,,,,,,,,,,,,,,,,,
PSP060,Population growth ,world-bank,Percentage,Population growth (annual %),http://data.worldbank.org/indicator/SP.POP.GROW,"You are free to copy, distribute, adapt, display or include the data in other products for commercial and noncommercial purposes at no cost subject to certain limitations summarized below.
You must include attribution for the data you use in the manner indicated in the metadata included with the data.
You must not claim or imply that The World Bank endorses your use of the data by or use The World Bank’s logo(s) or trademark(s) in conjunction with such use.
Other parties may have ownership interests in some of the materials contained on The World Bank Web site. For example, we maintain a list of some specific data within the Datasets that you may not redistribute or reuse without first contacting the original content provider, as well as information regarding how to contact the original content provider. Before incorporating any data in other products, please check the list: Terms of use: Restricted Data
The World Bank makes no warranties with respect to the data and you agree The World Bank shall not be liable to you in connection with your use of the data.
This is only a summary of the Terms of Use for Datasets Listed in The World Bank Data Catalogue. Please read the actual agreement that controls your use of the Datasets, which is available here: Terms of use for datasets. Also see World Bank Terms and Conditions.","Population growth (annual %) is the exponential rate of growth of midyear population from year t-1 to t, expressed as a percentage. Derived from total population. Population source: (1) United Nations Population Division. World Population Prospects, (2) United Nations Statistical Division. Population and Vital Statistics Report (various years), (3) Census reports and other statistical publications from national statistical offices, (4) Eurostat: Demographic Statistics, (5) Secretariat of the Pacific Community: Statistics and Demography Programme, and (6) U.S. Census Bureau: International Database.",,,,,,,,,,,,,,,,,,,,,,,,,,,,,,,,,,,,,,2.0481448494576,2.18548751159121,2.33751614508455,2.43643665303087,2.565101795671,2.90114807965851,3.53981520699797,4.40801968775266,5.53808331030241,6.66266137723098,7.40948297359111,7.41645868763957,6.70980209525268,5.49918085844938,4.30026232837843,3.4901434837174,3.44713148011249,4.04515072208616,4.92565569882617,5.66548110550582,6.15222187650303,6.07932944834292,5.51602668771208,4.70643814621625,3.98997711407851,3.49833867296759,3.49341390058664,3.83014558645831,4.35576139248047,4.79605644449015,5.03771683834612,4.84566843039777,4.2919461072645,3.55755376427954,2.86352409734508,2.45296671023612,2.39558814294324,2.66803074079108,3.10294829179849,3.43037321514361,3.45090646040153,2.98120415962932,2.07352359535178,1.0531110268342,0.179597749424314,-0.466284919440492,-0.713142619432845,-0.70809288602771,-0.633024797187231,-0.629042787146079,-0.3651225476837,0.0347161954536923,0.62696130135954,1.19509330999328,,,,,,,,,,
PSP100,"Percentage of Population Residing in Urban Areas by Major Area, Region and Country, 1950-2050",esa-unpd-wup2011,Percentage,"Percentage of Population Residing in Urban Areas by Major Area, Region and Country, 1950-2050",http://esa.un.org/wpp/Excel-Data/population.htm,"The United Nations maintains this web site (the “Site”) as a courtesy to those who may choose to access the Site (“Users”). The information presented herein is for informative purposes only. The United Nations grants permission to Users to visit the Site and to download and copy the information, documents and materials (collectively, “Materials”) from the Site for the User’s personal, non-commercial use, without any right to resell or redistribute them or to compile or create derivative works therefrom, subject to the terms and conditions outlined below, and also subject to more specific restrictions that may apply to specific Material within this Site.",For information about the method of calculation please visit http://esa.un.org/wpp/Excel-Data/population.htm,98.207,,,,,98.04,,,,,97.858,,,,,97.66,,,,,97.443,,,,,97.113,,,,,96.46,,,,,95.297,,,,,93.258,,,,,89.656,,,,,84.55,,,,,79.928,,,,,74.343,,,,,65.439,,,,,55.259,,,,,53.063,,,,,51.106,,,,,49.392,,,,,47.679,,,,,47.405,,,,,47.2
PSP090,Population density ,world-bank,People per square km,Population density,http://data.worldbank.org/indicator/EN.POP.DNST,"You are free to copy, distribute, adapt, display or include the data in other products for commercial and noncommercial purposes at no cost subject to certain limitations summarized below.
You must include attribution for the data you use in the manner indicated in the metadata included with the data.
You must not claim or imply that The World Bank endorses your use of the data by or use The World Bank’s logo(s) or trademark(s) in conjunction with such use.
Other parties may have ownership interests in some of the materials contained on The World Bank Web site. For example, we maintain a list of some specific data within the Datasets that you may not redistribute or reuse without first contacting the original content provider, as well as information regarding how to contact the original content provider. Before incorporating any data in other products, please check the list: Terms of use: Restricted Data
The World Bank makes no warranties with respect to the data and you agree The World Bank shall not be liable to you in connection with your use of the data.
This is only a summary of the Terms of Use for Datasets Listed in The World Bank Data Catalogue. Please read the actual agreement that controls your use of the Datasets, which is available here: Terms of use for datasets. Also see World Bank Terms and Conditions.","Population density is midyear population divided by land area in square kilometers. Population is based on the de facto definition of population, which counts all residents regardless of legal status or citizenship--except for refugees not permanently settled in the country of asylum, who are generally considered part of the population of their country of origin. Land area is a country's total area, excluding area under inland water bodies, national claims to continental shelf, and exclusive economic zones. In most cases the definition of inland water bodies includes major rivers and lakes. Food and Agriculture Organization and World Bank population estimates.",,,,,,,,,,,,,,,,,,,,,,,,,,,,,,,,,,,,,,34.84,34.1336842105263,33.3957894736842,32.6242105263158,31.8389473684211,31.0326315789474,30.1452631578947,29.0968421052632,27.8421052631579,26.3421052631579,24.6442105263158,22.8842105263158,21.2484210526316,19.8694736842105,18.8063157894737,18.0147368421053,17.3968421052632,16.8073684210526,16.1410526315789,15.3652631578947,14.5189473684211,13.6526315789474,12.8473684210526,12.1578947368421,11.5989473684211,11.1452631578947,10.7621052631579,10.3926315789474,10.0021052631579,9.57578947368421,9.12736842105263,8.67894736842105,8.26842105263158,7.92105263157895,7.64421052631579,7.42842105263158,7.24842105263158,7.07684210526316,6.89052631578947,6.68,6.45473684210526,6.23578947368421,6.05263157894737,5.92842105263158,5.86631578947368,5.85578947368421,5.88315789473684,5.92526315789474,5.96736842105263,6.00526315789474,6.04315789473684,6.06526315789474,6.06315789473684,,,,,,,,,,,
PSP010,"Total population (both sexes combined) by major area, region and country, annually for 1950-2010",esa-unpd-wpp2012,People,Total Population - Both Sexes.,http://esa.un.org/wpp/Excel-Data/population.htm,"The United Nations maintains this web site (the “Site”) as a courtesy to those who may choose to access the Site (“Users”). The information presented herein is for informative purposes only. The United Nations grants permission to Users to visit the Site and to download and copy the information, documents and materials (collectively, “Materials”) from the Site for the User’s personal, non-commercial use, without any right to resell or redistribute them or to compile or create derivative works therefrom, subject to the terms and conditions outlined below, and also subject to more specific restrictions that may apply to specific Material within this Site.","Total Population - Both Sexes. De facto population in a country, area or region as of 1 July of the year indicated. Figures are presented in thousands.",,,,,,,,,,,,,,,,,,,,,,,,,,,,,,,,,,,,,,,,,30993.0,30247.0,29481.0,28638.0,27642.0,26450.0,25025.0,23412.0,21740.0,20186.0,18876.0,17866.0,17114.0,16527.0,15967.0,15334.0,14597.0,13793.0,12970.0,12205.0,11550.0,11019.0,10588.0,10224.0,9873.0,9502.0,9097.0,8671.0,8245.0,7855.0,7525.0,7262.0,7057.0,6886.0,6723.0,6546.0,6346.0,6132.0,5924.0,5750.0,5632.0,5573.0,5563.0,5589.0,5629.0,5669.0,5705.0,5741.0,5762.0,5760.0,5724.0,5656.0,5558.0,5442.0,5318.0,5198.0,5094.0,5016.0,4977.0,4984.0,5047.0
PVW010,Proportion of the population using improved drinking water sources,mdgs,Percentage,Proportion of the population using improved drinking water sources,http://unstats.un.org/unsd/mdg/Metadata.aspx?IndicatorId=0&SeriesId=665,"The United Nations maintains this web site (the “Site”) as a courtesy to those who may choose to access the Site (“Users”). The information presented herein is for informative purposes only. The United Nations grants permission to Users to visit the Site and to download and copy the information, documents and materials (collectively, “Materials”) from the Site for the User’s personal, non-commercial use, without any right to resell or redistribute them or to compile or create derivative works therefrom, subject to the terms and conditions outlined below, and also subject to more specific restrictions that may apply to specific Material within this Site.","The proportion of the population using an improved drinking water source, total, urban, and rural, is the percentage of the population who use any of the following types of water supply for drinking: piped water into dwelling, plot or yard; public tap/standpipe; borehole/tube well; protected dug well; protected spring; rainwater collection and bottled water (if a secondary available source is also improved). It does not include unprotected well, unprotected spring, water provided by carts with small tanks/drums, tanker truck-provided water and bottled water (if secondary source is not an improved source) or surface water taken directly from rivers, ponds, streams, lakes, dams, or irrigation channels. Definitions and a detailed description of these facilities can be found at the website of the WHO/UNICEF Joint Monitoring Programme for Water Supply and Sanitation at www.wssinfo.org.",,,,,,,,,,,,,,,,,,,,,,,,,,,,,,,,,,,,,,,,,,,,87.0,87.0,87.0,87.0,87.0,87.0,87.0,87.0,87.0,87.0,87.0,87.0,87.0,,,,,,,,,,,,,,,,,,,,,,,,,,,,,,,,,,,,,,,,,,,,,
PVE130,Total net enrolment ratio in primary education,mdgs,Percentage,Total net enrolment ratio in primary education,http://mdgs.un.org/unsd/mdg/Metadata.aspx?IndicatorId=0&SeriesId=589,"The United Nations maintains this web site (the “Site”) as a courtesy to those who may choose to access the Site (“Users”). The information presented herein is for informative purposes only. The United Nations grants permission to Users to visit the Site and to download and copy the information, documents and materials (collectively, “Materials”) from the Site for the User’s personal, non-commercial use, without any right to resell or redistribute them or to compile or create derivative works therefrom, subject to the terms and conditions outlined below, and also subject to more specific restrictions that may apply to specific Material within this Site.",Net primary enrolment rate in primary education is the number of children of official primary school age (according to ISCED971) who are enrolled in primary education as a percentage of the total children of the official school age population. Total net primary enrolment rate also includes children of primary school age enrolled in secondary education. Where more than one system of primary education exists within the country the most widespread or common structure is used for determining the official school age group.,,,,,,,,,,,,,,,,,,,,,,,,,,,,,,,,,,,,,,,,,,,,,,80.7,84.4,75.2,91.3,,,,,,,,,,,,,,,,,,,,,,,,,,,,,,,,,,,,,,,,,,,,,,,,,,,,
PVW040,Proportion of the population using improved sanitation facilities,mdgs,Percentage,Proportion of the population using improved sanitation facilities,http://mdgs.un.org/unsd/mdg/Metadata.aspx?IndicatorId=0&SeriesId=668,"The United Nations maintains this web site (the “Site”) as a courtesy to those who may choose to access the Site (“Users”). The information presented herein is for informative purposes only. The United Nations grants permission to Users to visit the Site and to download and copy the information, documents and materials (collectively, “Materials”) from the Site for the User’s personal, non-commercial use, without any right to resell or redistribute them or to compile or create derivative works therefrom, subject to the terms and conditions outlined below, and also subject to more specific restrictions that may apply to specific Material within this Site.","The proportion of the population using an improved sanitation facility, total, urban, rural, is the percentage of the population with access to facilities that hygienically separate human excreta from human contact. Improved facilities include flush/pour flush toilets or latrines connected to a sewer, -septic tank, or -pit, ventilated improved pit latrines, pit latrines with a slab or platform of any material which covers the pit entirely, except for the drop hole and composting toilets/latrines. Unimproved facilities include public or shared facilities of an otherwise acceptable type, flush/pour-flush toilets or latrines which discharge directly into an open sewer or ditch, pit latrines without a slab, bucket latrines, hanging toilets or latrines which directly discharge in water bodies or in the open and the practice of open defecation in the bush, field or bodies or water. Definitions and a detailed description of these facilities can be found at the website of the WHO/UNICEF Joint Monitoring Programme for Water Supply and Sanitation at www.wssinfo.org.",,,,,,,,,,,,,,,,,,,,,,,,,,,,,,,,,,,,,,,,,,,,81.0,81.0,81.0,81.0,81.0,81.0,81.0,81.0,81.0,81.0,81.0,81.0,81.0,,,,,,,,,,,,,,,,,,,,,,,,,,,,,,,,,,,,,,,,,,,,,
PCX051,Mobile cellular subscriptions per 100 inhabitants,mdgs,Mobile cellular subscriptions per 100 people,Mobile cellular telephone subscriptions per 100 inhabitants.,http://mdgs.un.org/unsd/mdg/SeriesDetail.aspx?srid=756&crid=,"The United Nations maintains this web site (the “Site”) as a courtesy to those who may choose to access the Site (“Users”). The information presented herein is for informative purposes only. The United Nations grants permission to Users to visit the Site and to download and copy the information, documents and materials (collectively, “Materials”) from the Site for the User’s personal, non-commercial use, without any right to resell or redistribute them or to compile or create derivative works therefrom, subject to the terms and conditions outlined below, and also subject to more specific restrictions that may apply to specific Material within this Site.","Mobile cellular telephone subscriptions are subscriptions to a public mobile telephone service using cellular technology, which provide access to the public switched telephone network. Post-paid and prepaid subscriptions are included.",,,,,,,,,,,,,,,,,,,,,,,,,,,,,,,,,,,,,,,,,,,,,,,100.24,82.7,41.64,,,,,,0.0,0.0,0.0,0.0,0.0,0.0,0.0,,,,,,,,,,,,,,,,,,,,,,,,,,,,,,,,,,,,,,,,
PCX080,Fixed telephone lines per 100 inhabitants,mdgs,Fixed telephone lines per 100 people,Fixed telephone lines per 100 inhabitants.,http://data.worldbank.org/indicator/IT.MLT.MAIN.P2,"The United Nations maintains this web site (the “Site”) as a courtesy to those who may choose to access the Site (“Users”). The information presented herein is for informative purposes only. The United Nations grants permission to Users to visit the Site and to download and copy the information, documents and materials (collectively, “Materials”) from the Site for the User’s personal, non-commercial use, without any right to resell or redistribute them or to compile or create derivative works therefrom, subject to the terms and conditions outlined below, and also subject to more specific restrictions that may apply to specific Material within this Site.",Telephone lines are fixed telephone lines that connect a subscriber's terminal equipment to the public switched telephone network and that have a port on a telephone exchange. Integrated services digital network channels ands fixed wireless subscribers are included.,,,,,,,,,,,,,,,,,,,,,,,,,,,,,,,,,,,,,12.15,12.09,11.41,,11.94,12.23,12.55,12.92,13.39,13.99,14.86,15.87,16.7,18.93,17.99,15.78,14.09,26.74,25.38,24.24,22.61,23.45,24.67,,,,,,,,,,,,,,,,,,,,,,,,,,,,,,,,,,,,,,,,,,
