Indicator ID,Indicator name,Source dataset,Units,Dataset summary,More Info,Terms of Use,HDX Methodology,2050,2049,2048,2047,2046,2045,2044,2043,2042,2041,2040,2039,2038,2037,2036,2035,2034,2033,2032,2031,2030,2029,2028,2027,2026,2025,2024,2023,2022,2021,2020,2019,2018,2017,2016,2015,2014,2013,2012,2011,2010,2009,2008,2007,2006,2005,2004,2003,2002,2001,2000,1999,1998,1997,1996,1995,1994,1993,1992,1991,1990,1989,1988,1987,1986,1985,1984,1983,1982,1981,1980,1979,1978,1977,1976,1975,1974,1973,1972,1971,1970,1969,1968,1967,1966,1965,1964,1963,1962,1961,1960,1959,1958,1957,1956,1955,1954,1953,1952,1951,1950
PVW010,Proportion of the population using improved drinking water sources,mdgs,Percentage,Proportion of the population using improved drinking water sources,http://unstats.un.org/unsd/mdg/Metadata.aspx?IndicatorId=0&SeriesId=665,"The United Nations maintains this web site (the “Site”) as a courtesy to those who may choose to access the Site (“Users”). The information presented herein is for informative purposes only. The United Nations grants permission to Users to visit the Site and to download and copy the information, documents and materials (collectively, “Materials”) from the Site for the User’s personal, non-commercial use, without any right to resell or redistribute them or to compile or create derivative works therefrom, subject to the terms and conditions outlined below, and also subject to more specific restrictions that may apply to specific Material within this Site.","The proportion of the population using an improved drinking water source, total, urban, and rural, is the percentage of the population who use any of the following types of water supply for drinking: piped water into dwelling, plot or yard; public tap/standpipe; borehole/tube well; protected dug well; protected spring; rainwater collection and bottled water (if a secondary available source is also improved). It does not include unprotected well, unprotected spring, water provided by carts with small tanks/drums, tanker truck-provided water and bottled water (if secondary source is not an improved source) or surface water taken directly from rivers, ponds, streams, lakes, dams, or irrigation channels. Definitions and a detailed description of these facilities can be found at the website of the WHO/UNICEF Joint Monitoring Programme for Water Supply and Sanitation at www.wssinfo.org.",,,,,,,,,,,,,,,,,,,,,,,,,,,,,,,,,,,,79.0,77.0,76.0,74.0,72.0,70.0,68.0,66.0,64.0,63.0,61.0,59.0,57.0,56.0,54.0,52.0,50.0,49.0,47.0,45.0,44.0,42.0,41.0,39.0,38.0,36.0,,,,,,,,,,,,,,,,,,,,,,,,,,,,,,,,,,,,,,,,
PVX040,Incidence of Conflict,acled,Incidents,Incidence of conflict,http://www.acleddata.com,"If using ACLED data, please cite: Raleigh, Clionadh, Andrew Linke, Håvard Hegre and Joakim Karlsen. 2010. Introducing ACLED-Armed Conflict Location and Event Data. Journal of Peace Research 47(5) 1-10.","The Armed Conflict Location and Event Database (ACLED) project codes reported information on the exact location, date, and other characteristics of politically violent events in unstable and warring states. ACLED focuses specifically on: 
- Tracking rebel, militia and government activity over time and space 
- Locating rebel group bases, headquarters, strongholds and presence 
- Distinguishing between territorial transfers of military control from governments 
to rebel groups and vice versa 
- Recording violent acts between militias 
- Collecting information on rioting and protesting 
- Non-violent events that are crucial to the dynamics of political violence (e.g. rallies, recruitment drives, peace talks, high-level arrests) 
ACLED data cover all countries on the African continent from 1997-present. Real-time data is available for African states. Data for additional countries including Haiti, Laos, Cambodia, Nepal, Myanmar are available from 1997-early 2010. Data for Afghanistan and Pakistan is available from 2006-2009 and Lebanon from 2006-2012.

Total number of incidents of all types are summed by country by year.  Non-violent incident categories are excluded from the sum.",,,,,,,,,,,,,,,,,,,,,,,,,,,,,,,,,,,,,6.0,5.0,18.0,15.0,5.0,17.0,6.0,2.0,52.0,17.0,12.0,10.0,10.0,7.0,17.0,45.0,191.0,6.0,,,,,,,,,,,,,,,,,,,,,,,,,,,,,,,,,,,,,,,,,,,,,,,
PVE130,Total net enrolment ratio in primary education,mdgs,Percentage,Total net enrolment ratio in primary education,http://mdgs.un.org/unsd/mdg/Metadata.aspx?IndicatorId=0&SeriesId=589,"The United Nations maintains this web site (the “Site”) as a courtesy to those who may choose to access the Site (“Users”). The information presented herein is for informative purposes only. The United Nations grants permission to Users to visit the Site and to download and copy the information, documents and materials (collectively, “Materials”) from the Site for the User’s personal, non-commercial use, without any right to resell or redistribute them or to compile or create derivative works therefrom, subject to the terms and conditions outlined below, and also subject to more specific restrictions that may apply to specific Material within this Site.",Net primary enrolment rate in primary education is the number of children of official primary school age (according to ISCED971) who are enrolled in primary education as a percentage of the total children of the official school age population. Total net primary enrolment rate also includes children of primary school age enrolled in secondary education. Where more than one system of primary education exists within the country the most widespread or common structure is used for determining the official school age group.,,,,,,,,,,,,,,,,,,,,,,,,,,,,,,,,,,,,,,,,,70.8,,,,,,,,,,49.4,50.4,,,,,,,,,,,,,,,,,,,,,,,,,,,,,,,,,,,,,,,,,,,,,,,,,
PVX020,GNA Crisis Index,echo,Index,GNA crisis index,http://ec.europa.eu,"Copyright notice

© European Union, 1995-2014 

Reuse is authorised, provided the source is acknowledged. The reuse policy of the European Commission is implemented by a Decision of 12 December 2011  [728KB] . 

The general principle of reuse can be subject to conditions which may be specified in individual copyright notices. Therefore users are advised to refer to the copyright notices of the individual websites maintained under Europa and of the individual documents. Reuse is not applicable to documents subject to intellectual property rights of third parties. ","The GNA Final Index lists countries in ranking order. The GNA Vulnerability Index and the GNA Crisis Index are shown, as well as the various dimensions. Each dimension has a value that is the result of combining indicators. Note that all values are the result of ranking countries. If countries are in the top quartile (25%), they score 3; in the bottom quartile, they score 1; in the middle 2 quartiles, they score 2.  Index value is taken directly from the source dataset. For the calculation methods see the Methodological notes on http://ec.europa.eu/echo/policies/strategy_en.htm.",,,,,,,,,,,,,,,,,,,,,,,,,,,,,,,,,,,,,,,3.0,,,,,,,,,,,,,,,,,,,,,,,,,,,,,,,,,,,,,,,,,,,,,,,,,,,,,,,,,,,,,,
PVW040,Proportion of the population using improved sanitation facilities,mdgs,Percentage,Proportion of the population using improved sanitation facilities,http://mdgs.un.org/unsd/mdg/Metadata.aspx?IndicatorId=0&SeriesId=668,"The United Nations maintains this web site (the “Site”) as a courtesy to those who may choose to access the Site (“Users”). The information presented herein is for informative purposes only. The United Nations grants permission to Users to visit the Site and to download and copy the information, documents and materials (collectively, “Materials”) from the Site for the User’s personal, non-commercial use, without any right to resell or redistribute them or to compile or create derivative works therefrom, subject to the terms and conditions outlined below, and also subject to more specific restrictions that may apply to specific Material within this Site.","The proportion of the population using an improved sanitation facility, total, urban, rural, is the percentage of the population with access to facilities that hygienically separate human excreta from human contact. Improved facilities include flush/pour flush toilets or latrines connected to a sewer, -septic tank, or -pit, ventilated improved pit latrines, pit latrines with a slab or platform of any material which covers the pit entirely, except for the drop hole and composting toilets/latrines. Unimproved facilities include public or shared facilities of an otherwise acceptable type, flush/pour-flush toilets or latrines which discharge directly into an open sewer or ditch, pit latrines without a slab, bucket latrines, hanging toilets or latrines which directly discharge in water bodies or in the open and the practice of open defecation in the bush, field or bodies or water. Definitions and a detailed description of these facilities can be found at the website of the WHO/UNICEF Joint Monitoring Programme for Water Supply and Sanitation at www.wssinfo.org.",,,,,,,,,,,,,,,,,,,,,,,,,,,,,,,,,,,,21.0,21.0,21.0,20.0,20.0,19.0,18.0,18.0,17.0,16.0,16.0,15.0,14.0,14.0,13.0,12.0,12.0,11.0,11.0,11.0,11.0,11.0,,,,,,,,,,,,,,,,,,,,,,,,,,,,,,,,,,,,,,,,,,,,
PVF020,Per capita food supply,faostat3,kcal/capita/day,"Estimates of per capita food supplies available for human consumption during the reference period in terms of quantity, caloric value, protein and fat content.",http://faostat3.fao.org/faostat-gateway/go/to/browse/C/*/E,"Content on www.fao.org, its affiliated websites and specific pages (collectively the FAO website) is protected by copyright. To ensure wide dissemination of its information, FAO is committed to making its content freely available and encourages the use, reproduction and dissemination of the text, multimedia and data products presented. Except where otherwise indicated, content may be copied, printed and downloaded for private study, research and teaching purposes, or for use in non-commercial products or services, provided that appropriate acknowledgement of FAO as the source and copyright holder is given and that FAO's endorsement of users' views, products or services is not stated or implied in any way. FAO encourages unrestricted use of news releases provided on the FAO website, and no formal permission is required to reproduce these materials.

All requests for translation and adaptation rights, and for resale and other commercial use rights should be addressed to copyright@fao.org or submitted via the online Licence Request Form when downloading.

RECOMMENDED CITATION:

[© FAO] [Year of publication] [Title of content] [Page number (for publications)] [Location on FAO website] [Date accessed and/or downloaded]","Estimates of per capita food supplies available for human consumption during the reference period in terms of quantity, caloric value, protein and fat content. Calorie supplies are reported in kilocalories (1 calorie = 4.19 kilojoules). Per capita supplies in terms of product weight are derived from the total supplies available for human consumption (i.e. Food) by dividing the quantities of Food by the total population actually partaking of the food supplies during the reference period, i.e. the present in-area (de facto) population within the present geographical boundaries of the country. In other words, nationals living abroad during the reference period are excluded, but foreigners living in the country are included. Adjustments are made wherever possible for part-time presence or absence, such as temporary migrants, tourists and refugees supported by special schemes (if it has not been possible to allow for the amounts provided by such schemes under imports). In almost all cases, the population figures used are the mid-year estimates published by the United Nations Population Division. Per capita supply figures shown in the commodity balances therefore represent only the average supply available for the population as a whole and do not necessarily indicate what is actually consumed by individuals. Even if they are taken as approximation to per capita consumption, it is important to note that the amount of food actually consumed may be lower than the quantity shown here, depending on the degree of losses of edible food and nutrients in the household, e.g. during storage, in preparation and cooking etc. In many cases commodities are not consumed in the primary form in which they are presented in the commodity balance, e.g. cereals enter the household mainly in processed form like flour, meal, husked or milled rice. To take this fact into account, the caloric value, the protein and fat content shown against primary commodities in the commodity balances have been derived by applying the appropriate food composition factors to the quantities of the processed commodities and not by multiplying the quantities shown in the commodity balance with the food composition factors relating to primary commodities.",,,,,,,,,,,,,,,,,,,,,,,,,,,,,,,,,,,,,,,,2304.0,2351.0,2292.0,2328.0,2234.0,2216.0,2269.0,2248.0,2249.0,2259.0,2255.0,2250.0,2160.0,2152.0,2185.0,2251.0,2357.0,2340.0,2307.0,2373.0,2319.0,2249.0,2190.0,2213.0,2258.0,2249.0,2347.0,2134.0,2141.0,2144.0,2144.0,2020.0,1938.0,1952.0,1833.0,1753.0,1680.0,1605.0,1568.0,1575.0,1634.0,1534.0,1623.0,1542.0,1639.0,1671.0,1664.0,1621.0,1596.0,1571.0,1615.0,,,,,,,,,,,
PVX010,GNA Vulnerability Index,echo,Index,GNA vulnerability index,http://ec.europa.eu,"Copyright notice

© European Union, 1995-2014 

Reuse is authorised, provided the source is acknowledged. The reuse policy of the European Commission is implemented by a Decision of 12 December 2011  [728KB] . 

The general principle of reuse can be subject to conditions which may be specified in individual copyright notices. Therefore users are advised to refer to the copyright notices of the individual websites maintained under Europa and of the individual documents. Reuse is not applicable to documents subject to intellectual property rights of third parties. ","The GNA Final Index lists countries in ranking order. The GNA Vulnerability Index and the GNA Crisis Index are shown, as well as the various dimensions. Each dimension has a value that is the result of combining indicators. Note that all values are the result of ranking countries. If countries are in the top quartile (25%), they score 3; in the bottom quartile, they score 1; in the middle 2 quartiles, they score 2. Index value is taken directly from the source dataset. For the calculation methods see the Methodological notes on http://ec.europa.eu/echo/policies/strategy_en.htm",,,,,,,,,,,,,,,,,,,,,,,,,,,,,,,,,,,,,,,2.0,,,,,,,,,,,,,,,,,,,,,,,,,,,,,,,,,,,,,,,,,,,,,,,,,,,,,,,,,,,,,,
PVN050,Children under 5 moderately or severely underweight,mdgs,Percentage,Percentage of children under 5 moderately or severely underweight,http://mdgs.un.org/unsd/mdg/Metadata.aspx?IndicatorId=0&SeriesId=559,"The United Nations maintains this web site (the “Site”) as a courtesy to those who may choose to access the Site (“Users”). The information presented herein is for informative purposes only. The United Nations grants permission to Users to visit the Site and to download and copy the information, documents and materials (collectively, “Materials”) from the Site for the User’s personal, non-commercial use, without any right to resell or redistribute them or to compile or create derivative works therefrom, subject to the terms and conditions outlined below, and also subject to more specific restrictions that may apply to specific Material within this Site.","Prevalence of (moderately and severely) underweight children is the percentage of children aged 0-59 months whose weights for age are less than two standard deviations below the median weight for age of the international reference population. The international reference population, often referred to as the NCHS/WHO reference population, was formulated by the National Center for Health Statistics (NCHS) as a reference for the United States and later adopted by the World Health Organization (WHO).

The NCHS/WHO reference standard represents the distribution of height and weight by age and sex in a well-nourished population. In a well-nourished population, 2.3 percent of children fall below minus two standard deviations.

A new standard reference population, the WHO Child Growth Standards, was released in April 2006 and is also being used to estimate underweight prevalence (see Comments and Limitations below).

Percentage of children under five that are underweight =        (Number of children under age five that fall below minus two standard deviations from the median weight for age of the NCHS/WHO standard (moderate and severe))*100/ Total number of children under age five that were weighted.",,,,,,,,,,,,,,,,,,,,,,,,,,,,,,,,,,,,,,,,,18.1,,16.6,,17.4,,,,,,21.9,,,,,,,,,,,,,,,,,,,,,,,,,,,,,,,,,,,,,,,,,,,,,,,,,,
PVH140,"Children under five mortality rate per 1,000 live births",mdgs,"Deaths per 1,000 live births","Children under five mortality rate per 1,000 live births",http://mdgs.un.org/unsd/mdg/Metadata.aspx?IndicatorId=0&SeriesId=561,"The United Nations maintains this web site (the “Site”) as a courtesy to those who may choose to access the Site (“Users”). The information presented herein is for informative purposes only. The United Nations grants permission to Users to visit the Site and to download and copy the information, documents and materials (collectively, “Materials”) from the Site for the User’s personal, non-commercial use, without any right to resell or redistribute them or to compile or create derivative works therefrom, subject to the terms and conditions outlined below, and also subject to more specific restrictions that may apply to specific Material within this Site.","The under-five mortality rate (U5MR) is the probability (expressed as a rate per 1,000 live births) of a child born in a specified year dying before reaching the age of five if subject to current age-specific mortality rates.

A live birth is the complete expulsion or extraction from its mother of a product of conception, irrespective of the duration of the pregnancy, which, after such separation, breathes or shows any other evidence of life—such as beating of the heart, pulsation of the umbilical cord, or definite movement of voluntary muscles—whether or not the umbilical cord has been cut or the placenta is attached. Each product of such a birth is considered a live birth.",,,,,,,,,,,,,,,,,,,,,,,,,,,,,,,,,,,,,,123.9,127.9,131.7,135.9,140.0,144.2,148.5,152.8,157.1,161.9,166.6,171.4,176.2,180.8,185.5,190.3,195.0,199.8,204.3,208.8,213.1,217.1,221.1,224.8,,,,,,,,,,,,,,,,,,,,,,,,,,,,,,,,,,,,,,,,
PCX100,Internet users ,world-bank,Internet users per 100 people,Internet users are people with access to the worldwide network.,http://data.worldbank.org/indicator/IT.NET.USER.P2,"You are free to copy, distribute, adapt, display or include the data in other products for commercial and noncommercial purposes at no cost subject to certain limitations summarized below.
You must include attribution for the data you use in the manner indicated in the metadata included with the data.
You must not claim or imply that The World Bank endorses your use of the data by or use The World Bank’s logo(s) or trademark(s) in conjunction with such use.
Other parties may have ownership interests in some of the materials contained on The World Bank Web site. For example, we maintain a list of some specific data within the Datasets that you may not redistribute or reuse without first contacting the original content provider, as well as information regarding how to contact the original content provider. Before incorporating any data in other products, please check the list: Terms of use: Restricted Data
The World Bank makes no warranties with respect to the data and you agree The World Bank shall not be liable to you in connection with your use of the data.
This is only a summary of the Terms of Use for Datasets Listed in The World Bank Data Catalogue. Please read the actual agreement that controls your use of the Datasets, which is available here: Terms of use for datasets. Also see World Bank Terms and Conditions.","The Internet is a world-wide public computer network. It provides access to a number of communication services including the World Wide Web and carries e-mail, news, entertainment and data files, irrespective of the device used (not assumed to be only via a computer - it may also be by mobile-cellular telephone, other wireless devices, games machine, digital TV etc.). Access can be via a fixed or mobile network.

Individuals using the Internet refers to those that used the Internet in the last 12 months from any location. As of 2013, the definition has been updated and the reference period is the last three months instead of 12. While some countries already used the narrower reference period in the past, most countries may still take some time to adhere to the new reference period. Data are based on surveys generally carried out by national statistical offices or estimated based on the number of Internet subscriptions.",,,,,,,,,,,,,,,,,,,,,,,,,,,,,,,,,,,,,,3.1,2.89399062085531,2.672,2.45,2.30328059172582,2.35488871087933,2.20630223745003,2.0571967045036,1.90136531610877,1.80814220342991,1.35419747762901,1.02299323436117,0.299569144677667,0.230103170591588,0.117702448210923,0.02406042052803,0.0163890632503118,,,,,,,0.0,,,,,,,,,,,,,,,,,,,,,,,,,,,,,,,,,,,,,,,,
PCX130,Logistics performance index: Overall ,world-bank,Range (1=low to 5=high),Logistics performance index,Details of the survey methodology and index construction methodology are in Arvis and others' Connecting to Compete 2010: Trade Logistics in the Global Economy (2010). http://data.worldbank.org/indicator/LP.LPI.OVRL.XQ,"You are free to copy, distribute, adapt, display or include the data in other products for commercial and noncommercial purposes at no cost subject to certain limitations summarized below.
You must include attribution for the data you use in the manner indicated in the metadata included with the data.
You must not claim or imply that The World Bank endorses your use of the data by or use The World Bank’s logo(s) or trademark(s) in conjunction with such use.
Other parties may have ownership interests in some of the materials contained on The World Bank Web site. For example, we maintain a list of some specific data within the Datasets that you may not redistribute or reuse without first contacting the original content provider, as well as information regarding how to contact the original content provider. Before incorporating any data in other products, please check the list: Terms of use: Restricted Data
The World Bank makes no warranties with respect to the data and you agree The World Bank shall not be liable to you in connection with your use of the data.
This is only a summary of the Terms of Use for Datasets Listed in The World Bank Data Catalogue. Please read the actual agreement that controls your use of the Datasets, which is available here: Terms of use for datasets. Also see World Bank Terms and Conditions.","Logistics Performance Index overall score reflects perceptions of a country's logistics based on efficiency of customs clearance process, quality of trade- and transport-related infrastructure, ease of arranging competitively priced shipments, quality of logistics services, ability to track and trace consignments, and frequency with which shipments reach the consignee within the scheduled time. The index ranges from 1 to 5, with a higher score representing better performance. Data are from Logistics Performance Index surveys conducted by the World Bank in partnership with academic and international institutions and private companies and individuals engaged in international logistics. 2009 round of surveys covered more than 5,000 country assessments by nearly 1,000 international freight forwarders. Respondents evaluate eight markets on six core dimensions on a scale from 1 (worst) to 5 (best). The markets are chosen based on the most important export and import markets of the respondent's country, random selection, and, for landlocked countries, neighboring countries that connect them with international markets. Scores for the six areas are averaged across all respondents and aggregated to a single score using principal components analysis.",,,,,,,,,,,,,,,,,,,,,,,,,,,,,,,,,,,,,2.426464,,2.6,,2.1,,,2.28,,,,,,,,,,,,,,,,,,,,,,,,,,,,,,,,,,,,,,,,,,,,,,,,,,,,,,,,,
