Indicator ID,Indicator name,Source dataset,Units,Dataset summary,More Info,Terms of Use,HDX Methodology,2050,2049,2048,2047,2046,2045,2044,2043,2042,2041,2040,2039,2038,2037,2036,2035,2034,2033,2032,2031,2030,2029,2028,2027,2026,2025,2024,2023,2022,2021,2020,2019,2018,2017,2016,2015,2014,2013,2012,2011,2010,2009,2008,2007,2006,2005,2004,2003,2002,2001,2000,1999,1998,1997,1996,1995,1994,1993,1992,1991,1990,1989,1988,1987,1986,1985,1984,1983,1982,1981,1980,1979,1978,1977,1976,1975,1974,1973,1972,1971,1970,1969,1968,1967,1966,1965,1964,1963,1962,1961,1960,1959,1958,1957,1956,1955,1954,1953,1952,1951,1950
PSE130,"Household final consumption expenditure, PPP ",world-bank,Constant (2005) international US$,Household final consumption expenditure in PPP,http://data.worldbank.org/indicator/NE.CON.PRVT.PP.KD,"You are free to copy, distribute, adapt, display or include the data in other products for commercial and noncommercial purposes at no cost subject to certain limitations summarized below.
You must include attribution for the data you use in the manner indicated in the metadata included with the data.
You must not claim or imply that The World Bank endorses your use of the data by or use The World Bank’s logo(s) or trademark(s) in conjunction with such use.
Other parties may have ownership interests in some of the materials contained on The World Bank Web site. For example, we maintain a list of some specific data within the Datasets that you may not redistribute or reuse without first contacting the original content provider, as well as information regarding how to contact the original content provider. Before incorporating any data in other products, please check the list: Terms of use: Restricted Data
The World Bank makes no warranties with respect to the data and you agree The World Bank shall not be liable to you in connection with your use of the data.
This is only a summary of the Terms of Use for Datasets Listed in The World Bank Data Catalogue. Please read the actual agreement that controls your use of the Datasets, which is available here: Terms of use for datasets. Also see World Bank Terms and Conditions.","Household final consumption expenditure (formerly private consumption) is the market value of all goods and services, including durable products (such as cars, washing machines, and home computers), purchased by households. It excludes purchases of dwellings but includes imputed rent for owner-occupied dwellings. It also includes payments and fees to governments to obtain permits and licenses. Here, household consumption expenditure includes the expenditures of nonprofit institutions serving households, even when reported separately by the country. Data are converted to constant 2005 international dollars using purchasing power parity rates.",,,,,,,,,,,,,,,,,,,,,,,,,,,,,,,,,,,,,,,,9.4793818064593E11,9.46892590598091E11,9.32901777553061E11,9.47790115628979E11,9.55422921794856E11,9.44991308944971E11,9.32216551303075E11,9.21207575145429E11,9.1427904820202E11,9.0614871334338E11,9.04801189060312E11,8.98480965612313E11,8.77346753782586E11,8.54853144618377E11,8.2605230524483E11,7.99863164590648E11,7.91400463987316E11,7.78802260729738E11,7.66644553171998E11,7.90835909238196E11,7.77374202843072E11,7.57035671421734E11,7.41923914025544E11,7.12916829294278E11,6.84878376061435E11,6.61133387771712E11,6.34872818779686E11,6.17171884378077E11,5.99098874142162E11,6.01227780890544E11,5.95872974759587E11,5.86981561079354E11,,,,,,,,,,,,,,,,,,,,,,,,,,,,,,
PVE110,Mean years of schooling (of adults),data.undp.org,Years,Mean years of schooling,https://data.undp.org/dataset/Mean-years-of-schooling-of-adults-years-/m67k-vi5c,"The information in the various pages of the UNDP Web site is issued by the United Nations Development Programme for general distribution. The information presented is protected under the Berne Convention for the Protection of Literature and Artistic works, under other international conventions and under national laws on copyright and neighboring rights. Extracts of the information in the Web site may be reviewed, reproduced or translated for research or private study but not for sale or for use in conjunction with commercial purposes. Any use of information in the Web site should be accompanied by an acknowledgment of UNDP as the source, citing the uniform resource locator (URL) of the article. Reproduction or translation of substantial portions of the Web site, or any use other than for educational or other non-commercial purposes, require explicit, prior authorization in writing. Applications and enquiries should be addressed to the programme responsible for the page used.","Average number of years of education received by people ages 25 and older, converted from education attainment levels using official durations of each level.",,,,,,,,,,,,,,,,,,,,,,,,,,,,,,,,,,,,,10.1,,10.1,10.1,10.1,10.0,9.9,9.8,9.6,9.5,,,,,8.4,,,,,,,,,,7.2,,,,,,,,,,6.1,,,,,,,,,,,,,,,,,,,,,,,,,,,,,,
PSE030,"GDP per capita, PPP ",world-bank,Current International US$,Gross domestic product per capita in PPP,http://data.worldbank.org/indicator/NY.GDP.PCAP.PP.CD,"You are free to copy, distribute, adapt, display or include the data in other products for commercial and noncommercial purposes at no cost subject to certain limitations summarized below.
You must include attribution for the data you use in the manner indicated in the metadata included with the data.
You must not claim or imply that The World Bank endorses your use of the data by or use The World Bank’s logo(s) or trademark(s) in conjunction with such use.
Other parties may have ownership interests in some of the materials contained on The World Bank Web site. For example, we maintain a list of some specific data within the Datasets that you may not redistribute or reuse without first contacting the original content provider, as well as information regarding how to contact the original content provider. Before incorporating any data in other products, please check the list: Terms of use: Restricted Data
The World Bank makes no warranties with respect to the data and you agree The World Bank shall not be liable to you in connection with your use of the data.
This is only a summary of the Terms of Use for Datasets Listed in The World Bank Data Catalogue. Please read the actual agreement that controls your use of the Datasets, which is available here: Terms of use for datasets. Also see World Bank Terms and Conditions.",GDP per capita based on purchasing power parity (PPP). PPP GDP is gross domestic product converted to international dollars using purchasing power parity rates. An international dollar has the same purchasing power over GDP as the U.S. dollar has in the United States. GDP at purchaser's prices is the sum of gross value added by all resident producers in the economy plus any product taxes and minus any subsidies not included in the value of the products. It is calculated without making deductions for depreciation of fabricated assets or for depletion and degradation of natural resources. Data are in current international dollars.,,,,,,,,,,,,,,,,,,,,,,,,,,,,,,,,,,,,,,35280.7377429301,35808.0364440693,35901.252448938,34716.0919873882,34170.1568290991,35187.7512426399,33731.1770722526,31988.0866632388,29666.36207389,28791.6647893877,28471.5814791499,27910.1989514803,28251.2854250027,26657.9214653596,25168.3721861054,24681.8178273925,23460.8963195797,22676.31700242,21977.1939013028,20924.4669665015,20061.0983275937,19775.5256548147,19187.8619154444,18301.0175580944,16650.9443868067,15529.2148022141,14413.2171927257,13570.8941395128,12905.7129269389,12185.9056802985,11380.3194040413,10824.7070586215,10168.5628260472,9230.43898417213,,,,,,,,,,,,,,,,,,,,,,,,,,,,,,
PSE110,GNI per capita in PPP terms (constant 2005 international $),data.undp.org,Constant (2005) international US$,Gross national income in PPP terms (constant 2005 international $),http://data.worldbank.org/indicator/NY.GDP.PCAP.PP.KD,"The information in the various pages of the UNDP Web site is issued by the United Nations Development Programme for general distribution. The information presented is protected under the Berne Convention for the Protection of Literature and Artistic works, under other international conventions and under national laws on copyright and neighboring rights. Extracts of the information in the Web site may be reviewed, reproduced or translated for research or private study but not for sale or for use in conjunction with commercial purposes. Any use of information in the Web site should be accompanied by an acknowledgment of UNDP as the source, citing the uniform resource locator (URL) of the article. Reproduction or translation of substantial portions of the Web site, or any use other than for educational or other non-commercial purposes, require explicit, prior authorization in writing. Applications and enquiries should be addressed to the programme responsible for the page used.",GDP per capita based on purchasing power parity (PPP). PPP GDP is gross domestic product converted to international dollars using purchasing power parity rates. An international dollar has the same purchasing power over GDP as the U.S. dollar has in the United States. GDP at purchaser's prices is the sum of gross value added by all resident producers in the economy plus any product taxes and minus any subsidies not included in the value of the products. It is calculated without making deductions for depreciation of fabricated assets or for depletion and degradation of natural resources. Data are in constant 2005 international dollars.,,,,,,,,,,,,,,,,,,,,,,,,,,,,,,,,,,,,,,,26158.0,26890.0,26944.0,26605.0,28145.0,28993.0,28824.0,28290.0,,,,,27505.0,,,,,,,,,,23367.0,,,,,,,,,,18859.0,,,,,,,,,,,,,,,,,,,,,,,,,,,,,,
PVW010,Proportion of the population using improved drinking water sources,mdgs,Percentage,Proportion of the population using improved drinking water sources,http://unstats.un.org/unsd/mdg/Metadata.aspx?IndicatorId=0&SeriesId=665,"The United Nations maintains this web site (the “Site”) as a courtesy to those who may choose to access the Site (“Users”). The information presented herein is for informative purposes only. The United Nations grants permission to Users to visit the Site and to download and copy the information, documents and materials (collectively, “Materials”) from the Site for the User’s personal, non-commercial use, without any right to resell or redistribute them or to compile or create derivative works therefrom, subject to the terms and conditions outlined below, and also subject to more specific restrictions that may apply to specific Material within this Site.","The proportion of the population using an improved drinking water source, total, urban, and rural, is the percentage of the population who use any of the following types of water supply for drinking: piped water into dwelling, plot or yard; public tap/standpipe; borehole/tube well; protected dug well; protected spring; rainwater collection and bottled water (if a secondary available source is also improved). It does not include unprotected well, unprotected spring, water provided by carts with small tanks/drums, tanker truck-provided water and bottled water (if secondary source is not an improved source) or surface water taken directly from rivers, ponds, streams, lakes, dams, or irrigation channels. Definitions and a detailed description of these facilities can be found at the website of the WHO/UNICEF Joint Monitoring Programme for Water Supply and Sanitation at www.wssinfo.org.",,,,,,,,,,,,,,,,,,,,,,,,,,,,,,,,,,,,100.0,100.0,100.0,100.0,100.0,100.0,100.0,100.0,100.0,100.0,100.0,100.0,100.0,100.0,100.0,100.0,100.0,100.0,100.0,100.0,100.0,100.0,100.0,100.0,100.0,100.0,,,,,,,,,,,,,,,,,,,,,,,,,,,,,,,,,,,,,,,,
PVE130,Total net enrolment ratio in primary education,mdgs,Percentage,Total net enrolment ratio in primary education,http://mdgs.un.org/unsd/mdg/Metadata.aspx?IndicatorId=0&SeriesId=589,"The United Nations maintains this web site (the “Site”) as a courtesy to those who may choose to access the Site (“Users”). The information presented herein is for informative purposes only. The United Nations grants permission to Users to visit the Site and to download and copy the information, documents and materials (collectively, “Materials”) from the Site for the User’s personal, non-commercial use, without any right to resell or redistribute them or to compile or create derivative works therefrom, subject to the terms and conditions outlined below, and also subject to more specific restrictions that may apply to specific Material within this Site.",Net primary enrolment rate in primary education is the number of children of official primary school age (according to ISCED971) who are enrolled in primary education as a percentage of the total children of the official school age population. Total net primary enrolment rate also includes children of primary school age enrolled in secondary education. Where more than one system of primary education exists within the country the most widespread or common structure is used for determining the official school age group.,,,,,,,,,,,,,,,,,,,,,,,,,,,,,,,,,,,,,,,98.4,99.1,99.4,99.3,99.3,99.3,99.4,99.3,99.1,99.5,99.5,99.7,99.7,99.9,,99.9,99.6,98.7,,,,,,,,,,,,,,,,,,,,,,,,,,,,,,,,,,,,,,,,,,,,,
PVW040,Proportion of the population using improved sanitation facilities,mdgs,Percentage,Proportion of the population using improved sanitation facilities,http://mdgs.un.org/unsd/mdg/Metadata.aspx?IndicatorId=0&SeriesId=668,"The United Nations maintains this web site (the “Site”) as a courtesy to those who may choose to access the Site (“Users”). The information presented herein is for informative purposes only. The United Nations grants permission to Users to visit the Site and to download and copy the information, documents and materials (collectively, “Materials”) from the Site for the User’s personal, non-commercial use, without any right to resell or redistribute them or to compile or create derivative works therefrom, subject to the terms and conditions outlined below, and also subject to more specific restrictions that may apply to specific Material within this Site.","The proportion of the population using an improved sanitation facility, total, urban, rural, is the percentage of the population with access to facilities that hygienically separate human excreta from human contact. Improved facilities include flush/pour flush toilets or latrines connected to a sewer, -septic tank, or -pit, ventilated improved pit latrines, pit latrines with a slab or platform of any material which covers the pit entirely, except for the drop hole and composting toilets/latrines. Unimproved facilities include public or shared facilities of an otherwise acceptable type, flush/pour-flush toilets or latrines which discharge directly into an open sewer or ditch, pit latrines without a slab, bucket latrines, hanging toilets or latrines which directly discharge in water bodies or in the open and the practice of open defecation in the bush, field or bodies or water. Definitions and a detailed description of these facilities can be found at the website of the WHO/UNICEF Joint Monitoring Programme for Water Supply and Sanitation at www.wssinfo.org.",,,,,,,,,,,,,,,,,,,,,,,,,,,,,,,,,,,,100.0,100.0,100.0,100.0,100.0,100.0,100.0,100.0,100.0,100.0,100.0,100.0,100.0,100.0,100.0,100.0,100.0,100.0,100.0,100.0,100.0,100.0,100.0,100.0,100.0,100.0,,,,,,,,,,,,,,,,,,,,,,,,,,,,,,,,,,,,,,,,
PVF020,Per capita food supply,faostat3,kcal/capita/day,"Estimates of per capita food supplies available for human consumption during the reference period in terms of quantity, caloric value, protein and fat content.",http://faostat3.fao.org/faostat-gateway/go/to/browse/C/*/E,"Content on www.fao.org, its affiliated websites and specific pages (collectively the FAO website) is protected by copyright. To ensure wide dissemination of its information, FAO is committed to making its content freely available and encourages the use, reproduction and dissemination of the text, multimedia and data products presented. Except where otherwise indicated, content may be copied, printed and downloaded for private study, research and teaching purposes, or for use in non-commercial products or services, provided that appropriate acknowledgement of FAO as the source and copyright holder is given and that FAO's endorsement of users' views, products or services is not stated or implied in any way. FAO encourages unrestricted use of news releases provided on the FAO website, and no formal permission is required to reproduce these materials.

All requests for translation and adaptation rights, and for resale and other commercial use rights should be addressed to copyright@fao.org or submitted via the online Licence Request Form when downloading.

RECOMMENDED CITATION:

[© FAO] [Year of publication] [Title of content] [Page number (for publications)] [Location on FAO website] [Date accessed and/or downloaded]","Estimates of per capita food supplies available for human consumption during the reference period in terms of quantity, caloric value, protein and fat content. Calorie supplies are reported in kilocalories (1 calorie = 4.19 kilojoules). Per capita supplies in terms of product weight are derived from the total supplies available for human consumption (i.e. Food) by dividing the quantities of Food by the total population actually partaking of the food supplies during the reference period, i.e. the present in-area (de facto) population within the present geographical boundaries of the country. In other words, nationals living abroad during the reference period are excluded, but foreigners living in the country are included. Adjustments are made wherever possible for part-time presence or absence, such as temporary migrants, tourists and refugees supported by special schemes (if it has not been possible to allow for the amounts provided by such schemes under imports). In almost all cases, the population figures used are the mid-year estimates published by the United Nations Population Division. Per capita supply figures shown in the commodity balances therefore represent only the average supply available for the population as a whole and do not necessarily indicate what is actually consumed by individuals. Even if they are taken as approximation to per capita consumption, it is important to note that the amount of food actually consumed may be lower than the quantity shown here, depending on the degree of losses of edible food and nutrients in the household, e.g. during storage, in preparation and cooking etc. In many cases commodities are not consumed in the primary form in which they are presented in the commodity balance, e.g. cereals enter the household mainly in processed form like flour, meal, husked or milled rice. To take this fact into account, the caloric value, the protein and fat content shown against primary commodities in the commodity balances have been derived by applying the appropriate food composition factors to the quantities of the processed commodities and not by multiplying the quantities shown in the commodity balance with the food composition factors relating to primary commodities.",,,,,,,,,,,,,,,,,,,,,,,,,,,,,,,,,,,,,,,,3539.0,3556.0,3583.0,3573.0,3585.0,3610.0,3578.0,3627.0,3625.0,3662.0,3674.0,3670.0,3694.0,3675.0,3578.0,3558.0,3501.0,3484.0,3472.0,3540.0,3640.0,3584.0,3549.0,3532.0,3514.0,3495.0,3414.0,3407.0,3359.0,3393.0,3512.0,3603.0,3610.0,3504.0,3326.0,3388.0,3386.0,3477.0,3560.0,3481.0,3438.0,3454.0,3332.0,3287.0,3228.0,3150.0,3128.0,3075.0,3087.0,3020.0,2955.0,,,,,,,,,,,
PVH140,"Children under five mortality rate per 1,000 live births",mdgs,"Deaths per 1,000 live births","Children under five mortality rate per 1,000 live births",http://mdgs.un.org/unsd/mdg/Metadata.aspx?IndicatorId=0&SeriesId=561,"The United Nations maintains this web site (the “Site”) as a courtesy to those who may choose to access the Site (“Users”). The information presented herein is for informative purposes only. The United Nations grants permission to Users to visit the Site and to download and copy the information, documents and materials (collectively, “Materials”) from the Site for the User’s personal, non-commercial use, without any right to resell or redistribute them or to compile or create derivative works therefrom, subject to the terms and conditions outlined below, and also subject to more specific restrictions that may apply to specific Material within this Site.","The under-five mortality rate (U5MR) is the probability (expressed as a rate per 1,000 live births) of a child born in a specified year dying before reaching the age of five if subject to current age-specific mortality rates.

A live birth is the complete expulsion or extraction from its mother of a product of conception, irrespective of the duration of the pregnancy, which, after such separation, breathes or shows any other evidence of life—such as beating of the heart, pulsation of the umbilical cord, or definite movement of voluntary muscles—whether or not the umbilical cord has been cut or the placenta is attached. Each product of such a birth is considered a live birth.",,,,,,,,,,,,,,,,,,,,,,,,,,,,,,,,,,,,,,3.6,3.7,3.9,4.0,4.1,4.1,4.2,4.3,4.4,4.5,4.7,5.0,5.2,5.5,5.9,6.2,6.6,7.0,7.5,8.0,8.5,8.9,9.3,9.6,,,,,,,,,,,,,,,,,,,,,,,,,,,,,,,,,,,,,,,,
PCX100,Internet users ,world-bank,Internet users per 100 people,Internet users are people with access to the worldwide network.,http://data.worldbank.org/indicator/IT.NET.USER.P2,"You are free to copy, distribute, adapt, display or include the data in other products for commercial and noncommercial purposes at no cost subject to certain limitations summarized below.
You must include attribution for the data you use in the manner indicated in the metadata included with the data.
You must not claim or imply that The World Bank endorses your use of the data by or use The World Bank’s logo(s) or trademark(s) in conjunction with such use.
Other parties may have ownership interests in some of the materials contained on The World Bank Web site. For example, we maintain a list of some specific data within the Datasets that you may not redistribute or reuse without first contacting the original content provider, as well as information regarding how to contact the original content provider. Before incorporating any data in other products, please check the list: Terms of use: Restricted Data
The World Bank makes no warranties with respect to the data and you agree The World Bank shall not be liable to you in connection with your use of the data.
This is only a summary of the Terms of Use for Datasets Listed in The World Bank Data Catalogue. Please read the actual agreement that controls your use of the Datasets, which is available here: Terms of use for datasets. Also see World Bank Terms and Conditions.","The Internet is a world-wide public computer network. It provides access to a number of communication services including the World Wide Web and carries e-mail, news, entertainment and data files, irrespective of the device used (not assumed to be only via a computer - it may also be by mobile-cellular telephone, other wireless devices, games machine, digital TV etc.). Access can be via a fixed or mobile network.

Individuals using the Internet refers to those that used the Internet in the last 12 months from any location. As of 2013, the definition has been updated and the reference period is the last three months instead of 12. While some countries already used the narrower reference period in the past, most countries may still take some time to adhere to the new reference period. Data are based on surveys generally carried out by national statistical offices or estimated based on the number of Internet subscriptions.",,,,,,,,,,,,,,,,,,,,,,,,,,,,,,,,,,,,,,58.4593,55.829997993283,54.3899983018814,53.68,48.83,44.53,40.79,37.99,35.0,33.24,29.04,28.04,27.2221169788811,23.1108742441037,14.378410192862,4.5585195653676,2.27673783398868,1.02328990327724,0.524412787470198,0.192304619468143,0.122462052683735,0.0700534325551471,0.0350632556032967,0.017544562355015,,,,,,,,,,,,,,,,,,,,,,,,,,,,,,,,,,,,,,,,
